id,session_id,goal_id,subtask_id,approach,why_failed,created_timestamp,dead_end_data,subject
2a255d3c-b875-4971-956b-1d0740bb97db,e97f042f-11d7-4d75-bb9a-6e83225e282e,,,"Test approach","Just testing dual-scope",1767100981.54713,"{""approach"": ""Test approach"", ""why_failed"": ""Just testing dual-scope"", ""goal_id"": null, ""subtask_id"": null, ""impact"": 0.7, ""timestamp"": 1767100981.5471265}",
cdbdff97-9334-4e1a-9b24-112171d07621,4d427e83-2bea-473b-b790-7af8cc5dc48c,eaadd1bf-49c8-41e1-8f01-227950c2ef50,,"Tried using SELECT * in UNION","Column count mismatch",1767103799.85485,"{""approach"": ""Tried using SELECT * in UNION"", ""why_failed"": ""Column count mismatch"", ""goal_id"": ""eaadd1bf-49c8-41e1-8f01-227950c2ef50"", ""subtask_id"": null, ""impact"": 0.8, ""timestamp"": 1767103799.8548532}",
c235ada3-cae0-4a4a-a818-6064e517011b,19852c50-f417-49a4-a613-f88cf1f6c45c,97fda6e8-87b5-41dd-825f-737a582b420d,,"Looking for DB at ~/.empirica/ instead of project .empirica/sessions/","User's working directory is project root. Global ~/.empirica has empty placeholder DBs. Actual data lives in .empirica/sessions/sessions.db relative to project",1767195782.0542,"{""approach"": ""Looking for DB at ~/.empirica/ instead of project .empirica/sessions/"", ""why_failed"": ""User's working directory is project root. Global ~/.empirica has empty placeholder DBs. Actual data lives in .empirica/sessions/sessions.db relative to project"", ""goal_id"": ""97fda6e8-87b5-41dd-825f-737a582b420d"", ""subtask_id"": null, ""impact"": 0.5, ""timestamp"": 1767195782.0542004}",
4fea9f59-94dc-43e8-bfee-dc13345b5bb5,19852c50-f417-49a4-a613-f88cf1f6c45c,97fda6e8-87b5-41dd-825f-737a582b420d,,"Test deadend fix","Testing the bug fix",1767196333.74209,"{""approach"": ""Test deadend fix"", ""why_failed"": ""Testing the bug fix"", ""goal_id"": ""97fda6e8-87b5-41dd-825f-737a582b420d"", ""subtask_id"": null, ""impact"": 0.75, ""timestamp"": 1767196333.7420866}",
b891e2ff-fd8b-4505-8cc8-a679624c7fdd,ba9fef36-f8e9-4297-a787-38b1c9a19c99,,,"Ralph Wiggum integration","Investigation revealed Empirica already IS the autonomous loop mechanism (NOETIC-PRAXIC + epistemic gates). Ralph's Stop hook mechanism is orthogonal. Integrating Ralph would add complexity without value. Empirica's knowledge-driven loops superior to Ralph's mechanical iteration. Learning persistence + epistemic gates make Ralph redundant for Empirica use cases.",1767201894.09972,"{""approach"": ""Ralph Wiggum integration"", ""why_failed"": ""Investigation revealed Empirica already IS the autonomous loop mechanism (NOETIC-PRAXIC + epistemic gates). Ralph's Stop hook mechanism is orthogonal. Integrating Ralph would add complexity without value. Empirica's knowledge-driven loops superior to Ralph's mechanical iteration. Learning persistence + epistemic gates make Ralph redundant for Empirica use cases."", ""goal_id"": null, ""subtask_id"": null, ""impact"": 0.95, ""timestamp"": 1767201894.099721}",
bd7fc15b-f690-4d6d-b17f-3ca41f8529ce,306dcf72-d3e1-4fbc-82fe-dbe74b0fdba0,,,"Test approach","Test failure",1767202951.14658,"{""approach"": ""Test approach"", ""why_failed"": ""Test failure"", ""goal_id"": null, ""subtask_id"": null, ""impact"": 0.5, ""timestamp"": 1767202951.1465795}",
6c78edda-54da-4f63-b2b2-bcbebc531f21,c81d61b8-e6e2-44d7-b8eb-99d9d0bde37e,,,"Adding --persona flag to session-create and investigate-create-branch to prescribe personas upfront","Wrong direction. In high noetic phases, personas should emerge from exploration, not be prescribed. Prescribing would constrain the search space and miss potentially better configurations. The correct flow is: branch → explore → turtle → extract emerged persona from winner.",1767274755.12671,"{""approach"": ""Adding --persona flag to session-create and investigate-create-branch to prescribe personas upfront"", ""why_failed"": ""Wrong direction. In high noetic phases, personas should emerge from exploration, not be prescribed. Prescribing would constrain the search space and miss potentially better configurations. The correct flow is: branch \u2192 explore \u2192 turtle \u2192 extract emerged persona from winner."", ""goal_id"": null, ""subtask_id"": null, ""impact"": 0.65, ""timestamp"": 1767274755.1267126}",
9f9a60ca-584a-4d75-8704-9fd4bda876cc,6708a7e2-5b11-4d62-b89d-1e8342bb8697,,,"Looking for project-switch command in CLI","Command doesn't exist yet - PROJECT_SWITCHING_FOR_AIS.md is a design/proposal doc, not documentation of existing features",1767708592.04179,"{""approach"": ""Looking for project-switch command in CLI"", ""why_failed"": ""Command doesn't exist yet - PROJECT_SWITCHING_FOR_AIS.md is a design/proposal doc, not documentation of existing features"", ""goal_id"": null, ""subtask_id"": null, ""impact"": 0.3, ""timestamp"": 1767708592.0417874}",
65bc8070-4483-4413-a14d-be28bd6321e6,0eb24830-72ef-4090-8127-da1b83894570,,,"Looking for onboard command registration","Handler exists (onboard_handler.py) but not wired to CLI. Missing parser registration and command mapping.",1767709468.39242,"{""approach"": ""Looking for onboard command registration"", ""why_failed"": ""Handler exists (onboard_handler.py) but not wired to CLI. Missing parser registration and command mapping."", ""goal_id"": null, ""subtask_id"": null, ""impact"": 0.4, ""timestamp"": 1767709468.3924186}",
