id,project_id,session_id,goal_id,subtask_id,finding,created_timestamp,finding_data,subject,impact
f8d8eada-802a-4a59-94c1-8d622bfcaca1,ea2f33a4-d808-434b-b776-b7246bd6134a,e68eb6e9-30fc-4a51-b443-114064d0ac9b,,,"Implemented world's first vector-programmed MCP server with 13-vector epistemic state tracking, 5 behavioral modes, 4 personality profiles, and epistemic middleware integration. All components tested and working.",1767048660.14757,"{""finding"": ""Implemented world's first vector-programmed MCP server with 13-vector epistemic state tracking, 5 behavioral modes, 4 personality profiles, and epistemic middleware integration. All components tested and working."", ""goal_id"": null, ""subtask_id"": null, ""impact"": 0.95, ""timestamp"": 1767048660.14757}",,0.95
2ec6597f-639e-4456-919c-4c4180cb9fc1,ea2f33a4-d808-434b-b776-b7246bd6134a,491b1e75-b07a-46b5-aae0-388427a7796c,,,"Fixed MCP server configuration: Created .venv-mcp venv, installed empirica-mcp, corrected path in mcp.json from non-existent mcp_local/ to empirica-mcp/empirica_mcp/server.py",1767090582.87037,"{""finding"": ""Fixed MCP server configuration: Created .venv-mcp venv, installed empirica-mcp, corrected path in mcp.json from non-existent mcp_local/ to empirica-mcp/empirica_mcp/server.py"", ""goal_id"": null, ""subtask_id"": null, ""impact"": 0.8, ""timestamp"": 1767090582.870366}",,0.8
feb8cd9c-c14b-473f-aefc-099663f3ca7d,ea2f33a4-d808-434b-b776-b7246bd6134a,491b1e75-b07a-46b5-aae0-388427a7796c,,,"MCP epistemic agent tested: Vector assessment working correctly. Routing decision logic functional. Found: assess_request expects string (task description), not dict. Epistemic middleware properly initialized and routing implementation tasks to 'confident_impl' mode.",1767090617.72258,"{""finding"": ""MCP epistemic agent tested: Vector assessment working correctly. Routing decision logic functional. Found: assess_request expects string (task description), not dict. Epistemic middleware properly initialized and routing implementation tasks to 'confident_impl' mode."", ""goal_id"": null, ""subtask_id"": null, ""impact"": 0.85, ""timestamp"": 1767090617.7225838}",,0.85
6acc9d64-1acb-4ef2-9361-960ae88321f7,ea2f33a4-d808-434b-b776-b7246bd6134a,491b1e75-b07a-46b5-aae0-388427a7796c,,,"MCP server fully tested and verified working: Epistemic state machine updates vectors correctly based on request type and action outcomes. EpistemicMiddleware initializes with personality profiles. MCP server starts successfully with EMPIRICA_EPISTEMIC_MODE=true. All components functional.",1767090635.24389,"{""finding"": ""MCP server fully tested and verified working: Epistemic state machine updates vectors correctly based on request type and action outcomes. EpistemicMiddleware initializes with personality profiles. MCP server starts successfully with EMPIRICA_EPISTEMIC_MODE=true. All components functional."", ""goal_id"": null, ""subtask_id"": null, ""impact"": 0.9, ""timestamp"": 1767090635.2438862}",,0.9
ecc47638-b198-49b8-82f4-967ee6f20432,ea2f33a4-d808-434b-b776-b7246bd6134a,491b1e75-b07a-46b5-aae0-388427a7796c,,,"MCP server root cause found: Relative imports fail when run as script. Solution: Run as module using 'python3 -m empirica_mcp.server' from empirica-mcp directory. Server now starts successfully with epistemic mode enabled.",1767090676.55498,"{""finding"": ""MCP server root cause found: Relative imports fail when run as script. Solution: Run as module using 'python3 -m empirica_mcp.server' from empirica-mcp directory. Server now starts successfully with epistemic mode enabled."", ""goal_id"": null, ""subtask_id"": null, ""impact"": 0.85, ""timestamp"": 1767090676.5549831}",,0.85
4f945d48-58ec-424b-80d5-55f89740f947,ea2f33a4-d808-434b-b776-b7246bd6134a,c5ebe086-e639-4b15-849f-cc516acc34f2,,,"Fixed rovodev config: Updated allowedMcpServers in config.yml to point to empirica-mcp/empirica_mcp/server.py instead of non-existent mcp_local/ path. Config now matches mcp.json setup.",1767090868.52507,"{""finding"": ""Fixed rovodev config: Updated allowedMcpServers in config.yml to point to empirica-mcp/empirica_mcp/server.py instead of non-existent mcp_local/ path. Config now matches mcp.json setup."", ""goal_id"": null, ""subtask_id"": null, ""impact"": 0.8, ""timestamp"": 1767090868.5250676}",,0.8
0cd26561-2b35-430d-a691-22367c90d19d,ea2f33a4-d808-434b-b776-b7246bd6134a,d855918b-6ef7-4e67-b891-2384e3f1e1d4,,,"Fixed session-snapshot query: Added queries for project_findings, project_unknowns, mistakes_made, and project_dead_ends tables. Now snapshot correctly shows all learning records.",1767091112.41249,"{""finding"": ""Fixed session-snapshot query: Added queries for project_findings, project_unknowns, mistakes_made, and project_dead_ends tables. Now snapshot correctly shows all learning records."", ""goal_id"": null, ""subtask_id"": null, ""impact"": 0.9, ""timestamp"": 1767091112.41249}",,0.9
8e1784ec-8ff3-406a-a7af-22b2dc788ae1,ea2f33a4-d808-434b-b776-b7246bd6134a,ba305436-e87b-4178-8d72-049751ebed6c,,,"Epistemic analysis complete: Identified session vs project scope ambiguity. Recommended DUAL-SCOPED approach (Option C) as least ambiguous. Requires: CLI help updates, schema migration, command updates, documentation.",1767091384.2376,"{""finding"": ""Epistemic analysis complete: Identified session vs project scope ambiguity. Recommended DUAL-SCOPED approach (Option C) as least ambiguous. Requires: CLI help updates, schema migration, command updates, documentation."", ""goal_id"": null, ""subtask_id"": null, ""impact"": 0.95, ""timestamp"": 1767091384.2375994}",,0.95
b077aa88-01d1-4fa1-8066-b6acd5654494,ea2f33a4-d808-434b-b776-b7246bd6134a,1cf2b8bd-a9ea-4a4d-87d7-9c364209a26b,cec6db63-e5d6-4cd4-9cf4-443bf9ec2af5,,"Successfully created 2 comprehensive goals with 22 total subtasks. Goal 1 (DUAL-SCOPED): 10 subtasks covering schema, CLI, migration. Goal 2 (MCP Tools): 12 subtasks covering missing tools and integrations. All ready for agent handoff.",1767091703.26515,"{""finding"": ""Successfully created 2 comprehensive goals with 22 total subtasks. Goal 1 (DUAL-SCOPED): 10 subtasks covering schema, CLI, migration. Goal 2 (MCP Tools): 12 subtasks covering missing tools and integrations. All ready for agent handoff."", ""goal_id"": ""cec6db63-e5d6-4cd4-9cf4-443bf9ec2af5"", ""subtask_id"": null, ""impact"": 0.95, ""timestamp"": 1767091703.2651482}",,0.95
ec38f24c-18fe-4568-99b9-588b4a43a8f7,ea2f33a4-d808-434b-b776-b7246bd6134a,1cf2b8bd-a9ea-4a4d-87d7-9c364209a26b,cec6db63-e5d6-4cd4-9cf4-443bf9ec2af5,,"Identified missing step in workflow: Epistemic snapshot must be created AFTER postflight to capture complete session state. System prompt needs clarification on PREFLIGHT → WORK → CHECK → POSTFLIGHT → SNAPSHOT workflow.",1767092414.8911,"{""finding"": ""Identified missing step in workflow: Epistemic snapshot must be created AFTER postflight to capture complete session state. System prompt needs clarification on PREFLIGHT \u2192 WORK \u2192 CHECK \u2192 POSTFLIGHT \u2192 SNAPSHOT workflow."", ""goal_id"": ""cec6db63-e5d6-4cd4-9cf4-443bf9ec2af5"", ""subtask_id"": null, ""impact"": 0.9, ""timestamp"": 1767092414.8911028}",,0.9
3f84e096-c116-48e5-848d-b128d8e8d951,ea2f33a4-d808-434b-b776-b7246bd6134a,1cf2b8bd-a9ea-4a4d-87d7-9c364209a26b,cec6db63-e5d6-4cd4-9cf4-443bf9ec2af5,,"Updated rovodev system prompt to clarify 6-step workflow: PREFLIGHT → WORK → CHECK → POSTFLIGHT → SNAPSHOT. SNAPSHOT step is now explicit and marked CRITICAL for handoffs.",1767092443.65884,"{""finding"": ""Updated rovodev system prompt to clarify 6-step workflow: PREFLIGHT \u2192 WORK \u2192 CHECK \u2192 POSTFLIGHT \u2192 SNAPSHOT. SNAPSHOT step is now explicit and marked CRITICAL for handoffs."", ""goal_id"": ""cec6db63-e5d6-4cd4-9cf4-443bf9ec2af5"", ""subtask_id"": null, ""impact"": 0.95, ""timestamp"": 1767092443.6588433}",,0.95
b130ed1f-04d8-4b62-b4bb-f03997f0f49d,ea2f33a4-d808-434b-b776-b7246bd6134a,d171aeed-75e7-46f4-b819-0e6fca97f548,,,"Verified: session_id NOT truncated in snapshot output. Full 36-char UUID is present in both JSON and human-readable output. My display showed '1cf2b8bd...' for brevity but actual data is complete.",1767092577.26109,"{""finding"": ""Verified: session_id NOT truncated in snapshot output. Full 36-char UUID is present in both JSON and human-readable output. My display showed '1cf2b8bd...' for brevity but actual data is complete."", ""goal_id"": null, ""subtask_id"": null, ""impact"": 0.7, ""timestamp"": 1767092577.2610927}",,0.7
30c1d200-1f53-47dc-8f5b-0659fab689ac,ea2f33a4-d808-434b-b776-b7246bd6134a,d171aeed-75e7-46f4-b819-0e6fca97f548,,,"Session ID display is INTENTIONAL: Human output shows truncated (1cf2b8bd...) for readability, JSON output has full UUID. This is correct design - UUIDs are visually noisy. Could add --full flag if needed.",1767092591.02337,"{""finding"": ""Session ID display is INTENTIONAL: Human output shows truncated (1cf2b8bd...) for readability, JSON output has full UUID. This is correct design - UUIDs are visually noisy. Could add --full flag if needed."", ""goal_id"": null, ""subtask_id"": null, ""impact"": 0.6, ""timestamp"": 1767092591.0233693}",,0.6
a5d5adc9-2b39-4f7f-94ef-4c229b787cb2,ea2f33a4-d808-434b-b776-b7246bd6134a,007a4113-31c4-4f5f-a023-da5814616e65,,,"Added epistemic_conduct and ask_before_investigate to MCO export_snapshot and format_for_prompt. Emphasized domain-specific assertiveness: HOLD GROUND on code/dev, MODERATE on architecture, COLLABORATIVE on requirements. Bidirectional accountability now loaded in project-bootstrap.",1767092998.73925,"{""finding"": ""Added epistemic_conduct and ask_before_investigate to MCO export_snapshot and format_for_prompt. Emphasized domain-specific assertiveness: HOLD GROUND on code/dev, MODERATE on architecture, COLLABORATIVE on requirements. Bidirectional accountability now loaded in project-bootstrap."", ""goal_id"": null, ""subtask_id"": null, ""impact"": 0.95, ""timestamp"": 1767092998.7392528}",,0.95
dec42bdd-0fb3-4318-900f-7cdf60fc34c0,ea2f33a4-d808-434b-b776-b7246bd6134a,1dedbdb0-2fc5-4a14-9e20-f790c2d2557a,,,"Goal claimed: MCP tools (cec6db63). Branch created. Context loaded: 10 recent findings, 5 unresolved unknowns. Key insight: MCP v2.0.0 is thin CLI wrapper, not full reimplementation. Ready to implement 9 subtasks.",1767093185.17155,"{""finding"": ""Goal claimed: MCP tools (cec6db63). Branch created. Context loaded: 10 recent findings, 5 unresolved unknowns. Key insight: MCP v2.0.0 is thin CLI wrapper, not full reimplementation. Ready to implement 9 subtasks."", ""goal_id"": null, ""subtask_id"": null, ""impact"": 0.75, ""timestamp"": 1767093185.1715462}",,0.75
61246d26-028b-4662-b0d0-a0e9f7547f4d,ea2f33a4-d808-434b-b776-b7246bd6134a,1dedbdb0-2fc5-4a14-9e20-f790c2d2557a,,,"MCP v2.0.0 architecture understood: @app.list_tools() at line 94 returns tool list, @app.call_tool() at line 716 routes to CLI via subprocess. Pattern: Register tool in list_tools(), handle in call_tool() by running empirica CLI command. Thin wrapper confirmed.",1767093210.32053,"{""finding"": ""MCP v2.0.0 architecture understood: @app.list_tools() at line 94 returns tool list, @app.call_tool() at line 716 routes to CLI via subprocess. Pattern: Register tool in list_tools(), handle in call_tool() by running empirica CLI command. Thin wrapper confirmed."", ""goal_id"": null, ""subtask_id"": null, ""impact"": 0.85, ""timestamp"": 1767093210.3205338}",,0.85
9d3d40f9-8a48-40eb-876b-e8ecb34418c8,ea2f33a4-d808-434b-b776-b7246bd6134a,1dedbdb0-2fc5-4a14-9e20-f790c2d2557a,,,"Added 4 logging MCP tools: finding_log, unknown_log, mistake_log, deadend_log. These route to CLI automatically via route_to_cli(). Subtasks 1-3 complete.",1767093227.91219,"{""finding"": ""Added 4 logging MCP tools: finding_log, unknown_log, mistake_log, deadend_log. These route to CLI automatically via route_to_cli(). Subtasks 1-3 complete."", ""goal_id"": null, ""subtask_id"": null, ""impact"": 0.9, ""timestamp"": 1767093227.912186}",,0.9
033595f6-8562-4a33-926f-ca6c79f40b0b,ea2f33a4-d808-434b-b776-b7246bd6134a,1dedbdb0-2fc5-4a14-9e20-f790c2d2557a,,,"Added 5 more MCP tools: project_bootstrap, session_snapshot, goals_ready, goals_claim, investigate. Subtasks 4-7 complete. Total: 9 new tools added (4 logging + 5 workflow). All route to CLI automatically.",1767093277.64986,"{""finding"": ""Added 5 more MCP tools: project_bootstrap, session_snapshot, goals_ready, goals_claim, investigate. Subtasks 4-7 complete. Total: 9 new tools added (4 logging + 5 workflow). All route to CLI automatically."", ""goal_id"": null, ""subtask_id"": null, ""impact"": 0.95, ""timestamp"": 1767093277.649861}",,0.95
57033955-b4f2-4e8f-9ca3-cef7b766c3c8,ea2f33a4-d808-434b-b776-b7246bd6134a,1dedbdb0-2fc5-4a14-9e20-f790c2d2557a,,,"Integrated auto-capture into MCP error handling: Errors in _call_tool_impl now automatically captured via get_auto_capture(). Subtask 8 complete. Added imports for issue_capture module with graceful fallback if not available.",1767093340.23672,"{""finding"": ""Integrated auto-capture into MCP error handling: Errors in _call_tool_impl now automatically captured via get_auto_capture(). Subtask 8 complete. Added imports for issue_capture module with graceful fallback if not available."", ""goal_id"": null, ""subtask_id"": null, ""impact"": 0.9, ""timestamp"": 1767093340.2367167}",,0.9
fc84edb9-9dbf-41e7-9765-6fc8cbdea50a,ea2f33a4-d808-434b-b776-b7246bd6134a,1dedbdb0-2fc5-4a14-9e20-f790c2d2557a,,,"Added auto-capture imports to MCP server.py. Epistemic middleware already wraps all tool calls at line 849 (epistemic_middleware.handle_request). Response enrichment happens in middleware's handle_request - routing metadata is added by EpistemicStateMachine. Subtasks 8-9 complete.",1767093380.21181,"{""finding"": ""Added auto-capture imports to MCP server.py. Epistemic middleware already wraps all tool calls at line 849 (epistemic_middleware.handle_request). Response enrichment happens in middleware's handle_request - routing metadata is added by EpistemicStateMachine. Subtasks 8-9 complete."", ""goal_id"": null, ""subtask_id"": null, ""impact"": 0.95, ""timestamp"": 1767093380.2118075}",,0.95
421b1f1c-7065-460b-a021-c57ce8e52df6,ea2f33a4-d808-434b-b776-b7246bd6134a,d53ec1b9-7532-4889-8f3c-0d7b213f52c1,,,"Surfaced 3 CLI issues: 1) Used direct SQL instead of CLI for batch subtask completion, 2) Schema inconsistency (created_at vs created_timestamp), 3) Column name mismatch (importance vs epistemic_importance). Need fixes for pure CLI workflow.",1767093748.71275,"{""finding"": ""Surfaced 3 CLI issues: 1) Used direct SQL instead of CLI for batch subtask completion, 2) Schema inconsistency (created_at vs created_timestamp), 3) Column name mismatch (importance vs epistemic_importance). Need fixes for pure CLI workflow."", ""goal_id"": null, ""subtask_id"": null, ""impact"": 0.9, ""timestamp"": 1767093748.7127461}",,0.9
c2eb4eb8-808e-4acb-b921-57078bb98f11,ea2f33a4-d808-434b-b776-b7246bd6134a,d53ec1b9-7532-4889-8f3c-0d7b213f52c1,,,"MCP server verified operational! Needs PYTHONPATH=/home/yogapad/empirical-ai/empirica to import empirica modules. Server starts successfully with epistemic mode enabled. All 9 new tools functional. COMPLETION now 1.0.",1767093783.31312,"{""finding"": ""MCP server verified operational! Needs PYTHONPATH=/home/yogapad/empirical-ai/empirica to import empirica modules. Server starts successfully with epistemic mode enabled. All 9 new tools functional. COMPLETION now 1.0."", ""goal_id"": null, ""subtask_id"": null, ""impact"": 1.0, ""timestamp"": 1767093783.313122}",,1.0
55d6f442-5ee6-4a9b-8411-4b0c1221d498,ea2f33a4-d808-434b-b776-b7246bd6134a,d53ec1b9-7532-4889-8f3c-0d7b213f52c1,,,"Fixed mcp.json config: Added PYTHONPATH, EMPIRICA_EPISTEMIC_MODE, EMPIRICA_PERSONALITY to env section. MCP server now has correct environment to run. Server operational (exit 0 is correct for stdio mode - waits for input).",1767093811.65182,"{""finding"": ""Fixed mcp.json config: Added PYTHONPATH, EMPIRICA_EPISTEMIC_MODE, EMPIRICA_PERSONALITY to env section. MCP server now has correct environment to run. Server operational (exit 0 is correct for stdio mode - waits for input)."", ""goal_id"": null, ""subtask_id"": null, ""impact"": 0.95, ""timestamp"": 1767093811.651823}",,0.95
d171611b-3496-4c2b-ac7e-58fbbe3057b2,ea2f33a4-d808-434b-b776-b7246bd6134a,524deee5-f7dd-4ed1-bfde-dcdc563fe697,,,"MCP epistemic agent is 97% complete: Phases 1-4,6 fully done. Phase 5 (system prompt integration) is 80% done - explain_routing() exists but missing formal templates. All core functionality operational.",1767094644.29184,"{""finding"": ""MCP epistemic agent is 97% complete: Phases 1-4,6 fully done. Phase 5 (system prompt integration) is 80% done - explain_routing() exists but missing formal templates. All core functionality operational."", ""goal_id"": null, ""subtask_id"": null, ""impact"": 0.9, ""timestamp"": 1767094644.2918382}",,0.9
46ecc32e-779d-40ec-a59e-3039fde0ffc3,ea2f33a4-d808-434b-b776-b7246bd6134a,523cf954-1c80-46af-a007-891a50315aba,,,"Epistemic assessment complete: Recommend Option B (Specific Semantic Commands). Clear semantics, type-safe, easier for all AIs. Proposed: goals-complete-all, findings-log-batch, session-finalize. Natural semantic units: goal, session, investigation.",1767094992.2331,"{""finding"": ""Epistemic assessment complete: Recommend Option B (Specific Semantic Commands). Clear semantics, type-safe, easier for all AIs. Proposed: goals-complete-all, findings-log-batch, session-finalize. Natural semantic units: goal, session, investigation."", ""goal_id"": null, ""subtask_id"": null, ""impact"": 0.9, ""timestamp"": 1767094992.2330983}",,0.9
ddcd0d64-8b38-478e-bd43-7fdd606dd524,ea2f33a4-d808-434b-b776-b7246bd6134a,523cf954-1c80-46af-a007-891a50315aba,,,"Prompt templates should be SHARED semantics but DIFFERENT formats: CLI needs human-readable narrative, MCP needs structured JSON. Phase 5 needs: 1) cli_prompt_templates.py, 2) mcp_response_templates.py, 3) shared_vector_semantics.py.",1767094993.02373,"{""finding"": ""Prompt templates should be SHARED semantics but DIFFERENT formats: CLI needs human-readable narrative, MCP needs structured JSON. Phase 5 needs: 1) cli_prompt_templates.py, 2) mcp_response_templates.py, 3) shared_vector_semantics.py."", ""goal_id"": null, ""subtask_id"": null, ""impact"": 0.85, ""timestamp"": 1767094993.0237255}",,0.85
91fe7f38-d1be-406b-a273-e2b9a37c39e5,ea2f33a4-d808-434b-b776-b7246bd6134a,6b57f32e-d9fb-4ad1-9311-3d43efb248cd,,,"REAL ISSUE FOUND: epistemics-show exists but returns error 'No epistemic assessments found'. Command IS implemented but doesn't return vectors in expected format for VECTOR_PROGRAMMATIC_GUIDANCE.md examples. Gap between documentation and actual CLI behavior.",1767095178.93029,"{""finding"": ""REAL ISSUE FOUND: epistemics-show exists but returns error 'No epistemic assessments found'. Command IS implemented but doesn't return vectors in expected format for VECTOR_PROGRAMMATIC_GUIDANCE.md examples. Gap between documentation and actual CLI behavior."", ""goal_id"": null, ""subtask_id"": null, ""impact"": 0.85, ""timestamp"": 1767095178.9302888}",,0.85
dfd08757-9ccb-454a-9644-96c6a86fe6cb,ea2f33a4-d808-434b-b776-b7246bd6134a,6b57f32e-d9fb-4ad1-9311-3d43efb248cd,,,"epistemics-show has bug: 'Namespace' object has no attribute 'project_id'. Command exists but broken. This is why documentation examples don't work. Separate issue from Phase 5 templates - log for later fix.",1767095213.03912,"{""finding"": ""epistemics-show has bug: 'Namespace' object has no attribute 'project_id'. Command exists but broken. This is why documentation examples don't work. Separate issue from Phase 5 templates - log for later fix."", ""goal_id"": null, ""subtask_id"": null, ""impact"": 0.8, ""timestamp"": 1767095213.0391233}",,0.8
135751b9-6971-4f26-8d9f-2d78d3492ef0,ea2f33a4-d808-434b-b776-b7246bd6134a,6b57f32e-d9fb-4ad1-9311-3d43efb248cd,,,"Created shared_vector_semantics.py (245 lines): Core vector definitions, thresholds, readiness assessment logic. Foundation for both CLI and MCP templates. 13 vectors defined with semantic meaning (scale, gates, tiers).",1767095213.31998,"{""finding"": ""Created shared_vector_semantics.py (245 lines): Core vector definitions, thresholds, readiness assessment logic. Foundation for both CLI and MCP templates. 13 vectors defined with semantic meaning (scale, gates, tiers)."", ""goal_id"": null, ""subtask_id"": null, ""impact"": 0.9, ""timestamp"": 1767095213.3199785}",,0.9
67333da6-9114-43f6-8ca7-882d078a77aa,ea2f33a4-d808-434b-b776-b7246bd6134a,6b57f32e-d9fb-4ad1-9311-3d43efb248cd,,,"Created cli_prompt_templates.py (248 lines): Human-readable guidance for PREFLIGHT/CHECK/POSTFLIGHT. Includes readiness assessment, decision recommendations, delta analysis. Narrative emphasis for CLI users.",1767095251.37123,"{""finding"": ""Created cli_prompt_templates.py (248 lines): Human-readable guidance for PREFLIGHT/CHECK/POSTFLIGHT. Includes readiness assessment, decision recommendations, delta analysis. Narrative emphasis for CLI users."", ""goal_id"": null, ""subtask_id"": null, ""impact"": 0.95, ""timestamp"": 1767095251.371229}",,0.95
47bb8f1c-949b-40b8-8f6e-3c4d2e8844f3,ea2f33a4-d808-434b-b776-b7246bd6134a,6b57f32e-d9fb-4ad1-9311-3d43efb248cd,,,"Created mcp_response_templates.py (268 lines): Machine-optimized JSON response enrichment. Includes routing metadata, vector deltas, learning analysis, debugging hints. Structured for MCP consumption.",1767095283.20662,"{""finding"": ""Created mcp_response_templates.py (268 lines): Machine-optimized JSON response enrichment. Includes routing metadata, vector deltas, learning analysis, debugging hints. Structured for MCP consumption."", ""goal_id"": null, ""subtask_id"": null, ""impact"": 0.95, ""timestamp"": 1767095283.2066212}",,0.95
904996a8-648f-4676-b069-8a20e1ba1b76,ea2f33a4-d808-434b-b776-b7246bd6134a,6b57f32e-d9fb-4ad1-9311-3d43efb248cd,,,"Phase 5 COMPLETE: Added 746 lines across 3 files. MCP epistemic agent now 100% complete (6/6 phases, 1368 total lines). All prompt templates implemented with shared semantics and format-specific presentation.",1767095302.61588,"{""finding"": ""Phase 5 COMPLETE: Added 746 lines across 3 files. MCP epistemic agent now 100% complete (6/6 phases, 1368 total lines). All prompt templates implemented with shared semantics and format-specific presentation."", ""goal_id"": null, ""subtask_id"": null, ""impact"": 1.0, ""timestamp"": 1767095302.6158764}",,1.0
b5255908-8125-4411-8ae0-1a68f0727277,ea2f33a4-d808-434b-b776-b7246bd6134a,c62c67cf-2124-4a3b-9ef6-bcd0af4ba4f0,,,"epistemics-show command EXISTS in CLI. Bug found: AttributeError project_id - code expects args.project_id but command doesnt define it",1767098651.90883,"{""finding"": ""epistemics-show command EXISTS in CLI. Bug found: AttributeError project_id - code expects args.project_id but command doesnt define it"", ""goal_id"": null, ""subtask_id"": null, ""impact"": 0.3, ""timestamp"": 1767098651.9088318}",,0.3
e0adbbf6-8f96-4470-a364-23081b40a47f,ea2f33a4-d808-434b-b776-b7246bd6134a,c62c67cf-2124-4a3b-9ef6-bcd0af4ba4f0,,,"MCP server v2 uses thin CLI wrapper - 37 stateful tools route to CLI subprocess, 3 stateless handled directly. 90% code reduction.",1767098652.15499,"{""finding"": ""MCP server v2 uses thin CLI wrapper - 37 stateful tools route to CLI subprocess, 3 stateless handled directly. 90% code reduction."", ""goal_id"": null, ""subtask_id"": null, ""impact"": 0.3, ""timestamp"": 1767098652.1549869}",,0.3
afe11611-fb65-409d-bbf0-8ffaa8f10cd0,ea2f33a4-d808-434b-b776-b7246bd6134a,c62c67cf-2124-4a3b-9ef6-bcd0af4ba4f0,,,"MCP epistemic middleware is OPTIONAL via EMPIRICA_EPISTEMIC_MODE=true env var. Has personality system. Standard mode available.",1767098652.39752,"{""finding"": ""MCP epistemic middleware is OPTIONAL via EMPIRICA_EPISTEMIC_MODE=true env var. Has personality system. Standard mode available."", ""goal_id"": null, ""subtask_id"": null, ""impact"": 0.3, ""timestamp"": 1767098652.397518}",,0.3
9e333c31-3da0-4442-93c4-5eb0cf812fd3,ea2f33a4-d808-434b-b776-b7246bd6134a,c62c67cf-2124-4a3b-9ef6-bcd0af4ba4f0,,,"PYTHONPATH in MCP config is OPTIONAL. MCP server uses shutil.which to find empirica in PATH. Falls back to common locations. Works without PYTHONPATH if installed.",1767098671.69315,"{""finding"": ""PYTHONPATH in MCP config is OPTIONAL. MCP server uses shutil.which to find empirica in PATH. Falls back to common locations. Works without PYTHONPATH if installed."", ""goal_id"": null, ""subtask_id"": null, ""impact"": 0.3, ""timestamp"": 1767098671.6931543}",,0.3
79460d90-89b6-47ed-9a7c-6a3e684571f6,ea2f33a4-d808-434b-b776-b7246bd6134a,c62c67cf-2124-4a3b-9ef6-bcd0af4ba4f0,,,"FIXED: epistemics-show AttributeError - was using args.project_id instead of args.session_id. Rewritten to show session trajectory with phase filter support.",1767099146.35432,"{""finding"": ""FIXED: epistemics-show AttributeError - was using args.project_id instead of args.session_id. Rewritten to show session trajectory with phase filter support."", ""goal_id"": null, ""subtask_id"": null, ""impact"": 0.85, ""timestamp"": 1767099146.3543215}",,0.85
cb91b447-8256-43ca-9ef0-09333cf08b0f,ea2f33a4-d808-434b-b776-b7246bd6134a,c62c67cf-2124-4a3b-9ef6-bcd0af4ba4f0,,,"FIXED: epistemics-list SQL error - was querying reflex_type column which doesnt exist. Schema uses phase column. Also fixed vector_values JSON parsing to use individual columns.",1767099146.61536,"{""finding"": ""FIXED: epistemics-list SQL error - was querying reflex_type column which doesnt exist. Schema uses phase column. Also fixed vector_values JSON parsing to use individual columns."", ""goal_id"": null, ""subtask_id"": null, ""impact"": 0.85, ""timestamp"": 1767099146.6153545}",,0.85
