id,project_id,session_id,goal_id,subtask_id,finding,created_timestamp,finding_data,subject,impact
3990aa17-8284-4cbb-bab2-1102646909c1,ea2f33a4-d808-434b-b776-b7246bd6134a,c81d61b8-e6e2-44d7-b8eb-99d9d0bde37e,,,"Persona emergence vs prescription: In high noetic phases, personas should EMERGE from parallel branch exploration, not be prescribed. Flow: branch → diverge → turtle each → extract persona from winner → store. Non-winners become deadends/unknowns. This captures validated configurations rather than assumed ones.",1767274744.61738,"{""finding"": ""Persona emergence vs prescription: In high noetic phases, personas should EMERGE from parallel branch exploration, not be prescribed. Flow: branch \u2192 diverge \u2192 turtle each \u2192 extract persona from winner \u2192 store. Non-winners become deadends/unknowns. This captures validated configurations rather than assumed ones."", ""goal_id"": null, ""subtask_id"": null, ""impact"": 0.85, ""timestamp"": 1767274744.6173759}",,0.85
336a93e9-8dc1-4ffe-a85e-e21ca3f7cf20,ea2f33a4-d808-434b-b776-b7246bd6134a,c81d61b8-e6e2-44d7-b8eb-99d9d0bde37e,,,"Branch merge scoring already implemented: BranchRepository.merge_branches calculates score = (learning_delta × quality × confidence) / cost. Winner selection + decision recording exists. Missing: turtle stack integration, persona extraction, non-winner tagging, persona storage.",1767274806.04055,"{""finding"": ""Branch merge scoring already implemented: BranchRepository.merge_branches calculates score = (learning_delta \u00d7 quality \u00d7 confidence) / cost. Winner selection + decision recording exists. Missing: turtle stack integration, persona extraction, non-winner tagging, persona storage."", ""goal_id"": null, ""subtask_id"": null, ""impact"": 0.7, ""timestamp"": 1767274806.040546}",,0.7
7ce1a608-24ee-4eb7-8e1d-fe01b5f54ba0,ea2f33a4-d808-434b-b776-b7246bd6134a,c81d61b8-e6e2-44d7-b8eb-99d9d0bde37e,,,"Persona duality: NOETIC = emergent (parallel branches → turtle → capture winner), PRAXIC = selected (sentinel picks best-fit from pool via --turtle). Stochastic generation vs deterministic application. Clean architectural split aligned with phase entropy.",1767274860.98747,"{""finding"": ""Persona duality: NOETIC = emergent (parallel branches \u2192 turtle \u2192 capture winner), PRAXIC = selected (sentinel picks best-fit from pool via --turtle). Stochastic generation vs deterministic application. Clean architectural split aligned with phase entropy."", ""goal_id"": null, ""subtask_id"": null, ""impact"": 0.9, ""timestamp"": 1767274860.987472}",,0.9
ff88a4e5-e8fe-4e6a-a238-569f26ad69cc,ea2f33a4-d808-434b-b776-b7246bd6134a,34397bf5-b761-4b85-b09d-be5ba7971265,,,"PRAXIC Issue 3 RESOLVED: Fixed config.yml Unicode encoding. Root cause: Unicode special characters (→, ≥, ≤, ✅) in config.yml were preventing find_and_replace_code from matching strings. Fix: Normalized all 9 Unicode characters to ASCII equivalents (→->, ≥->=, ≤-<=, ✅->[OK], etc.). Verification: Test string search now works. Impact: MEDIUM - unblocks system prompt updates and config modifications. File location: /home/yogapad/.rovodev/config.yml",1767276211.51813,"{""finding"": ""PRAXIC Issue 3 RESOLVED: Fixed config.yml Unicode encoding. Root cause: Unicode special characters (\u2192, \u2265, \u2264, \u2705) in config.yml were preventing find_and_replace_code from matching strings. Fix: Normalized all 9 Unicode characters to ASCII equivalents (\u2192->, \u2265->=, \u2264-<=, \u2705->[OK], etc.). Verification: Test string search now works. Impact: MEDIUM - unblocks system prompt updates and config modifications. File location: /home/yogapad/.rovodev/config.yml"", ""goal_id"": null, ""subtask_id"": null, ""impact"": 0.8, ""timestamp"": 1767276211.5181284}",,0.8
8b1bb88a-9e3b-478a-927a-9c3f6bacaac1,ea2f33a4-d808-434b-b776-b7246bd6134a,c81d61b8-e6e2-44d7-b8eb-99d9d0bde37e,df914c26-514e-4b56-8cdc-c757100cde19,,"Fixed handoff-query to scan git notes: GitHandoffStorage.list_handoffs() now uses git for-each-ref to scan refs/notes/empirica/handoff/*. HybridHandoffStorage.query_handoffs() merges git notes not in database. Enables cross-repo portability - cloned repos with handoffs now queryable.",1767276526.53756,"{""finding"": ""Fixed handoff-query to scan git notes: GitHandoffStorage.list_handoffs() now uses git for-each-ref to scan refs/notes/empirica/handoff/*. HybridHandoffStorage.query_handoffs() merges git notes not in database. Enables cross-repo portability - cloned repos with handoffs now queryable."", ""goal_id"": ""df914c26-514e-4b56-8cdc-c757100cde19"", ""subtask_id"": null, ""impact"": 0.65, ""timestamp"": 1767276526.5375628}",,0.65
b929f514-be76-4e93-8bdd-2087b4dfc759,ea2f33a4-d808-434b-b776-b7246bd6134a,34397bf5-b761-4b85-b09d-be5ba7971265,,,"UNIT TEST ASSESSMENT COMPLETE: 119/142 tests passing (83.8%), 23 skipped, 1 failed. Test Status Breakdown: (1) 21 skipped - canonical/reflex tests (marked as skip by design), (2) 1 skipped - chat test (UI-only), (3) 1 FAILED: test_signature_determinism - signature hashes differ between runs (determinism issue in signing_persona), (4) 119 PASSED - all critical paths working. Root cause of failure: Non-deterministic signature generation in test_signature_determinism. Ready to fix.",1767276735.95248,"{""finding"": ""UNIT TEST ASSESSMENT COMPLETE: 119/142 tests passing (83.8%), 23 skipped, 1 failed. Test Status Breakdown: (1) 21 skipped - canonical/reflex tests (marked as skip by design), (2) 1 skipped - chat test (UI-only), (3) 1 FAILED: test_signature_determinism - signature hashes differ between runs (determinism issue in signing_persona), (4) 119 PASSED - all critical paths working. Root cause of failure: Non-deterministic signature generation in test_signature_determinism. Ready to fix."", ""goal_id"": null, ""subtask_id"": null, ""impact"": 0.9, ""timestamp"": 1767276735.9524817}",,0.9
695af62d-3995-46d5-9da6-13c4cd69d607,ea2f33a4-d808-434b-b776-b7246bd6134a,34397bf5-b761-4b85-b09d-be5ba7971265,,,"UNIT TEST FIX COMPLETE: Fixed test_signature_determinism (only failing test). Root cause: timestamp in canonical state was non-deterministic, causing Ed25519 signatures to differ despite same input. Solution: Added optional timestamp parameter to allow tests to use fixed values. Result: 120/120 unit tests passing (100%), 23 skipped (by design). All TIER 2 and PRAXIC work verified working correctly via unit tests.",1767277189.0271,"{""finding"": ""UNIT TEST FIX COMPLETE: Fixed test_signature_determinism (only failing test). Root cause: timestamp in canonical state was non-deterministic, causing Ed25519 signatures to differ despite same input. Solution: Added optional timestamp parameter to allow tests to use fixed values. Result: 120/120 unit tests passing (100%), 23 skipped (by design). All TIER 2 and PRAXIC work verified working correctly via unit tests."", ""goal_id"": null, ""subtask_id"": null, ""impact"": 1.0, ""timestamp"": 1767277189.0270977}",,1.0
b1f1ed44-e80a-4528-94f1-4c54abef9ce4,ea2f33a4-d808-434b-b776-b7246bd6134a,c81d61b8-e6e2-44d7-b8eb-99d9d0bde37e,df914c26-514e-4b56-8cdc-c757100cde19,,"Unified query command complete: empirica query <type> --scope flag provides consistent access to findings/unknowns/deadends/mistakes/issues/handoffs/goals with session/project/global scoping",1767277253.45234,"{""finding"": ""Unified query command complete: empirica query <type> --scope flag provides consistent access to findings/unknowns/deadends/mistakes/issues/handoffs/goals with session/project/global scoping"", ""goal_id"": ""df914c26-514e-4b56-8cdc-c757100cde19"", ""subtask_id"": null, ""impact"": 0.7, ""timestamp"": 1767277253.4523358}",,0.7
893ccd20-2dc1-4ef6-9f16-6a0796d50e39,ea2f33a4-d808-434b-b776-b7246bd6134a,c81d61b8-e6e2-44d7-b8eb-99d9d0bde37e,df914c26-514e-4b56-8cdc-c757100cde19,,"Fixed project-bootstrap JSON error output: Errors now respect --output json flag, returning parseable JSON with ok=false instead of human-readable text. This enables reliable piping to JSON parsers in CI/scripts.",1767277630.64228,"{""finding"": ""Fixed project-bootstrap JSON error output: Errors now respect --output json flag, returning parseable JSON with ok=false instead of human-readable text. This enables reliable piping to JSON parsers in CI/scripts."", ""goal_id"": ""df914c26-514e-4b56-8cdc-c757100cde19"", ""subtask_id"": null, ""impact"": 0.6, ""timestamp"": 1767277630.6422834}",,0.6
5358400f-3cc3-4966-af6d-36ae0756eced,ea2f33a4-d808-434b-b776-b7246bd6134a,b508ae53-41b1-4462-aea1-4feeefc60dd0,,,"RESOLUTION: handoff-query git notes scanning - Use HybridHandoffStorage to check both DB and git notes. Implementation: Extend query_handoffs() to fallback to git notes when DB search incomplete. Status: Ready for implementation.",1767278059.70797,"{""finding"": ""RESOLUTION: handoff-query git notes scanning - Use HybridHandoffStorage to check both DB and git notes. Implementation: Extend query_handoffs() to fallback to git notes when DB search incomplete. Status: Ready for implementation."", ""goal_id"": null, ""subtask_id"": null, ""impact"": 0.8, ""timestamp"": 1767278059.707973}",,0.8
64a7b2cc-3d88-4fa2-84ce-4d39b4f5ae9c,ea2f33a4-d808-434b-b776-b7246bd6134a,b508ae53-41b1-4462-aea1-4feeefc60dd0,,,"RESOLUTION: Persona storage - Store emerged personas in Qdrant (per-project collection 'personas_{project_id}'). Orchestration: Use existing decision_logic.py for persona selection. Gap fix: Add --persona flag to investigate-create-branch. PREFLIGHT seeding: Load persona.epistemic_config.priors into CHECK baseline.",1767278060.80532,"{""finding"": ""RESOLUTION: Persona storage - Store emerged personas in Qdrant (per-project collection 'personas_{project_id}'). Orchestration: Use existing decision_logic.py for persona selection. Gap fix: Add --persona flag to investigate-create-branch. PREFLIGHT seeding: Load persona.epistemic_config.priors into CHECK baseline."", ""goal_id"": null, ""subtask_id"": null, ""impact"": 0.95, ""timestamp"": 1767278060.80532}",,0.95
6c5d7cf6-dec0-4d7a-a075-524b3650bcbb,ea2f33a4-d808-434b-b776-b7246bd6134a,b508ae53-41b1-4462-aea1-4feeefc60dd0,,,"RESOLUTION: CHECK phase hooks - ADD check-drift --trigger pre_check BEFORE compact, --trigger post_check AFTER. Empty DBs - REMOVE ~/.empirica/empirica.db (empty file). Semantic search error - FIXED (project-search JSON parse issue resolved).",1767278061.90022,"{""finding"": ""RESOLUTION: CHECK phase hooks - ADD check-drift --trigger pre_check BEFORE compact, --trigger post_check AFTER. Empty DBs - REMOVE ~/.empirica/empirica.db (empty file). Semantic search error - FIXED (project-search JSON parse issue resolved)."", ""goal_id"": null, ""subtask_id"": null, ""impact"": 0.9, ""timestamp"": 1767278061.9002194}",,0.9
c013339b-07af-4c4a-bcec-578831bbd4f0,ea2f33a4-d808-434b-b776-b7246bd6134a,b508ae53-41b1-4462-aea1-4feeefc60dd0,,,"RESOLUTION: Bayesian beliefs - Wire log_bayesian_belief() calls into epistemic_middleware.py. Call on every CHECK phase. Calibration thresholds - Define: HALT >=0.90, BRANCH <=0.50, LOCK 0.85, REVISE 0.60. EVS architecture - Use MCP tools (primary) + CLI fallback.",1767278062.9976,"{""finding"": ""RESOLUTION: Bayesian beliefs - Wire log_bayesian_belief() calls into epistemic_middleware.py. Call on every CHECK phase. Calibration thresholds - Define: HALT >=0.90, BRANCH <=0.50, LOCK 0.85, REVISE 0.60. EVS architecture - Use MCP tools (primary) + CLI fallback."", ""goal_id"": null, ""subtask_id"": null, ""impact"": 0.85, ""timestamp"": 1767278062.9976013}",,0.85
81a2e826-1105-49ee-81c5-94d3a207cd4d,ea2f33a4-d808-434b-b776-b7246bd6134a,c81d61b8-e6e2-44d7-b8eb-99d9d0bde37e,df914c26-514e-4b56-8cdc-c757100cde19,,"CLAUDE.md updated: Added unknown resolution pattern conventions (Design/Fixed/Tracked/Obsolete) and new query command. Clarifies that resolving unknown = question answered, not implementation done.",1767279434.2541,"{""finding"": ""CLAUDE.md updated: Added unknown resolution pattern conventions (Design/Fixed/Tracked/Obsolete) and new query command. Clarifies that resolving unknown = question answered, not implementation done."", ""goal_id"": ""df914c26-514e-4b56-8cdc-c757100cde19"", ""subtask_id"": null, ""impact"": 0.6, ""timestamp"": 1767279434.254096}",,0.6
db916876-976b-48dc-9f45-b84522822299,ea2f33a4-d808-434b-b776-b7246bd6134a,24e0fd9a-cdeb-4128-8a22-33522e044ea7,,,"System prompt versioning complete: Created CANONICAL_CORE.md (128 lines), sync_system_prompts.py generates AI variants from core + model deltas. Archived 1720-line monster. Install script updated to v2.0.",1767280342.92147,"{""finding"": ""System prompt versioning complete: Created CANONICAL_CORE.md (128 lines), sync_system_prompts.py generates AI variants from core + model deltas. Archived 1720-line monster. Install script updated to v2.0."", ""goal_id"": null, ""subtask_id"": null, ""impact"": 0.8, ""timestamp"": 1767280342.921474}",,0.8
0a08f223-a5df-4c2d-989c-ea4a8666f028,ea2f33a4-d808-434b-b776-b7246bd6134a,24e0fd9a-cdeb-4128-8a22-33522e044ea7,,,"System prompt architecture: CANONICAL_CORE.md (128 lines) + model_deltas/ + sync_system_prompts.py enables maintainable multi-AI prompt management. All variants now at v1.1.5.",1767280655.60799,"{""finding"": ""System prompt architecture: CANONICAL_CORE.md (128 lines) + model_deltas/ + sync_system_prompts.py enables maintainable multi-AI prompt management. All variants now at v1.1.5."", ""goal_id"": null, ""subtask_id"": null, ""impact"": 0.8, ""timestamp"": 1767280655.6079886}",,0.8
89f6d584-31df-4c95-8072-2fd2f2a9acfd,ea2f33a4-d808-434b-b776-b7246bd6134a,f4d80e69-2c4d-4746-8744-4cb204e4dc50,9030d380-6089-47c8-90c3-5abb4b9f8b86,,"Documentation staleness audit: docs/README.md (v1.1.0), docs/system-prompts/README.md (v4.0) both stale. System prompts README doesn't know about CANONICAL_CORE + model_deltas architecture. Multiple broken links to non-existent files.",1767281061.51071,"{""finding"": ""Documentation staleness audit: docs/README.md (v1.1.0), docs/system-prompts/README.md (v4.0) both stale. System prompts README doesn't know about CANONICAL_CORE + model_deltas architecture. Multiple broken links to non-existent files."", ""goal_id"": ""9030d380-6089-47c8-90c3-5abb4b9f8b86"", ""subtask_id"": null, ""impact"": 0.7, ""timestamp"": 1767281061.5107076}",,0.7
bed9ef51-e31f-44b9-9404-c2b19d870dd2,ea2f33a4-d808-434b-b776-b7246bd6134a,f4d80e69-2c4d-4746-8744-4cb204e4dc50,9030d380-6089-47c8-90c3-5abb4b9f8b86,,"Turtle docs audit complete: 7 version mismatches (1.1.0→1.2.1), 20+ broken links, system-prompts/README.md references non-existent CANONICAL_SYSTEM_PROMPT.md, 4 missing directories (production/, skills/), 9 broken links in 01_START_HERE.md alone",1767281469.92026,"{""finding"": ""Turtle docs audit complete: 7 version mismatches (1.1.0\u21921.2.1), 20+ broken links, system-prompts/README.md references non-existent CANONICAL_SYSTEM_PROMPT.md, 4 missing directories (production/, skills/), 9 broken links in 01_START_HERE.md alone"", ""goal_id"": ""9030d380-6089-47c8-90c3-5abb4b9f8b86"", ""subtask_id"": null, ""impact"": 0.8, ""timestamp"": 1767281469.9202554}",,0.8
71f6f35c-b4f3-4372-83b6-1e0a61092a35,ea2f33a4-d808-434b-b776-b7246bd6134a,b0ed1fc5-913a-46ad-bcdd-a6b87d0a11ea,,,"TIER 3 WORK IDENTIFIED: Three major categories. (1) Documentation: 7 version mismatches (1.1.0→1.2.1), 20+ broken links, system-prompts/README doesn't know about CANONICAL_CORE + model_deltas, 4 missing directories, 9 broken links in 01_START_HERE alone. (2) Database: Table naming inconsistency (project_ prefix), bootstrap_level column missing. (3) Implementation gaps: Persona storage in Qdrant, Bayesian wiring, CHECK hooks, calibration thresholds. Priority: Fix docs first (unblocks users), then database schema, then implementation.",1767281668.3322,"{""finding"": ""TIER 3 WORK IDENTIFIED: Three major categories. (1) Documentation: 7 version mismatches (1.1.0\u21921.2.1), 20+ broken links, system-prompts/README doesn't know about CANONICAL_CORE + model_deltas, 4 missing directories, 9 broken links in 01_START_HERE alone. (2) Database: Table naming inconsistency (project_ prefix), bootstrap_level column missing. (3) Implementation gaps: Persona storage in Qdrant, Bayesian wiring, CHECK hooks, calibration thresholds. Priority: Fix docs first (unblocks users), then database schema, then implementation."", ""goal_id"": null, ""subtask_id"": null, ""impact"": 0.95, ""timestamp"": 1767281668.3322003}",,0.95
9433e1c0-e24f-4ba8-b447-f09077f2add5,ea2f33a4-d808-434b-b776-b7246bd6134a,f4d80e69-2c4d-4746-8744-4cb204e4dc50,9030d380-6089-47c8-90c3-5abb4b9f8b86,,"Documentation v1.2.1 alignment complete: 16 files updated, version refs fixed, system-prompts/README.md rewritten for CANONICAL_CORE architecture, docs/README.md broken links fixed",1767281684.16823,"{""finding"": ""Documentation v1.2.1 alignment complete: 16 files updated, version refs fixed, system-prompts/README.md rewritten for CANONICAL_CORE architecture, docs/README.md broken links fixed"", ""goal_id"": ""9030d380-6089-47c8-90c3-5abb4b9f8b86"", ""subtask_id"": null, ""impact"": 0.8, ""timestamp"": 1767281684.1682248}",,0.8
0f226645-4a14-41b4-a93f-1a5a75cd0b30,ea2f33a4-d808-434b-b776-b7246bd6134a,3a3728a4-bb37-478f-a3f3-7b743305d974,,,"Turtle release assessment v1.2.1: Version consistent (pyproject.toml, __init__.py), import works, CLI shows 1.2.1, git clean on develop, bootstrap test passes",1767281879.96495,"{""finding"": ""Turtle release assessment v1.2.1: Version consistent (pyproject.toml, __init__.py), import works, CLI shows 1.2.1, git clean on develop, bootstrap test passes"", ""goal_id"": null, ""subtask_id"": null, ""impact"": 0.7, ""timestamp"": 1767281879.9649465}",,0.7
e185f3ac-45e8-4bb3-b945-1b5b75c04552,ea2f33a4-d808-434b-b776-b7246bd6134a,3a3728a4-bb37-478f-a3f3-7b743305d974,,,"Empirica v1.2.1 RELEASED: Full epistemic loop complete (PREFLIGHT→turtle→CHECK→git push→PyPI). Package live at https://pypi.org/project/empirica/1.2.1/",1767281989.23036,"{""finding"": ""Empirica v1.2.1 RELEASED: Full epistemic loop complete (PREFLIGHT\u2192turtle\u2192CHECK\u2192git push\u2192PyPI). Package live at https://pypi.org/project/empirica/1.2.1/"", ""goal_id"": null, ""subtask_id"": null, ""impact"": 0.9, ""timestamp"": 1767281989.2303617}",,0.9
5b9e8ddf-85cd-40b5-ac21-cf3478c64b75,ea2f33a4-d808-434b-b776-b7246bd6134a,b9ef4dbb-c0d7-492e-a3f1-abd07066d7f6,,,"PACKAGING BUG: empirica-mcp/ bundled in main wheel due to 'include = [""empirica*""]' glob matching both packages. Should be 'include = [""empirica""]' (no glob) or exclude 'empirica-mcp*'. Also test_epistemic.py included in wheel.",1767282173.38135,"{""finding"": ""PACKAGING BUG: empirica-mcp/ bundled in main wheel due to 'include = [\""empirica*\""]' glob matching both packages. Should be 'include = [\""empirica\""]' (no glob) or exclude 'empirica-mcp*'. Also test_epistemic.py included in wheel."", ""goal_id"": null, ""subtask_id"": null, ""impact"": 0.8, ""timestamp"": 1767282173.3813508}",,0.8
2a8a4537-23a1-4a6b-903f-46d059c3aec6,ea2f33a4-d808-434b-b776-b7246bd6134a,b9ef4dbb-c0d7-492e-a3f1-abd07066d7f6,,,"Packaging bug FIXED: Changed include from 'empirica*' to 'empirica', added 'empirica-mcp*' to exclude. Wheel now 282 files (was 293), no empirica-mcp bundled.",1767282277.78021,"{""finding"": ""Packaging bug FIXED: Changed include from 'empirica*' to 'empirica', added 'empirica-mcp*' to exclude. Wheel now 282 files (was 293), no empirica-mcp bundled."", ""goal_id"": null, ""subtask_id"": null, ""impact"": 0.7, ""timestamp"": 1767282277.7802093}",,0.7
328f01e8-446f-41e3-a137-f3ad108c94ab,ea2f33a4-d808-434b-b776-b7246bd6134a,b9ef4dbb-c0d7-492e-a3f1-abd07066d7f6,,,"GitHub cleanup: Removed auto-commit from pre-compact hook, deleted docs/research/ and docs/FEATURE_STATUS.md from tracking, deleted remote investigation branch, updated .gitignore",1767283295.15032,"{""finding"": ""GitHub cleanup: Removed auto-commit from pre-compact hook, deleted docs/research/ and docs/FEATURE_STATUS.md from tracking, deleted remote investigation branch, updated .gitignore"", ""goal_id"": null, ""subtask_id"": null, ""impact"": 0.8, ""timestamp"": 1767283295.150318}",,0.8
ce76eea7-2603-48d0-9862-da619e85adea,ea2f33a4-d808-434b-b776-b7246bd6134a,b9ef4dbb-c0d7-492e-a3f1-abd07066d7f6,,,"Docs numbering gaps: 01, 04, 06 exist but 02, 03, 05 missing. Post-compact task: renumber or fill gaps. Also verify content is current.",1767284105.71622,"{""finding"": ""Docs numbering gaps: 01, 04, 06 exist but 02, 03, 05 missing. Post-compact task: renumber or fill gaps. Also verify content is current."", ""goal_id"": null, ""subtask_id"": null, ""impact"": 0.5, ""timestamp"": 1767284105.7162187}",,0.5
640f87a8-9951-4c63-b992-4bf0e09c858c,ea2f33a4-d808-434b-b776-b7246bd6134a,b0ed1fc5-913a-46ad-bcdd-a6b87d0a11ea,,,"TIER 3 DATABASE SCHEMA FIX COMPLETE: (1) Removed empty .db file that was blocking reinitialization. (2) Ran 13 database migrations successfully. (3) bootstrap_level column now exists in sessions table. (4) Sessions table schema complete: id, ai_id, created_at, updated_at, project_id, subject, bootstrap_level. Database is now production-ready. Migration failures on other tables are expected (cascades, goals, findings tables created separately).",1767285039.71557,"{""finding"": ""TIER 3 DATABASE SCHEMA FIX COMPLETE: (1) Removed empty .db file that was blocking reinitialization. (2) Ran 13 database migrations successfully. (3) bootstrap_level column now exists in sessions table. (4) Sessions table schema complete: id, ai_id, created_at, updated_at, project_id, subject, bootstrap_level. Database is now production-ready. Migration failures on other tables are expected (cascades, goals, findings tables created separately)."", ""goal_id"": null, ""subtask_id"": null, ""impact"": 0.9, ""timestamp"": 1767285039.7155662}",,0.9
da8dcf31-1719-40b1-89ab-6530a71bd157,ea2f33a4-d808-434b-b776-b7246bd6134a,8d29daad-2012-4262-8a32-f48ba7ed1813,,,"Added statusline and memory compact plugin instructions to CLAUDE_CODE_SETUP.md",1767287932.61714,"{""finding"": ""Added statusline and memory compact plugin instructions to CLAUDE_CODE_SETUP.md"", ""goal_id"": null, ""subtask_id"": null, ""impact"": 0.5, ""timestamp"": 1767287932.617135}",,0.5
58ed3f98-b96c-4fd4-b806-dba43f5e2fcf,ea2f33a4-d808-434b-b776-b7246bd6134a,ae60439d-54ca-4616-958c-84a241295b86,,,"Test suite analysis: 448 tests, 289 pass (64.5%), 101 fail, 33 errors. Failures fall into 3 categories: (1) Test isolation issues - tests pass individually but fail in suite due to shared state, (2) Feature gaps - tests expect unimplemented features like bootstrap_level in MCP, (3) Actual bugs. Recommending triage approach vs bulk fix.",1767289686.79165,"{""finding"": ""Test suite analysis: 448 tests, 289 pass (64.5%), 101 fail, 33 errors. Failures fall into 3 categories: (1) Test isolation issues - tests pass individually but fail in suite due to shared state, (2) Feature gaps - tests expect unimplemented features like bootstrap_level in MCP, (3) Actual bugs. Recommending triage approach vs bulk fix."", ""goal_id"": null, ""subtask_id"": null, ""impact"": 0.7, ""timestamp"": 1767289686.791646}",,0.7
741bff76-1ff9-4254-8e3b-4d4ee90accea,ea2f33a4-d808-434b-b776-b7246bd6134a,ae60439d-54ca-4616-958c-84a241295b86,,,"Database schema cleanup assessed: investigation_tools and act_logs tables exist, renaming to noetic_tools/praxic_logs would require updating ~500 references across 13 files plus migration scripts. Recommending deferred refactoring with proper migration plan.",1767289913.69214,"{""finding"": ""Database schema cleanup assessed: investigation_tools and act_logs tables exist, renaming to noetic_tools/praxic_logs would require updating ~500 references across 13 files plus migration scripts. Recommending deferred refactoring with proper migration plan."", ""goal_id"": null, ""subtask_id"": null, ""impact"": 0.5, ""timestamp"": 1767289913.692142}",,0.5
099cde20-1754-4421-904a-bf3d329f1579,ea2f33a4-d808-434b-b776-b7246bd6134a,13ac95a6-4cb0-4f88-9d2b-9c7c362effff,,,"Implemented vector-based cognitive phase inference (Turtle Principle) - statusline now shows emergent phase AND CASCADE gate",1767291680.40472,"{""finding"": ""Implemented vector-based cognitive phase inference (Turtle Principle) - statusline now shows emergent phase AND CASCADE gate"", ""goal_id"": null, ""subtask_id"": null, ""impact"": 0.85, ""timestamp"": 1767291680.4047227}",,0.85
df12b8aa-1e70-4991-8df3-270fdc701529,ea2f33a4-d808-434b-b776-b7246bd6134a,13ac95a6-4cb0-4f88-9d2b-9c7c362effff,,,"Implemented vector-based cognitive phase inference (Turtle Principle)",1767291686.24943,"{""finding"": ""Implemented vector-based cognitive phase inference (Turtle Principle)"", ""goal_id"": null, ""subtask_id"": null, ""impact"": 0.85, ""timestamp"": 1767291686.2494268}",,0.85
7b0609e1-aaab-45f6-852f-4a543f64993f,ea2f33a4-d808-434b-b776-b7246bd6134a,2ba34768-fc9d-441e-9864-5a5f1ef53146,,,"Implemented epistemic sub-agents: agent-spawn/report/aggregate CLI commands, persona integration, investigation branch tracking. Turtle Principle applied to sub-agent layer.",1767294558.02901,"{""finding"": ""Implemented epistemic sub-agents: agent-spawn/report/aggregate CLI commands, persona integration, investigation branch tracking. Turtle Principle applied to sub-agent layer."", ""goal_id"": null, ""subtask_id"": null, ""impact"": 0.85, ""timestamp"": 1767294558.029011}",,0.85
