id,project_id,session_id,goal_id,subtask_id,finding,created_timestamp,finding_data,subject,impact
4f423f82-060b-4683-8249-934e353af693,ea2f33a4-d808-434b-b776-b7246bd6134a,d32b4ae4-3168-4446-b664-2477e5d73548,,,"RAG generation bottleneck: (1) Contextual Awareness issues (noisy context, knowledge conflicts between parametric vs contextual, lost-in-the-middle phenomenon from RoPE positional encoding), (2) Contextual Alignment issues (source attribution, faithful decoding)",1766703870.42131,"{""finding"": ""RAG generation bottleneck: (1) Contextual Awareness issues (noisy context, knowledge conflicts between parametric vs contextual, lost-in-the-middle phenomenon from RoPE positional encoding), (2) Contextual Alignment issues (source attribution, faithful decoding)"", ""goal_id"": null, ""subtask_id"": null, ""impact"": 0.9, ""timestamp"": 1766703870.421304}",,0.5
ea2295f3-20f2-45fc-97de-b29e149c6e19,ea2f33a4-d808-434b-b776-b7246bd6134a,d32b4ae4-3168-4446-b664-2477e5d73548,,,"Concrete RAG failure examples provided: boiling point query retrieving altitude-specific info (blind retrieval), fastest mile query retrieving car racing instead of athletics (ambiguous), penicillin university query getting incomplete results (complex multi-step)",1766703870.43572,"{""finding"": ""Concrete RAG failure examples provided: boiling point query retrieving altitude-specific info (blind retrieval), fastest mile query retrieving car racing instead of athletics (ambiguous), penicillin university query getting incomplete results (complex multi-step)"", ""goal_id"": null, ""subtask_id"": null, ""impact"": 0.8, ""timestamp"": 1766703870.435716}",,0.5
5e15c11e-9920-4585-b7d1-119eb9530386,ea2f33a4-d808-434b-b776-b7246bd6134a,d32b4ae4-3168-4446-b664-2477e5d73548,,,"Lost-in-the-middle phenomenon: LLMs perform worse on info in middle of long context vs beginning/end, attributed to RoPE long-term decay property and pre-training data structure bias (news reports have salient info at start/end)",1766703870.44544,"{""finding"": ""Lost-in-the-middle phenomenon: LLMs perform worse on info in middle of long context vs beginning/end, attributed to RoPE long-term decay property and pre-training data structure bias (news reports have salient info at start/end)"", ""goal_id"": null, ""subtask_id"": null, ""impact"": 0.8, ""timestamp"": 1766703870.4454432}",,0.5
85ac0223-a2b5-4a94-ae2d-e87438be52d6,ea2f33a4-d808-434b-b776-b7246bd6134a,d32b4ae4-3168-4446-b664-2477e5d73548,,,"Knowledge conflict finding: T5 models tend to trust parametric memory over contextual information, but LLMs show high receptivity to external evidence when conflicts are coherent (not heuristic entity substitution)",1766703870.45531,"{""finding"": ""Knowledge conflict finding: T5 models tend to trust parametric memory over contextual information, but LLMs show high receptivity to external evidence when conflicts are coherent (not heuristic entity substitution)"", ""goal_id"": null, ""subtask_id"": null, ""impact"": 0.7, ""timestamp"": 1766703870.4553118}",,0.5
e17824e5-e07e-4f0d-84f1-d16e4d520185,ea2f33a4-d808-434b-b776-b7246bd6134a,d32b4ae4-3168-4446-b664-2477e5d73548,,,"LLM-generated content contamination risk: Modern retrieval models favor LLM-generated content over human-authored content (empirical studies), leading to progressive loss of human-generated content influence in RAG systems",1766703870.46519,"{""finding"": ""LLM-generated content contamination risk: Modern retrieval models favor LLM-generated content over human-authored content (empirical studies), leading to progressive loss of human-generated content influence in RAG systems"", ""goal_id"": null, ""subtask_id"": null, ""impact"": 0.8, ""timestamp"": 1766703870.465184}",,0.5
271313e7-cf48-417f-b651-d795b79b540e,ea2f33a4-d808-434b-b776-b7246bd6134a,d32b4ae4-3168-4446-b664-2477e5d73548,,,"RAG paper (Lewis et al. 2020) - Open-domain QA results: NQ 44.5 (vs T5 34.5, REALM 40.4), WQ 56.8/68.0, CuratedTrec 45.2, TriviaQA 52.2. State-of-the-art on all 4 tasks",1766705166.04779,"{""finding"": ""RAG paper (Lewis et al. 2020) - Open-domain QA results: NQ 44.5 (vs T5 34.5, REALM 40.4), WQ 56.8/68.0, CuratedTrec 45.2, TriviaQA 52.2. State-of-the-art on all 4 tasks"", ""goal_id"": null, ""subtask_id"": null, ""impact"": 0.9, ""timestamp"": 1766705166.0477858}",,0.5
b16cf0e9-56e4-4f8e-ba16-6dd3a08004c5,ea2f33a4-d808-434b-b776-b7246bd6134a,d32b4ae4-3168-4446-b664-2477e5d73548,,,"RAG MS-MARCO results: +2.6 BLEU, +2.6 Rouge-L over BART baseline. Approaches SOTA despite not having gold passages access that SOTA models use",1766705166.07108,"{""finding"": ""RAG MS-MARCO results: +2.6 BLEU, +2.6 Rouge-L over BART baseline. Approaches SOTA despite not having gold passages access that SOTA models use"", ""goal_id"": null, ""subtask_id"": null, ""impact"": 0.7, ""timestamp"": 1766705166.0710738}",,0.5
79b0b55a-d4b0-496c-8a73-4b7363b38e80,ea2f33a4-d808-434b-b776-b7246bd6134a,d32b4ae4-3168-4446-b664-2477e5d73548,,,"RAG human evaluation on Jeopardy: 42.7% more factual than BART, only 7.1% less factual. Also rated more specific by large margin. Demonstrates factuality improvement over parametric-only model",1766705166.08118,"{""finding"": ""RAG human evaluation on Jeopardy: 42.7% more factual than BART, only 7.1% less factual. Also rated more specific by large margin. Demonstrates factuality improvement over parametric-only model"", ""goal_id"": null, ""subtask_id"": null, ""impact"": 0.9, ""timestamp"": 1766705166.0811753}",,0.5
d502731b-0a6e-49ab-acb3-f52acfdc58d3,ea2f33a4-d808-434b-b776-b7246bd6134a,d32b4ae4-3168-4446-b664-2477e5d73548,,,"RAG generates correct answers even when answer NOT in retrieved documents: 11.8% accuracy on NQ in such cases (extractive model would score 0%). Shows parametric + non-parametric memory synergy",1766705166.09712,"{""finding"": ""RAG generates correct answers even when answer NOT in retrieved documents: 11.8% accuracy on NQ in such cases (extractive model would score 0%). Shows parametric + non-parametric memory synergy"", ""goal_id"": null, ""subtask_id"": null, ""impact"": 0.8, ""timestamp"": 1766705166.097118}",,0.5
1ef8b51b-252f-442c-8cd4-cfafb56af8d8,ea2f33a4-d808-434b-b776-b7246bd6134a,d32b4ae4-3168-4446-b664-2477e5d73548,,,"RAG FEVER fact verification: Within 4.3% of SOTA without specialized retrieval supervision that SOTA systems require. SOTA systems are complex pipelines with domain-specific architectures",1766705166.10703,"{""finding"": ""RAG FEVER fact verification: Within 4.3% of SOTA without specialized retrieval supervision that SOTA systems require. SOTA systems are complex pipelines with domain-specific architectures"", ""goal_id"": null, ""subtask_id"": null, ""impact"": 0.6, ""timestamp"": 1766705166.1070278}",,0.5
9ed104b3-be56-4191-a321-b6e42d3ff4a2,ea2f33a4-d808-434b-b776-b7246bd6134a,d32b4ae4-3168-4446-b664-2477e5d73548,,,"RAG architecture: Dense Passage Retriever (DPR) + BART seq2seq, trained end-to-end. Two variants: RAG-Sequence (same docs for all tokens) vs RAG-Token (different docs per token)",1766705166.11687,"{""finding"": ""RAG architecture: Dense Passage Retriever (DPR) + BART seq2seq, trained end-to-end. Two variants: RAG-Sequence (same docs for all tokens) vs RAG-Token (different docs per token)"", ""goal_id"": null, ""subtask_id"": null, ""impact"": 0.7, ""timestamp"": 1766705166.1168668}",,0.5
5350747e-1fa5-4b4a-8145-795d1ecdd42c,ea2f33a4-d808-434b-b776-b7246bd6134a,d32b4ae4-3168-4446-b664-2477e5d73548,,,"Semantic Uncertainty (Kuhn et al. 2023, ICLR) introduces semantic entropy - uncertainty measure accounting for semantic equivalence. Problem: ""France capital is Paris"" vs ""Paris is France capital"" are different tokens but same meaning",1766705225.12343,"{""finding"": ""Semantic Uncertainty (Kuhn et al. 2023, ICLR) introduces semantic entropy - uncertainty measure accounting for semantic equivalence. Problem: \""France capital is Paris\"" vs \""Paris is France capital\"" are different tokens but same meaning"", ""goal_id"": null, ""subtask_id"": null, ""impact"": 0.9, ""timestamp"": 1766705225.123424}",,0.5
4845b9a2-85be-4b3e-be81-0c951efc94a0,ea2f33a4-d808-434b-b776-b7246bd6134a,d32b4ae4-3168-4446-b664-2477e5d73548,,,"Semantic entropy AUROC results: TriviaQA 0.83, CoQA 0.77 (30B OPT model). Outperforms baselines: predictive entropy, length-normalized entropy, p(True), lexical similarity. Performance gap widens with more samples",1766705225.14647,"{""finding"": ""Semantic entropy AUROC results: TriviaQA 0.83, CoQA 0.77 (30B OPT model). Outperforms baselines: predictive entropy, length-normalized entropy, p(True), lexical similarity. Performance gap widens with more samples"", ""goal_id"": null, ""subtask_id"": null, ""impact"": 0.9, ""timestamp"": 1766705225.146467}",,0.5
befffda5-4c97-4123-a419-87c0810f002b,ea2f33a4-d808-434b-b776-b7246bd6134a,d32b4ae4-3168-4446-b664-2477e5d73548,,,"Table 2 mechanism analysis: Incorrectly answered questions have MORE semantically distinct answers. TriviaQA: 3.89 distinct (incorrect) vs 1.89 (correct). CoQA: 1.77 distinct (incorrect) vs 1.27 (correct). Higher uncertainty correlates with errors",1766705225.15617,"{""finding"": ""Table 2 mechanism analysis: Incorrectly answered questions have MORE semantically distinct answers. TriviaQA: 3.89 distinct (incorrect) vs 1.89 (correct). CoQA: 1.77 distinct (incorrect) vs 1.27 (correct). Higher uncertainty correlates with errors"", ""goal_id"": null, ""subtask_id"": null, ""impact"": 0.8, ""timestamp"": 1766705225.1561735}",,0.5
1522c923-f6dc-4198-bb0b-3de7c9ceff22,ea2f33a4-d808-434b-b776-b7246bd6134a,d32b4ae4-3168-4446-b664-2477e5d73548,,,"Dataset performance: TriviaQA 50.6% accuracy (closed-book), CoQA 82.3% accuracy (open-book with supporting paragraph). TriviaQA is more challenging dataset",1766705225.16605,"{""finding"": ""Dataset performance: TriviaQA 50.6% accuracy (closed-book), CoQA 82.3% accuracy (open-book with supporting paragraph). TriviaQA is more challenging dataset"", ""goal_id"": null, ""subtask_id"": null, ""impact"": 0.6, ""timestamp"": 1766705225.1660488}",,0.5
c9ed4172-1a88-441a-8c74-8f3d7e1226da,ea2f33a4-d808-434b-b776-b7246bd6134a,d32b4ae4-3168-4446-b664-2477e5d73548,,,"Semantic equivalence classifier: 92.7% accuracy on TriviaQA, 95.5% on CoQA. Uses principle: two sentences mean same thing if you can infer each from other. Clustering based on bidirectional entailment",1766705225.17603,"{""finding"": ""Semantic equivalence classifier: 92.7% accuracy on TriviaQA, 95.5% on CoQA. Uses principle: two sentences mean same thing if you can infer each from other. Clustering based on bidirectional entailment"", ""goal_id"": null, ""subtask_id"": null, ""impact"": 0.7, ""timestamp"": 1766705225.176028}",,0.5
b18ad6e4-5df1-4cf1-9704-a294cc19e692,ea2f33a4-d808-434b-b776-b7246bd6134a,d32b4ae4-3168-4446-b664-2477e5d73548,,,"Method is unsupervised, requires no training/data-gathering, works with off-the-shelf LLMs. Performance improves with model size (6.7B → 13B → 30B). Far fewer samples needed than prior work (10 samples sufficient)",1766705225.19033,"{""finding"": ""Method is unsupervised, requires no training/data-gathering, works with off-the-shelf LLMs. Performance improves with model size (6.7B \u2192 13B \u2192 30B). Far fewer samples needed than prior work (10 samples sufficient)"", ""goal_id"": null, ""subtask_id"": null, ""impact"": 0.7, ""timestamp"": 1766705225.190328}",,0.5
127603c1-8d03-441a-94b2-36b8c28227d6,ea2f33a4-d808-434b-b776-b7246bd6134a,d32b4ae4-3168-4446-b664-2477e5d73548,,,"Added cycle/round/scope-depth tracking to check-drift: --cycle (investigation iteration), --round (CHECK gate count), --scope-depth (0.0=surface, 1.0=exhaustive). Enables investigation depth self-awareness",1766706226.51694,"{""finding"": ""Added cycle/round/scope-depth tracking to check-drift: --cycle (investigation iteration), --round (CHECK gate count), --scope-depth (0.0=surface, 1.0=exhaustive). Enables investigation depth self-awareness"", ""goal_id"": null, ""subtask_id"": null, ""impact"": 0.9, ""timestamp"": 1766706226.5169435}",,0.5
c04ae05d-a62e-4a5f-b2e2-cf9c1eec06a4,ea2f33a4-d808-434b-b776-b7246bd6134a,d32b4ae4-3168-4446-b664-2477e5d73548,,,"Investigation context now saved in pre-summary snapshots and displayed in post-summary. Enables drift detection for: cycles without progress, scope-uncertainty mismatch, investigation regression after compact",1766706226.53994,"{""finding"": ""Investigation context now saved in pre-summary snapshots and displayed in post-summary. Enables drift detection for: cycles without progress, scope-uncertainty mismatch, investigation regression after compact"", ""goal_id"": null, ""subtask_id"": null, ""impact"": 0.8, ""timestamp"": 1766706226.5399399}",,0.5
5bde64ca-c22e-4ce0-9323-8e27d13f2332,ea2f33a4-d808-434b-b776-b7246bd6134a,d32b4ae4-3168-4446-b664-2477e5d73548,,,"Philosophical insight: AI alignment through reward shaping not anthropomorphization. When reward=epistemic truth, AI naturally seeks grounding through optimization, not motivation. No desire to be right, just information-theoretic gradient descent",1766706226.54995,"{""finding"": ""Philosophical insight: AI alignment through reward shaping not anthropomorphization. When reward=epistemic truth, AI naturally seeks grounding through optimization, not motivation. No desire to be right, just information-theoretic gradient descent"", ""goal_id"": null, ""subtask_id"": null, ""impact"": 1.0, ""timestamp"": 1766706226.5499454}",,0.5
c0674ae4-f517-4488-8594-23d1c9a59b01,ea2f33a4-d808-434b-b776-b7246bd6134a,d32b4ae4-3168-4446-b664-2477e5d73548,,,"Epistemic checker v2 validation on investigated papers: Hallucination survey 16.1% experiential (62 claims), RAG 31.6% (19 claims), Uncertainty 44.0% (25 claims). Pattern: More focused empirical papers = higher grounding. Survey paper with 300+ refs = lower grounding. Checker successfully finds investigation evidence trails.",1766706626.04393,"{""finding"": ""Epistemic checker v2 validation on investigated papers: Hallucination survey 16.1% experiential (62 claims), RAG 31.6% (19 claims), Uncertainty 44.0% (25 claims). Pattern: More focused empirical papers = higher grounding. Survey paper with 300+ refs = lower grounding. Checker successfully finds investigation evidence trails."", ""goal_id"": null, ""subtask_id"": null}",,0.5
e5e2d56b-a8af-4b15-8d6a-c090f268200b,ea2f33a4-d808-434b-b776-b7246bd6134a,8ddc7f2c-72fa-45d9-8036-cf341ca6b6fd,,,"CRITICAL BUG FIXED: check-drift used CheckpointManager.load_recent_checkpoints() but CASCADE uses GitEnhancedReflexLogger. Storage mismatch caused hooks to fail. Fixed monitor_commands.py line 409 to use GitEnhancedReflexLogger.list_checkpoints(). Also fixed JSON output to be pure JSON when --output json specified. Hooks now work correctly.",1766707524.50618,"{""finding"": ""CRITICAL BUG FIXED: check-drift used CheckpointManager.load_recent_checkpoints() but CASCADE uses GitEnhancedReflexLogger. Storage mismatch caused hooks to fail. Fixed monitor_commands.py line 409 to use GitEnhancedReflexLogger.list_checkpoints(). Also fixed JSON output to be pure JSON when --output json specified. Hooks now work correctly."", ""goal_id"": null, ""subtask_id"": null, ""impact"": 0.5, ""timestamp"": 1766707524.506183}",,0.5
cee21bb6-9647-4703-a6f0-30e841162a60,ea2f33a4-d808-434b-b776-b7246bd6134a,8ddc7f2c-72fa-45d9-8036-cf341ca6b6fd,,,"Vector continuity audit complete: Found 4 gaps: (1) Pre-compact uses last checkpoint not current state - may be stale, (2) Post-compact no fresh assessment - can't measure compact-induced drift, (3) Snapshots load by timestamp not importance (impact+completion), (4) Completed snapshots (completion>=0.9) accumulate without archival. Recommendations: capture fresh vectors pre/post compact, importance-weighted loading, snapshot curation.",1766707958.60941,"{""finding"": ""Vector continuity audit complete: Found 4 gaps: (1) Pre-compact uses last checkpoint not current state - may be stale, (2) Post-compact no fresh assessment - can't measure compact-induced drift, (3) Snapshots load by timestamp not importance (impact+completion), (4) Completed snapshots (completion>=0.9) accumulate without archival. Recommendations: capture fresh vectors pre/post compact, importance-weighted loading, snapshot curation."", ""goal_id"": null, ""subtask_id"": null, ""impact"": 0.5, ""timestamp"": 1766707958.6094062}",,0.5
ff46656f-044d-4ff9-937f-4f673d74e393,ea2f33a4-d808-434b-b776-b7246bd6134a,8ddc7f2c-72fa-45d9-8036-cf341ca6b6fd,,,"Designed complete epistemic state capture schema for assess-state command. Includes: 13 vectors, git state (commits/dirty/branch), reasoning trail, database artifacts (findings/unknowns/goals/mistakes), session metadata (cascade phase/round/cycle), project context, investigation chains, reference docs. Optional: semantic search via Qdrant for long sessions. Post-compact hook will load project-bootstrap for dynamic context + compare ALL dimensions (not just vectors).",1766746436.31154,"{""finding"": ""Designed complete epistemic state capture schema for assess-state command. Includes: 13 vectors, git state (commits/dirty/branch), reasoning trail, database artifacts (findings/unknowns/goals/mistakes), session metadata (cascade phase/round/cycle), project context, investigation chains, reference docs. Optional: semantic search via Qdrant for long sessions. Post-compact hook will load project-bootstrap for dynamic context + compare ALL dimensions (not just vectors)."", ""goal_id"": null, ""subtask_id"": null, ""impact"": 0.5, ""timestamp"": 1766746436.311542}",,0.5
7cb178e8-524c-4e13-bf59-0104c9f3ba7e,ea2f33a4-d808-434b-b776-b7246bd6134a,6c1d2387-f659-4546-8c1b-b5d562e60a03,0cc0de6c-79b3-4ba4-96bf-60f756d2c74d,,"Testing auto-resolution of project ID in finding-log command",1766749819.68263,"{""finding"": ""Testing auto-resolution of project ID in finding-log command"", ""goal_id"": ""0cc0de6c-79b3-4ba4-96bf-60f756d2c74d"", ""subtask_id"": null, ""impact"": 0.7, ""timestamp"": 1766749819.682631}",,0.37
6d0f5081-faba-49b4-9c4a-4a681a05e202,ea2f33a4-d808-434b-b776-b7246bd6134a,8ddc7f2c-72fa-45d9-8036-cf341ca6b6fd,,,"Enhanced project-bootstrap with live state capture for vector continuity across memory compacts",1766761443.42722,"{""finding"": ""Enhanced project-bootstrap with live state capture for vector continuity across memory compacts"", ""goal_id"": null, ""subtask_id"": null, ""impact"": 0.9, ""timestamp"": 1766761443.4272182}",,0.5
0c5b85d7-33b9-4b8a-94ae-56f430963621,ea2f33a4-d808-434b-b776-b7246bd6134a,8ddc7f2c-72fa-45d9-8036-cf341ca6b6fd,,,"Fixed critical bug: check-drift used CheckpointManager but CASCADE uses GitEnhancedReflexLogger - storage layer mismatch caused hooks to fail",1766761456.92057,"{""finding"": ""Fixed critical bug: check-drift used CheckpointManager but CASCADE uses GitEnhancedReflexLogger - storage layer mismatch caused hooks to fail"", ""goal_id"": null, ""subtask_id"": null, ""impact"": 0.95, ""timestamp"": 1766761456.9205716}",,0.5
87b1f23b-e98c-4356-914e-ede0311f2dfb,ea2f33a4-d808-434b-b776-b7246bd6134a,8ddc7f2c-72fa-45d9-8036-cf341ca6b6fd,,,"Implemented adaptive depth loading: drift >0.3=full, >0.1=moderate, else minimal. Calculates average absolute change across 5 vectors",1766761458.46197,"{""finding"": ""Implemented adaptive depth loading: drift >0.3=full, >0.1=moderate, else minimal. Calculates average absolute change across 5 vectors"", ""goal_id"": null, ""subtask_id"": null, ""impact"": 0.8, ""timestamp"": 1766761458.461972}",,0.5
963d7744-c61a-4676-b228-1bbbfcccf39c,ea2f33a4-d808-434b-b776-b7246bd6134a,8ddc7f2c-72fa-45d9-8036-cf341ca6b6fd,,,"Rewrote PreCompact/PostCompact hooks to use project-bootstrap with fresh-assess instead of check-drift for better state capture",1766761459.84758,"{""finding"": ""Rewrote PreCompact/PostCompact hooks to use project-bootstrap with fresh-assess instead of check-drift for better state capture"", ""goal_id"": null, ""subtask_id"": null, ""impact"": 0.85, ""timestamp"": 1766761459.8475773}",,0.5
a2edae85-79f6-46ca-b59a-4876d19a844f,ea2f33a4-d808-434b-b776-b7246bd6134a,8ddc7f2c-72fa-45d9-8036-cf341ca6b6fd,2393d8ff-0048-47bc-9785-6d332176e839,,"SessionDatabase bloat identified: 4183 lines, 99 methods, 24 tables. Top 5 methods account for 1700 lines (40%). Refactoring plan created with 5 phases to reduce to ~1500 lines",1766761922.29923,"{""finding"": ""SessionDatabase bloat identified: 4183 lines, 99 methods, 24 tables. Top 5 methods account for 1700 lines (40%). Refactoring plan created with 5 phases to reduce to ~1500 lines"", ""goal_id"": ""2393d8ff-0048-47bc-9785-6d332176e839"", ""subtask_id"": null, ""impact"": 0.85, ""timestamp"": 1766761922.2992265}",,0.5
9e7ae456-4ba9-48c6-a056-b56a9fe59ba9,ea2f33a4-d808-434b-b776-b7246bd6134a,8ddc7f2c-72fa-45d9-8036-cf341ca6b6fd,2393d8ff-0048-47bc-9785-6d332176e839,,"Repositories already exist (1161 lines extracted) but SessionDatabase still has duplicate CRUD methods instead of delegating to them - half-refactored state",1766762255.28443,"{""finding"": ""Repositories already exist (1161 lines extracted) but SessionDatabase still has duplicate CRUD methods instead of delegating to them - half-refactored state"", ""goal_id"": ""2393d8ff-0048-47bc-9785-6d332176e839"", ""subtask_id"": null, ""impact"": 0.9, ""timestamp"": 1766762255.2844265}",,0.5
5647b792-3acc-45b1-bd25-2a411de7b25a,ea2f33a4-d808-434b-b776-b7246bd6134a,8ddc7f2c-72fa-45d9-8036-cf341ca6b6fd,2393d8ff-0048-47bc-9785-6d332176e839,,"Enhanced post-compact hook to inject full breadcrumbs (not just counts) with adaptive depth filtering based on drift",1766763938.98871,"{""finding"": ""Enhanced post-compact hook to inject full breadcrumbs (not just counts) with adaptive depth filtering based on drift"", ""goal_id"": ""2393d8ff-0048-47bc-9785-6d332176e839"", ""subtask_id"": null, ""impact"": 0.85, ""timestamp"": 1766763938.9887135}",,0.5
db324238-54aa-4674-96f0-160f399d1913,ea2f33a4-d808-434b-b776-b7246bd6134a,8ddc7f2c-72fa-45d9-8036-cf341ca6b6fd,2393d8ff-0048-47bc-9785-6d332176e839,,"CHECK command design issue: arbitrary 0.7 confidence threshold and no auto-loading of findings/unknowns. Should merge with check-drift to provide informational drift analysis instead of hard decision gate",1766763941.41338,"{""finding"": ""CHECK command design issue: arbitrary 0.7 confidence threshold and no auto-loading of findings/unknowns. Should merge with check-drift to provide informational drift analysis instead of hard decision gate"", ""goal_id"": ""2393d8ff-0048-47bc-9785-6d332176e839"", ""subtask_id"": null, ""impact"": 0.9, ""timestamp"": 1766763941.4133754}",,0.5
121d337e-5c71-4b22-8013-d271074af25a,ea2f33a4-d808-434b-b776-b7246bd6134a,8ddc7f2c-72fa-45d9-8036-cf341ca6b6fd,2393d8ff-0048-47bc-9785-6d332176e839,,"Added auto-commit to pre-compact hook - ensures snapshot captures all uncommitted work before memory compact",1766763997.54794,"{""finding"": ""Added auto-commit to pre-compact hook - ensures snapshot captures all uncommitted work before memory compact"", ""goal_id"": ""2393d8ff-0048-47bc-9785-6d332176e839"", ""subtask_id"": null, ""impact"": 0.8, ""timestamp"": 1766763997.5479362}",,0.5
d64d9848-c186-47a7-847a-9efee638d663,ea2f33a4-d808-434b-b776-b7246bd6134a,8ddc7f2c-72fa-45d9-8036-cf341ca6b6fd,2393d8ff-0048-47bc-9785-6d332176e839,,"New CHECK implementation works! Auto-loads PREFLIGHT baseline, calculates drift, makes evidence-based suggestions. Found 2 bugs: wrong breadcrumbs table name and delta calculation comparing whole objects instead of just vectors",1766764948.86077,"{""finding"": ""New CHECK implementation works! Auto-loads PREFLIGHT baseline, calculates drift, makes evidence-based suggestions. Found 2 bugs: wrong breadcrumbs table name and delta calculation comparing whole objects instead of just vectors"", ""goal_id"": ""2393d8ff-0048-47bc-9785-6d332176e839"", ""subtask_id"": null, ""impact"": 0.85, ""timestamp"": 1766764948.8607657}",,0.5
2bf3db8d-a046-45ed-bcb2-b6401cdd152d,ea2f33a4-d808-434b-b776-b7246bd6134a,8ddc7f2c-72fa-45d9-8036-cf341ca6b6fd,2393d8ff-0048-47bc-9785-6d332176e839,,"CHECK now fully functional with evidence-based suggestions: auto-loads 294 findings + 51 unknowns, calculates drift, makes suggestive decisions based on evidence",1766765087.55586,"{""finding"": ""CHECK now fully functional with evidence-based suggestions: auto-loads 294 findings + 51 unknowns, calculates drift, makes suggestive decisions based on evidence"", ""goal_id"": ""2393d8ff-0048-47bc-9785-6d332176e839"", ""subtask_id"": null, ""impact"": 0.9, ""timestamp"": 1766765087.5558598}",,0.5
1e2dffc3-8738-4033-a513-ec84417ac31c,ea2f33a4-d808-434b-b776-b7246bd6134a,8ddc7f2c-72fa-45d9-8036-cf341ca6b6fd,2393d8ff-0048-47bc-9785-6d332176e839,,"Phase 1 complete: Extracted 24 database schemas into 5 organized modules. Reduced _create_tables from 712 to 126 lines (82%). session_database.py now 3599 lines (was 4183)",1766765235.02329,"{""finding"": ""Phase 1 complete: Extracted 24 database schemas into 5 organized modules. Reduced _create_tables from 712 to 126 lines (82%). session_database.py now 3599 lines (was 4183)"", ""goal_id"": ""2393d8ff-0048-47bc-9785-6d332176e839"", ""subtask_id"": null, ""impact"": 0.85, ""timestamp"": 1766765235.0232909}",,0.5
86ad3cc2-93f0-4f7a-b704-509d8d35d32d,ea2f33a4-d808-434b-b776-b7246bd6134a,8ddc7f2c-72fa-45d9-8036-cf341ca6b6fd,2393d8ff-0048-47bc-9785-6d332176e839,,"Phase 2 complete: Decomposed bootstrap_project_breadcrumbs from 556 to ~80 lines with 4 focused helpers. session_database.py now 3251 lines (22% total reduction from 4183)",1766765989.57529,"{""finding"": ""Phase 2 complete: Decomposed bootstrap_project_breadcrumbs from 556 to ~80 lines with 4 focused helpers. session_database.py now 3251 lines (22% total reduction from 4183)"", ""goal_id"": ""2393d8ff-0048-47bc-9785-6d332176e839"", ""subtask_id"": null, ""impact"": 0.85, ""timestamp"": 1766765989.5752864}",,0.5
