id,project_id,session_id,goal_id,subtask_id,finding,created_timestamp,finding_data,subject,impact
36df4d1c-a488-4af6-a5ab-ad356cbb1e0e,3be592bd-651d-47f6-8dcd-eec78df7ebfd,49f4486e-c475-401b-bb09-f6a7c83e034c,,,"Findings/unknowns/dead_ends need structured database tables for dynamic breadcrumbs",1765308976.0226,"{""finding"": ""Findings/unknowns/dead_ends need structured database tables for dynamic breadcrumbs"", ""goal_id"": null, ""subtask_id"": null}",,
33ec96ba-d63f-41c7-9b75-f122b1ff33fc,3be592bd-651d-47f6-8dcd-eec78df7ebfd,49f4486e-c475-401b-bb09-f6a7c83e034c,,,"Bootstrap breadcrumbs supports two modes: session_start (fast) and live (complete)",1765308976.20156,"{""finding"": ""Bootstrap breadcrumbs supports two modes: session_start (fast) and live (complete)"", ""goal_id"": null, ""subtask_id"": null}",,
2baabdb7-617e-41ae-a82b-6a6b03e377ad,3be592bd-651d-47f6-8dcd-eec78df7ebfd,49f4486e-c475-401b-bb09-f6a7c83e034c,,,"Epistemic memory is not omniscience - it tracks what we know, what we don't know, and what we tried that failed. More valuable because it's honest, actionable, cumulative, and resilient.",1765310672.91021,"{""finding"": ""Epistemic memory is not omniscience - it tracks what we know, what we don't know, and what we tried that failed. More valuable because it's honest, actionable, cumulative, and resilient."", ""goal_id"": null, ""subtask_id"": null}",,
17f1990a-714b-45d4-ad36-f585a8da9aca,3be592bd-651d-47f6-8dcd-eec78df7ebfd,49f4486e-c475-401b-bb09-f6a7c83e034c,,,"Project bootstrapping is commercially valuable: onboarding time 6-8 weeks → 1 day, prevents duplicate failures, preserves architecture decisions, shows unresolved problems. ROI easily 10x-100x in large teams.",1765310673.08911,"{""finding"": ""Project bootstrapping is commercially valuable: onboarding time 6-8 weeks \u2192 1 day, prevents duplicate failures, preserves architecture decisions, shows unresolved problems. ROI easily 10x-100x in large teams."", ""goal_id"": null, ""subtask_id"": null}",,
88945517-ce56-425e-93ef-9ea652942686,3be592bd-651d-47f6-8dcd-eec78df7ebfd,49f4486e-c475-401b-bb09-f6a7c83e034c,,,"Reference docs bootstrap production documentation so AI knows what exists, what to reference, and what to update. This offloads epistemic context from hundreds of docs to structured DB queries.",1765313024.09038,"{""finding"": ""Reference docs bootstrap production documentation so AI knows what exists, what to reference, and what to update. This offloads epistemic context from hundreds of docs to structured DB queries."", ""goal_id"": null, ""subtask_id"": null}",,
2b5c47ab-4b97-4775-a5a3-a4a4bec4a879,3be592bd-651d-47f6-8dcd-eec78df7ebfd,49f4486e-c475-401b-bb09-f6a7c83e034c,,,"Using Empirica to track Empirica development (meta!) validates the architecture: issues become unknowns, insights become findings, future work visible in breadcrumbs.",1765313024.27692,"{""finding"": ""Using Empirica to track Empirica development (meta!) validates the architecture: issues become unknowns, insights become findings, future work visible in breadcrumbs."", ""goal_id"": null, ""subtask_id"": null}",,
e25b7f2a-183c-4da1-ad5b-7222d56c2c44,3be592bd-651d-47f6-8dcd-eec78df7ebfd,3978cc40-f6c3-44de-98c0-da9b8ce482a5,,,"MCP integration added to Empirica - 5 new project-level tools (project-bootstrap, finding-log, unknown-log, deadend-log, refdoc-add)",1765314474.20446,"{""finding"": ""MCP integration added to Empirica - 5 new project-level tools (project-bootstrap, finding-log, unknown-log, deadend-log, refdoc-add)"", ""goal_id"": null, ""subtask_id"": null}",,
f3a59452-18d1-4fdd-a182-74c16bd18b91,3be592bd-651d-47f6-8dcd-eec78df7ebfd,49f4486e-c475-401b-bb09-f6a7c83e034c,,,"Website successfully extracted to separate repo (empirica-web) to prevent .gitignore issues with gh-pages branch that previously clobbered content. Committed and pushed to https://github.com/Nubaeon/empirica-web.git",1765369819.84232,"{""finding"": ""Website successfully extracted to separate repo (empirica-web) to prevent .gitignore issues with gh-pages branch that previously clobbered content. Committed and pushed to https://github.com/Nubaeon/empirica-web.git"", ""goal_id"": null, ""subtask_id"": null}",,
12b14a4b-1fc4-4f3c-a624-0a6f67a4e036,3be592bd-651d-47f6-8dcd-eec78df7ebfd,5720c635-5189-4625-82be-9762c6d470ee,,,"Semantic documentation index enables 73% token savings for doc discovery (850 vs 3100 tokens). 15 key docs tagged with tags, concepts, questions, use_cases. Foundation for Phase 2 (Qdrant embeddings) and Phase 3 (uncertainty-driven bootstrap).",1765371496.64514,"{""finding"": ""Semantic documentation index enables 73% token savings for doc discovery (850 vs 3100 tokens). 15 key docs tagged with tags, concepts, questions, use_cases. Foundation for Phase 2 (Qdrant embeddings) and Phase 3 (uncertainty-driven bootstrap)."", ""goal_id"": null, ""subtask_id"": null}",,
cf917aa2-80d2-4623-8bf7-2b4bbc9241b8,ea2f33a4-d808-434b-b776-b7246bd6134a,69a70657-18c6-4b10-9269-3b9f7a5bd901,,,"Created new QA session and goal. PREFLIGHT submitted. Identified two existing projects in DB.",1765439529.74429,"{""finding"": ""Created new QA session and goal. PREFLIGHT submitted. Identified two existing projects in DB."", ""goal_id"": null, ""subtask_id"": null}",,0.43
1f349df5-a79a-463a-98fb-da13883eba91,ea2f33a4-d808-434b-b776-b7246bd6134a,69a70657-18c6-4b10-9269-3b9f7a5bd901,d780c11c-ec44-4892-a2f6-98c97f8bace3,,"execute_postflight MCP tool incorrectly maps to CLI: --task-summary flag not recognized, requires --vectors",1765439791.71733,"{""finding"": ""execute_postflight MCP tool incorrectly maps to CLI: --task-summary flag not recognized, requires --vectors"", ""goal_id"": ""d780c11c-ec44-4892-a2f6-98c97f8bace3"", ""subtask_id"": null}",,0.43
74a67d8d-f0b9-4b38-9ffc-9deed48f32b5,ea2f33a4-d808-434b-b776-b7246bd6134a,69a70657-18c6-4b10-9269-3b9f7a5bd901,d780c11c-ec44-4892-a2f6-98c97f8bace3,,"execute_check MCP tool has incorrect type expectations: expects findings as list but doc shows string. CLI arg parsing error visible.",1765439791.86636,"{""finding"": ""execute_check MCP tool has incorrect type expectations: expects findings as list but doc shows string. CLI arg parsing error visible."", ""goal_id"": ""d780c11c-ec44-4892-a2f6-98c97f8bace3"", ""subtask_id"": null}",,0.43
300353dd-6205-4bd0-a288-9209061a0f85,ea2f33a4-d808-434b-b776-b7246bd6134a,69a70657-18c6-4b10-9269-3b9f7a5bd901,d780c11c-ec44-4892-a2f6-98c97f8bace3,,"Comprehensive issues document created: 4 critical bugs (execute_check params, execute_postflight missing CLI, git_notes=false reporting, query_mistakes returns 0) + 7+ deprecated code locations",1765439886.8334,"{""finding"": ""Comprehensive issues document created: 4 critical bugs (execute_check params, execute_postflight missing CLI, git_notes=false reporting, query_mistakes returns 0) + 7+ deprecated code locations"", ""goal_id"": ""d780c11c-ec44-4892-a2f6-98c97f8bace3"", ""subtask_id"": null}",,0.43
f82cd899-96d4-4061-a846-2d18e349b3cb,ea2f33a4-d808-434b-b776-b7246bd6134a,69a70657-18c6-4b10-9269-3b9f7a5bd901,d780c11c-ec44-4892-a2f6-98c97f8bace3,,"Fixed execute_check defensive parsing: now handles string/list/None gracefully. Next: fix git_notes status reporting and debug query_mistakes.",1765439911.95045,"{""finding"": ""Fixed execute_check defensive parsing: now handles string/list/None gracefully. Next: fix git_notes status reporting and debug query_mistakes."", ""goal_id"": ""d780c11c-ec44-4892-a2f6-98c97f8bace3"", ""subtask_id"": null}",,0.43
cf1d15f1-a36c-47d1-8ad0-a699c5c57fde,ea2f33a4-d808-434b-b776-b7246bd6134a,69a70657-18c6-4b10-9269-3b9f7a5bd901,d780c11c-ec44-4892-a2f6-98c97f8bace3,,"Session complete: 4/6 subtasks done, 3 bugs fixed, comprehensive handoff docs created for Gemini/Qwen deprecation cleanup. Ready for next session to finish remaining 2 issues.",1765440192.98308,"{""finding"": ""Session complete: 4/6 subtasks done, 3 bugs fixed, comprehensive handoff docs created for Gemini/Qwen deprecation cleanup. Ready for next session to finish remaining 2 issues."", ""goal_id"": ""d780c11c-ec44-4892-a2f6-98c97f8bace3"", ""subtask_id"": null}",,0.43
7b0398f0-fb75-455d-9724-4db1e651dbf8,ea2f33a4-d808-434b-b776-b7246bd6134a,69a70657-18c6-4b10-9269-3b9f7a5bd901,d780c11c-ec44-4892-a2f6-98c97f8bace3,,"Parallel investigation branches exist in DB schema (investigation_branches + merge_decisions tables) with epistemic auto-merge support. Need to test CLI commands.",1765440804.78134,"{""finding"": ""Parallel investigation branches exist in DB schema (investigation_branches + merge_decisions tables) with epistemic auto-merge support. Need to test CLI commands."", ""goal_id"": ""d780c11c-ec44-4892-a2f6-98c97f8bace3"", ""subtask_id"": null}",,0.43
b1cab6b7-2bb5-4573-b185-bf5b116b7472,ea2f33a4-d808-434b-b776-b7246bd6134a,69a70657-18c6-4b10-9269-3b9f7a5bd901,d780c11c-ec44-4892-a2f6-98c97f8bace3,,"Project bootstrap skill suggestions working perfectly: 5 local skills shown, 2 semantic docs included. Non-burdensome, just informational.",1765440804.78134,"{""finding"": ""Project bootstrap skill suggestions working perfectly: 5 local skills shown, 2 semantic docs included. Non-burdensome, just informational."", ""goal_id"": ""d780c11c-ec44-4892-a2f6-98c97f8bace3"", ""subtask_id"": null}",,0.43
35b50b29-b5f3-46f5-8a34-840ee0a0626e,ea2f33a4-d808-434b-b776-b7246bd6134a,69a70657-18c6-4b10-9269-3b9f7a5bd901,d780c11c-ec44-4892-a2f6-98c97f8bace3,,"Mistake vs Dead-End taxonomy clarified: Mistakes=high confidence errors with prevention; Dead Ends=valid attempts that didn't work; False positives should be corrected via Dead End log explaining the correction.",1765440870.82297,"{""finding"": ""Mistake vs Dead-End taxonomy clarified: Mistakes=high confidence errors with prevention; Dead Ends=valid attempts that didn't work; False positives should be corrected via Dead End log explaining the correction."", ""goal_id"": ""d780c11c-ec44-4892-a2f6-98c97f8bace3"", ""subtask_id"": null}",,0.43
f1f50744-6ba5-43f3-8311-3383855f3bb9,ea2f33a4-d808-434b-b776-b7246bd6134a,69a70657-18c6-4b10-9269-3b9f7a5bd901,d780c11c-ec44-4892-a2f6-98c97f8bace3,,"Ready to start fixes: 1) git_notes status reporting (GitEnhancedReflexLogger.add_checkpoint return value), 2) Add postflight CLI command, 3) Remove deprecated code",1765440878.87233,"{""finding"": ""Ready to start fixes: 1) git_notes status reporting (GitEnhancedReflexLogger.add_checkpoint return value), 2) Add postflight CLI command, 3) Remove deprecated code"", ""goal_id"": ""d780c11c-ec44-4892-a2f6-98c97f8bace3"", ""subtask_id"": null}",,0.43
1bc6b87e-bec6-4583-9fb5-81e2893a03b8,ea2f33a4-d808-434b-b776-b7246bd6134a,69a70657-18c6-4b10-9269-3b9f7a5bd901,d780c11c-ec44-4892-a2f6-98c97f8bace3,,"Fixed git_notes=false bug: add_checkpoint() now distinguishes success (SHA), attempted-but-failed (empty string), and not-attempted (None). Status checks updated in all 3 CASCADE handlers.",1765440924.36363,"{""finding"": ""Fixed git_notes=false bug: add_checkpoint() now distinguishes success (SHA), attempted-but-failed (empty string), and not-attempted (None). Status checks updated in all 3 CASCADE handlers."", ""goal_id"": ""d780c11c-ec44-4892-a2f6-98c97f8bace3"", ""subtask_id"": null}",,0.43
89d1b14f-73f4-4a59-9ced-ae55a3fd0e0f,ea2f33a4-d808-434b-b776-b7246bd6134a,69a70657-18c6-4b10-9269-3b9f7a5bd901,d780c11c-ec44-4892-a2f6-98c97f8bace3,,"Applied git_notes status fix to all 3 CASCADE handlers (PREFLIGHT, CHECK, POSTFLIGHT) using sed",1765440941.27471,"{""finding"": ""Applied git_notes status fix to all 3 CASCADE handlers (PREFLIGHT, CHECK, POSTFLIGHT) using sed"", ""goal_id"": ""d780c11c-ec44-4892-a2f6-98c97f8bace3"", ""subtask_id"": null}",,0.43
09bd19a3-49d6-430c-a334-918b6805c780,ea2f33a4-d808-434b-b776-b7246bd6134a,69a70657-18c6-4b10-9269-3b9f7a5bd901,d780c11c-ec44-4892-a2f6-98c97f8bace3,,"Postponing postflight CLI command addition until after deprecated code removal to avoid merge conflicts. Created patch file for reference.",1765440970.27848,"{""finding"": ""Postponing postflight CLI command addition until after deprecated code removal to avoid merge conflicts. Created patch file for reference."", ""goal_id"": ""d780c11c-ec44-4892-a2f6-98c97f8bace3"", ""subtask_id"": null}",,0.43
4d98ef59-57a0-4463-9c92-4aeec5590d99,ea2f33a4-d808-434b-b776-b7246bd6134a,69a70657-18c6-4b10-9269-3b9f7a5bd901,d780c11c-ec44-4892-a2f6-98c97f8bace3,,"Clarifying execute_postflight design: User confirms it should NOT generate intermediate prompt - AI directly performs self-assessment and submits via submit_postflight_assessment. No Sentinel needed.",1765441109.97379,"{""finding"": ""Clarifying execute_postflight design: User confirms it should NOT generate intermediate prompt - AI directly performs self-assessment and submits via submit_postflight_assessment. No Sentinel needed."", ""goal_id"": ""d780c11c-ec44-4892-a2f6-98c97f8bace3"", ""subtask_id"": null}",,0.43
2d12c450-e059-4708-9c52-a4fd5d6e6948,ea2f33a4-d808-434b-b776-b7246bd6134a,69a70657-18c6-4b10-9269-3b9f7a5bd901,d780c11c-ec44-4892-a2f6-98c97f8bace3,,"Implemented pure POSTFLIGHT assessment: AI rates current state only, system calculates deltas independently. Added memory gap detection (decreases >15%) and calibration issue detection (know/do mismatch, completion/uncertainty mismatch). Warnings shown in CLI output.",1765441894.25699,"{""finding"": ""Implemented pure POSTFLIGHT assessment: AI rates current state only, system calculates deltas independently. Added memory gap detection (decreases >15%) and calibration issue detection (know/do mismatch, completion/uncertainty mismatch). Warnings shown in CLI output."", ""goal_id"": ""d780c11c-ec44-4892-a2f6-98c97f8bace3"", ""subtask_id"": null}",,0.43
15fe8efb-a328-4885-9f1f-4b6d0768bf2c,ea2f33a4-d808-434b-b776-b7246bd6134a,69a70657-18c6-4b10-9269-3b9f7a5bd901,d780c11c-ec44-4892-a2f6-98c97f8bace3,,"Implemented execute_postflight as direct Python handler: returns PREFLIGHT baseline + CHECK history + instructions for pure self-assessment. No CLI mapping needed.",1765441984.92591,"{""finding"": ""Implemented execute_postflight as direct Python handler: returns PREFLIGHT baseline + CHECK history + instructions for pure self-assessment. No CLI mapping needed."", ""goal_id"": ""d780c11c-ec44-4892-a2f6-98c97f8bace3"", ""subtask_id"": null}",,0.43
800da73c-fa20-472a-8850-0f18d65ce0c6,ea2f33a4-d808-434b-b776-b7246bd6134a,69a70657-18c6-4b10-9269-3b9f7a5bd901,d780c11c-ec44-4892-a2f6-98c97f8bace3,,"submit_postflight_assessment succeeded but deltas empty - PREFLIGHT checkpoint lookup failed. Also git_notes=false (checkpoint_id empty string). Need to verify GitEnhancedReflexLogger.get_last_checkpoint() works.",1765442011.79497,"{""finding"": ""submit_postflight_assessment succeeded but deltas empty - PREFLIGHT checkpoint lookup failed. Also git_notes=false (checkpoint_id empty string). Need to verify GitEnhancedReflexLogger.get_last_checkpoint() works."", ""goal_id"": ""d780c11c-ec44-4892-a2f6-98c97f8bace3"", ""subtask_id"": null}",,0.43
819eeed1-99bc-46cf-8bb5-530d25d12af1,ea2f33a4-d808-434b-b776-b7246bd6134a,69a70657-18c6-4b10-9269-3b9f7a5bd901,d780c11c-ec44-4892-a2f6-98c97f8bace3,,"Root cause: git notes write operations failing silently. Need fallback in workflow_commands.py to use SQLite reflexes table for delta calculation when git notes unavailable.",1765442040.55336,"{""finding"": ""Root cause: git notes write operations failing silently. Need fallback in workflow_commands.py to use SQLite reflexes table for delta calculation when git notes unavailable."", ""goal_id"": ""d780c11c-ec44-4892-a2f6-98c97f8bace3"", ""subtask_id"": null}",,0.43
36dabd06-18c9-4b1f-a0cb-58dc5f5f3ec9,ea2f33a4-d808-434b-b776-b7246bd6134a,69a70657-18c6-4b10-9269-3b9f7a5bd901,d780c11c-ec44-4892-a2f6-98c97f8bace3,,"Added SQLite fallback for delta calculation in handle_postflight_submit_command. Queries reflexes table directly when git notes unavailable. Ensures pure POSTFLIGHT works even without git notes.",1765442054.83048,"{""finding"": ""Added SQLite fallback for delta calculation in handle_postflight_submit_command. Queries reflexes table directly when git notes unavailable. Ensures pure POSTFLIGHT works even without git notes."", ""goal_id"": ""d780c11c-ec44-4892-a2f6-98c97f8bace3"", ""subtask_id"": null}",,0.43
2d0efd2a-80c1-4ee4-ad3e-95386d7b8a1d,ea2f33a4-d808-434b-b776-b7246bd6134a,69a70657-18c6-4b10-9269-3b9f7a5bd901,d780c11c-ec44-4892-a2f6-98c97f8bace3,,"Pure POSTFLIGHT SUCCESS: Calculated deltas show positive learning across all vectors (know +0.1, state +0.2, uncertainty -0.15). No memory gaps detected. SQLite fallback working perfectly.",1765442095.06865,"{""finding"": ""Pure POSTFLIGHT SUCCESS: Calculated deltas show positive learning across all vectors (know +0.1, state +0.2, uncertainty -0.15). No memory gaps detected. SQLite fallback working perfectly."", ""goal_id"": ""d780c11c-ec44-4892-a2f6-98c97f8bace3"", ""subtask_id"": null}",,0.43
c44a82e8-5a0b-4b3d-8ba2-90ee1a0bf1b7,ea2f33a4-d808-434b-b776-b7246bd6134a,c4557f4b-02c1-4d60-87f5-902ee804b487,d12bcde4-f387-41ac-8ed3-cb360d7ad408,,"Composition pattern (not inheritance) is correct for SQLite repositories - all repositories share single connection for transactional consistency",1765454902.49088,"{""finding"": ""Composition pattern (not inheritance) is correct for SQLite repositories - all repositories share single connection for transactional consistency"", ""goal_id"": ""d12bcde4-f387-41ac-8ed3-cb360d7ad408"", ""subtask_id"": null}",,0.605
69353092-abe6-44cd-bc43-9898698d3140,ea2f33a4-d808-434b-b776-b7246bd6134a,c4557f4b-02c1-4d60-87f5-902ee804b487,d12bcde4-f387-41ac-8ed3-cb360d7ad408,,"Backward compatibility maintained via facade pattern - SessionDatabase delegates to repositories, all 81 import sites work unchanged",1765454902.65631,"{""finding"": ""Backward compatibility maintained via facade pattern - SessionDatabase delegates to repositories, all 81 import sites work unchanged"", ""goal_id"": ""d12bcde4-f387-41ac-8ed3-cb360d7ad408"", ""subtask_id"": null}",,0.605
e9c9f11d-9427-4163-a1a8-064f8ded799b,ea2f33a4-d808-434b-b776-b7246bd6134a,c4557f4b-02c1-4d60-87f5-902ee804b487,d12bcde4-f387-41ac-8ed3-cb360d7ad408,,"File reduction so far: 3220 → 2826 lines (394 lines removed, 12.2%). Repository files: Goals=253, Branches=201, Breadcrumbs=301, Projects=253 lines",1765454902.8208,"{""finding"": ""File reduction so far: 3220 \u2192 2826 lines (394 lines removed, 12.2%). Repository files: Goals=253, Branches=201, Breadcrumbs=301, Projects=253 lines"", ""goal_id"": ""d12bcde4-f387-41ac-8ed3-cb360d7ad408"", ""subtask_id"": null}",,0.605
2188aad0-bf92-4af1-ae51-b68b960f1005,ea2f33a4-d808-434b-b776-b7246bd6134a,c4557f4b-02c1-4d60-87f5-902ee804b487,,,"Phase 4 complete: All 7 ProjectRepository methods delegated (create_project, get_project, link_session_to_project, get_project_sessions, aggregate_project_learning_deltas, create_project_handoff, get_latest_project_handoff). File reduced to 2,646 lines. Commit a8e25b93.",1765457593.43834,"{""finding"": ""Phase 4 complete: All 7 ProjectRepository methods delegated (create_project, get_project, link_session_to_project, get_project_sessions, aggregate_project_learning_deltas, create_project_handoff, get_latest_project_handoff). File reduced to 2,646 lines. Commit a8e25b93."", ""goal_id"": null, ""subtask_id"": null}",,0.605
c9788de4-c1a0-4ac7-9299-4ded59119c7c,ea2f33a4-d808-434b-b776-b7246bd6134a,c4557f4b-02c1-4d60-87f5-902ee804b487,,,"Created 6 new repository files: base.py (69), goals.py (253), branches.py (201), breadcrumbs.py (301), projects.py (253), __init__.py (20). Composition pattern established - all repositories share single SQLite connection.",1765457593.44828,"{""finding"": ""Created 6 new repository files: base.py (69), goals.py (253), branches.py (201), breadcrumbs.py (301), projects.py (253), __init__.py (20). Composition pattern established - all repositories share single SQLite connection."", ""goal_id"": null, ""subtask_id"": null}",,0.605
aa646e27-5055-41af-b697-10a0cd242924,ea2f33a4-d808-434b-b776-b7246bd6134a,c4557f4b-02c1-4d60-87f5-902ee804b487,,,"Fixed project-bootstrap goal progress bug: Query was checking status=""complete"" but actual value is ""completed"". Now correctly shows 4/6 instead of 0/6. Commit c853c5eb.",1765467487.92666,"{""finding"": ""Fixed project-bootstrap goal progress bug: Query was checking status=\""complete\"" but actual value is \""completed\"". Now correctly shows 4/6 instead of 0/6. Commit c853c5eb."", ""goal_id"": null, ""subtask_id"": null}",,0.605
0f4eb992-ce77-44b7-b4fd-c3952260c056,ea2f33a4-d808-434b-b776-b7246bd6134a,c4557f4b-02c1-4d60-87f5-902ee804b487,,,"Verified backward compatibility: All 50 SessionDatabase() instances work unchanged. Facade pattern successful. Both db.method() and db.repository.method() patterns work.",1765467487.95001,"{""finding"": ""Verified backward compatibility: All 50 SessionDatabase() instances work unchanged. Facade pattern successful. Both db.method() and db.repository.method() patterns work."", ""goal_id"": null, ""subtask_id"": null}",,0.605
e03d45e8-e6be-421d-9020-295174398b58,ea2f33a4-d808-434b-b776-b7246bd6134a,c4557f4b-02c1-4d60-87f5-902ee804b487,,,"Fixed project-bootstrap JSON output: Now includes full integrity_analysis lists (66 phantom commands + 3 undocumented) with file locations and context. Enables programmatic doc cleanup by AI agents. Commit f706fb1f.",1765468137.51137,"{""finding"": ""Fixed project-bootstrap JSON output: Now includes full integrity_analysis lists (66 phantom commands + 3 undocumented) with file locations and context. Enables programmatic doc cleanup by AI agents. Commit f706fb1f."", ""goal_id"": null, ""subtask_id"": null}",,0.605
1499a26d-67a2-4311-b2f0-d982725dca31,ea2f33a4-d808-434b-b776-b7246bd6134a,c4557f4b-02c1-4d60-87f5-902ee804b487,,,"Created DOC_CLEANUP_PLAN.md: Multi-AI coordination plan to fix 66 phantom commands. Emphasizes human reasoning over heuristics - many ""phantoms"" are valid examples (shell commands) or instructions. Assigns phases to Devstral/Qwen/Gemini for parallel execution.",1765468191.71842,"{""finding"": ""Created DOC_CLEANUP_PLAN.md: Multi-AI coordination plan to fix 66 phantom commands. Emphasizes human reasoning over heuristics - many \""phantoms\"" are valid examples (shell commands) or instructions. Assigns phases to Devstral/Qwen/Gemini for parallel execution."", ""goal_id"": null, ""subtask_id"": null}",,0.605
42842066-32fa-47a4-8d9f-bdcddf1fa0fe,ea2f33a4-d808-434b-b776-b7246bd6134a,6b3749fd-0202-4a4e-837c-fba29c1b0cba,2b232d4a-0297-43ed-863a-4a5d3f30a94f,771ccf13-9166-47ae-a08c-03bf4ebc50c9,"Project IDs are pure UUIDs generated at creation time (uuid.uuid4()), NOT derived from git repo. Session-to-project mapping happens via git remote URL matching in session_create.py lines 32-49. It queries 'SELECT id FROM projects WHERE repos LIKE %git_url%' to find matching project.",1765540728.79314,"{""finding"": ""Project IDs are pure UUIDs generated at creation time (uuid.uuid4()), NOT derived from git repo. Session-to-project mapping happens via git remote URL matching in session_create.py lines 32-49. It queries 'SELECT id FROM projects WHERE repos LIKE %git_url%' to find matching project."", ""goal_id"": ""2b232d4a-0297-43ed-863a-4a5d3f30a94f"", ""subtask_id"": ""771ccf13-9166-47ae-a08c-03bf4ebc50c9""}",,0.585
76f26580-068b-41bf-babf-66bcd5e5c401,ea2f33a4-d808-434b-b776-b7246bd6134a,6b3749fd-0202-4a4e-837c-fba29c1b0cba,2b232d4a-0297-43ed-863a-4a5d3f30a94f,e9156ff3-40c0-45cd-899d-ea25edf777c0,"Found the duplicate issue: Project 'ea2f33a4' (created 2025-12-09) has repos='[""https://github.com/Nubaeon/empirica.git""]' (full URL) with 1 session. Project 'adea7fe4' (created 2025-12-12, today) has repos='[""empirica""]' (just name) with 0 sessions. The git remote URL matching logic fails because one stores full URL, other stores just repo name. Session creation matched ea2f33a4 because it contains the full git URL.",1765540751.18848,"{""finding"": ""Found the duplicate issue: Project 'ea2f33a4' (created 2025-12-09) has repos='[\""https://github.com/Nubaeon/empirica.git\""]' (full URL) with 1 session. Project 'adea7fe4' (created 2025-12-12, today) has repos='[\""empirica\""]' (just name) with 0 sessions. The git remote URL matching logic fails because one stores full URL, other stores just repo name. Session creation matched ea2f33a4 because it contains the full git URL."", ""goal_id"": ""2b232d4a-0297-43ed-863a-4a5d3f30a94f"", ""subtask_id"": ""e9156ff3-40c0-45cd-899d-ea25edf777c0""}",,0.585
1146dcce-4ddd-4d2d-97c9-39b2fde17084,ea2f33a4-d808-434b-b776-b7246bd6134a,6b3749fd-0202-4a4e-837c-fba29c1b0cba,2b232d4a-0297-43ed-863a-4a5d3f30a94f,4fa33d78-c775-4366-92e1-e6b544bf3b21,"DECISION: Project 'ea2f33a4' should be canonical because: (1) It was created first (2025-12-09 vs 2025-12-12), (2) It already has 1 session linked to it, (3) It contains the full git URL which makes auto-matching work correctly, (4) Current session auto-mapped to it successfully. Project 'adea7fe4' should be deleted - it has 0 sessions, was created today as duplicate, and has incomplete repos data (just name instead of URL).",1765540760.55039,"{""finding"": ""DECISION: Project 'ea2f33a4' should be canonical because: (1) It was created first (2025-12-09 vs 2025-12-12), (2) It already has 1 session linked to it, (3) It contains the full git URL which makes auto-matching work correctly, (4) Current session auto-mapped to it successfully. Project 'adea7fe4' should be deleted - it has 0 sessions, was created today as duplicate, and has incomplete repos data (just name instead of URL)."", ""goal_id"": ""2b232d4a-0297-43ed-863a-4a5d3f30a94f"", ""subtask_id"": ""4fa33d78-c775-4366-92e1-e6b544bf3b21""}",,0.585
