id,session_id,goal_id,mistake,why_wrong,cost_estimate,root_cause_vector,prevention,created_timestamp,mistake_data
8a35f5c5-28d5-4dec-886d-e3570a9bbf6c,4d427e83-2bea-473b-b790-7af8cc5dc48c,,"Forgot to add explicit column lists","UNION requires matching column counts",,,,1767103800.07689,"{""mistake"": ""Forgot to add explicit column lists"", ""why_wrong"": ""UNION requires matching column counts"", ""cost_estimate"": null, ""root_cause_vector"": null, ""prevention"": null, ""goal_id"": null, ""timestamp"": 1767103800.0768893}"
bb361715-93f0-4118-ba00-c94f1cc87cbf,12084d97-9717-4e7c-950c-9272d0a7dad3,,"BayesianBeliefManager.update_belief() called but method doesn't exist","Method signature changed or never implemented - causes non-fatal error during CHECK/POSTFLIGHT",,CONTEXT,"Verify BayesianBeliefManager API before calling, add try/except wrapper",1767365562.23894,"{""mistake"": ""BayesianBeliefManager.update_belief() called but method doesn't exist"", ""why_wrong"": ""Method signature changed or never implemented - causes non-fatal error during CHECK/POSTFLIGHT"", ""cost_estimate"": null, ""root_cause_vector"": ""CONTEXT"", ""prevention"": ""Verify BayesianBeliefManager API before calling, add try/except wrapper"", ""goal_id"": null, ""timestamp"": 1767365562.2389426}"
256a6555-c951-4367-a71c-c91ebecc342f,12084d97-9717-4e7c-950c-9272d0a7dad3,,"CHECK gate returned decision: null instead of proceed/investigate","Auto-compute logic was missing - decision was just passed through from input",,DO,"Implemented auto-compute in workflow_commands.py:513-530 with bias corrections",1767365564.55625,"{""mistake"": ""CHECK gate returned decision: null instead of proceed/investigate"", ""why_wrong"": ""Auto-compute logic was missing - decision was just passed through from input"", ""cost_estimate"": null, ""root_cause_vector"": ""DO"", ""prevention"": ""Implemented auto-compute in workflow_commands.py:513-530 with bias corrections"", ""goal_id"": null, ""timestamp"": 1767365564.5562456}"
086d69fe-aa8b-424e-8b7b-339042b2a7bb,12084d97-9717-4e7c-950c-9272d0a7dad3,,"project_skills/*.yaml not loaded by project-bootstrap","Skill extraction/injection pipeline was designed but wiring was incomplete",,CONTEXT,"Added skill loading in project_commands.py:424-448, verified with test",1767365567.82214,"{""mistake"": ""project_skills/*.yaml not loaded by project-bootstrap"", ""why_wrong"": ""Skill extraction/injection pipeline was designed but wiring was incomplete"", ""cost_estimate"": null, ""root_cause_vector"": ""CONTEXT"", ""prevention"": ""Added skill loading in project_commands.py:424-448, verified with test"", ""goal_id"": null, ""timestamp"": 1767365567.8221345}"
5e5cd796-97f2-4e21-a9f9-f03080868784,745bd3f3-e780-4892-8d8b-2c6c97c9944e,,"Committed telegram_bot and web_chat to empirica/empirica-outreach/ subdir instead of separate empirica-outreach repo","Did not check if empirica-outreach was a separate repo or just a subdir. Assumed subdir was the right place.",,,"Always verify target repo with 'ls -la' and check for .git directory before creating new code directories",1767626529.17373,"{""mistake"": ""Committed telegram_bot and web_chat to empirica/empirica-outreach/ subdir instead of separate empirica-outreach repo"", ""why_wrong"": ""Did not check if empirica-outreach was a separate repo or just a subdir. Assumed subdir was the right place."", ""cost_estimate"": null, ""root_cause_vector"": null, ""prevention"": ""Always verify target repo with 'ls -la' and check for .git directory before creating new code directories"", ""goal_id"": null, ""timestamp"": 1767626529.1737287}"
f97145c5-e705-4ddb-b384-7753c15710a0,dbba2a97-7eb4-4fe5-9872-179ceb6dcce5,,"Migration 015 was failing due to bytecode cache mismatch - old pyc files had code without logger import","Python bytecode cache (__pycache__) was stale after code changes",,context,"Clear __pycache__ after modifying migration files, or run with PYTHONDONTWRITEBYTECODE=1",1767880201.16216,"{""mistake"": ""Migration 015 was failing due to bytecode cache mismatch - old pyc files had code without logger import"", ""why_wrong"": ""Python bytecode cache (__pycache__) was stale after code changes"", ""cost_estimate"": null, ""root_cause_vector"": ""context"", ""prevention"": ""Clear __pycache__ after modifying migration files, or run with PYTHONDONTWRITEBYTECODE=1"", ""goal_id"": null, ""timestamp"": 1767880201.1621614}"
5751769b-2e95-4694-a208-728610c3dcc8,bf846b4d-b7e6-436f-9b07-019b0f7fabfb,,"Created .empirica folder in empirica-playground that conflates app database with session tracking","Empirica CLI walks up directory tree, finds wrong .empirica, uses wrong schema. App auth/users DB should be isolated from epistemic work tracking.","30 minutes debugging schema mismatch",,"App projects should store their operational DBs in app/data/ or similar, not in .empirica. Only create .empirica for actual empirica-tracked projects.",1768396214.72946,"{""mistake"": ""Created .empirica folder in empirica-playground that conflates app database with session tracking"", ""why_wrong"": ""Empirica CLI walks up directory tree, finds wrong .empirica, uses wrong schema. App auth/users DB should be isolated from epistemic work tracking."", ""cost_estimate"": ""30 minutes debugging schema mismatch"", ""root_cause_vector"": null, ""prevention"": ""App projects should store their operational DBs in app/data/ or similar, not in .empirica. Only create .empirica for actual empirica-tracked projects."", ""goal_id"": null, ""timestamp"": 1768396214.729455}"
