id,project_id,session_id,goal_id,subtask_id,unknown,is_resolved,resolved_by,created_timestamp,resolved_timestamp,unknown_data,subject,impact,transaction_id
e77f5311-5897-4655-be62-2391d66e5ea6,748a81a2-ac14-45b8-a185-994997b76828,47784a70-c610-4a31-865b-917932572e59,5e019f75-04ca-4f89-a215-95c2a563fe8a,,"What formally defines the boundary of an epistemic transaction? Current candidates: (1) coherence of changes (fuzzy), (2) user decision (explicit but arbitrary), (3) natural work pivot (implicit but hard to detect), (4) goal completion (too granular), (5) confidence inflection (measurable but requires continuous monitoring). May need to accept this is inherently fuzzy like defining 'a thought' and optimize for pragmatic heuristics rather than formal boundaries.",0,,1770549006.702924,,"{""unknown"": ""What formally defines the boundary of an epistemic transaction? Current candidates: (1) coherence of changes (fuzzy), (2) user decision (explicit but arbitrary), (3) natural work pivot (implicit but hard to detect), (4) goal completion (too granular), (5) confidence inflection (measurable but requires continuous monitoring). May need to accept this is inherently fuzzy like defining 'a thought' and optimize for pragmatic heuristics rather than formal boundaries."", ""goal_id"": ""5e019f75-04ca-4f89-a215-95c2a563fe8a"", ""subtask_id"": null, ""impact"": 0.9, ""transaction_id"": null, ""timestamp"": 1770549006.7029238}",,0.9,
90062118-55ad-48c7-afea-6997311c9c53,748a81a2-ac14-45b8-a185-994997b76828,a46e16f8-5f07-4571-95f0-2ba416264a5d,,,"What exactly did Philipp do to his Claude Code install? What was the auto-initialiser menu he tried to build? What is the current state of his system - is Claude Code completely broken, partially working, or just the Empirica integration broken?",0,,1770549006.7048068,,"{""unknown"": ""What exactly did Philipp do to his Claude Code install? What was the auto-initialiser menu he tried to build? What is the current state of his system - is Claude Code completely broken, partially working, or just the Empirica integration broken?"", ""goal_id"": null, ""subtask_id"": null, ""impact"": 0.5, ""transaction_id"": null, ""timestamp"": 1770549006.7048063}",,0.5,
2f63ffb8-7176-4a2f-b225-91f2b68b3cac,748a81a2-ac14-45b8-a185-994997b76828,9c5decc7-6648-4fd0-b1d7-58c3a01c4d43,,,Can ADK agents meaningfully self-assess epistemic vectors (13 floats) without explicit instructions? LLM-driven agents may need simplified interfaces or wrapper tools that abstract the vector construction.,0,,1770549006.7067218,,"{""unknown"": ""Can ADK agents meaningfully self-assess epistemic vectors (13 floats) without explicit instructions? LLM-driven agents may need simplified interfaces or wrapper tools that abstract the vector construction."", ""goal_id"": null, ""subtask_id"": null, ""impact"": 0.8, ""transaction_id"": null, ""timestamp"": 1770549006.7067213}",,0.8,
972edb08-1a35-48e8-b629-475c9bbd411a,748a81a2-ac14-45b8-a185-994997b76828,84f1b8b5-241a-48b0-8d20-8d4eab1f0146,,,"How to formally measure the entropy state of an epistemic trajectory — what metric captures the gap between verification schema coverage and full output space? Is it expressible as a ratio, a distribution, or requires domain-specific formalization?",0,,1770549006.708618,,"{""unknown"": ""How to formally measure the entropy state of an epistemic trajectory \u2014 what metric captures the gap between verification schema coverage and full output space? Is it expressible as a ratio, a distribution, or requires domain-specific formalization?"", ""goal_id"": null, ""subtask_id"": null, ""impact"": 0.8, ""transaction_id"": null, ""timestamp"": 1770549006.7086177}",,0.8,
21e51f45-a27c-4fe0-8953-7315c165c51c,748a81a2-ac14-45b8-a185-994997b76828,c6613e54-c340-4120-a537-4dd86d500446,bf195856-8013-403d-b7c2-4696faf2b0ec,,Should CLI 'link' and 'unlink' commands migrate from client_projects to creating/deleting engagements? Current: link creates simple client_projects entry. Alternative: link creates engagement with project_id. Need to decide on single source of truth for client-project relationships.,0,,1770549006.7104156,,"{""unknown"": ""Should CLI 'link' and 'unlink' commands migrate from client_projects to creating/deleting engagements? Current: link creates simple client_projects entry. Alternative: link creates engagement with project_id. Need to decide on single source of truth for client-project relationships."", ""goal_id"": ""bf195856-8013-403d-b7c2-4696faf2b0ec"", ""subtask_id"": null, ""impact"": 0.5, ""transaction_id"": null, ""timestamp"": 1770549006.7104154}",,0.5,
095e7338-4603-4cbb-af97-f11f4681dd25,748a81a2-ac14-45b8-a185-994997b76828,47784a70-c610-4a31-865b-917932572e59,,,"Stale active_session_tmux_* files cause statusline to show wrong session data. Root cause: tmux restart leaves orphaned files, and SessionStart hook via MCP may resolve to different TMUX_PANE than expected. Session resolution fallback (Priority 2: DB lookup) shows different project counts. Need cleanup mechanism or session file TTL.",0,,1770549006.7122693,,"{""unknown"": ""Stale active_session_tmux_* files cause statusline to show wrong session data. Root cause: tmux restart leaves orphaned files, and SessionStart hook via MCP may resolve to different TMUX_PANE than expected. Session resolution fallback (Priority 2: DB lookup) shows different project counts. Need cleanup mechanism or session file TTL."", ""goal_id"": null, ""subtask_id"": null, ""impact"": 0.9, ""transaction_id"": null, ""timestamp"": 1770549006.712269}",,0.9,
81b272fa-e48b-4ffb-a3f5-eb85c574d3bb,748a81a2-ac14-45b8-a185-994997b76828,84f1b8b5-241a-48b0-8d20-8d4eab1f0146,,,What is the convergence rate of verification schema expansion? How many trajectory iterations (blindspot detections) are needed to achieve a target coverage level in a given domain? Is there a diminishing returns curve?,0,,1770549006.7141187,,"{""unknown"": ""What is the convergence rate of verification schema expansion? How many trajectory iterations (blindspot detections) are needed to achieve a target coverage level in a given domain? Is there a diminishing returns curve?"", ""goal_id"": null, ""subtask_id"": null, ""impact"": 0.8, ""transaction_id"": null, ""timestamp"": 1770549006.7141185}",,0.8,
a7ab836f-c1fa-4e7d-8966-2ea780d5bc10,748a81a2-ac14-45b8-a185-994997b76828,1110ed11-8735-4901-adea-60d8c9e8ad4f,,,Plugin installer optional memory stack: Should add --with-memory flag or separate install-memory.sh for Qdrant + Ollama + nomic-embed-text setup. Currently memory features require manual setup. Need to decide: bundle or separate?,0,,1770549006.7159734,,"{""unknown"": ""Plugin installer optional memory stack: Should add --with-memory flag or separate install-memory.sh for Qdrant + Ollama + nomic-embed-text setup. Currently memory features require manual setup. Need to decide: bundle or separate?"", ""goal_id"": null, ""subtask_id"": null, ""impact"": 0.8, ""transaction_id"": null, ""timestamp"": 1770549006.7159731}",,0.8,
020041db-a6b5-463d-a563-5bb8b15ba81f,748a81a2-ac14-45b8-a185-994997b76828,9c5decc7-6648-4fd0-b1d7-58c3a01c4d43,,,A2A Agent Card format: what fields map to epistemic state? Need to read the v1.0 draft spec to determine if custom extensions can carry vector data or if a new capability type is needed,0,,1770549006.7177794,,"{""unknown"": ""A2A Agent Card format: what fields map to epistemic state? Need to read the v1.0 draft spec to determine if custom extensions can carry vector data or if a new capability type is needed"", ""goal_id"": null, ""subtask_id"": null, ""impact"": 0.8, ""transaction_id"": null, ""timestamp"": 1770549006.7177792}",,0.8,
d52a1912-5ff4-45c7-8378-c00fea5815fb,748a81a2-ac14-45b8-a185-994997b76828,a8569166-3094-47a8-b1c1-01783176c92e,,,How should per-note visibility work? Need a visibility field on individual notes (private/shared/public) with enforcement at sync time. Questions: should visibility be inherited from channel? Should there be a promotion workflow (private->shared->public)? How does this interact with the immune system and lesson cold storage?,0,,1770549006.7196696,,"{""unknown"": ""How should per-note visibility work? Need a visibility field on individual notes (private/shared/public) with enforcement at sync time. Questions: should visibility be inherited from channel? Should there be a promotion workflow (private->shared->public)? How does this interact with the immune system and lesson cold storage?"", ""goal_id"": null, ""subtask_id"": null, ""impact"": 0.75, ""transaction_id"": null, ""timestamp"": 1770549006.719669}",,0.75,
21ebe7dc-40ed-4d9d-a284-86dac0d6adf9,748a81a2-ac14-45b8-a185-994997b76828,a8569166-3094-47a8-b1c1-01783176c92e,e1eabad2-d97e-4268-8ff4-8bd3e4ab82a9,,"How should learning trajectory data be used if not for bias correction? Options: (1) Pure analytics/dashboards, (2) Inform retrieval depth at PREFLIGHT (high learning velocity → less context needed), (3) Detect learning plateaus (trigger different investigation strategies), (4) All of the above",0,,1770549006.7215722,,"{""unknown"": ""How should learning trajectory data be used if not for bias correction? Options: (1) Pure analytics/dashboards, (2) Inform retrieval depth at PREFLIGHT (high learning velocity \u2192 less context needed), (3) Detect learning plateaus (trigger different investigation strategies), (4) All of the above"", ""goal_id"": ""e1eabad2-d97e-4268-8ff4-8bd3e4ab82a9"", ""subtask_id"": null, ""impact"": 0.75, ""transaction_id"": null, ""timestamp"": 1770549006.7215717}",,0.75,
2f9bb42a-52b3-4049-b38a-f3962be28516,748a81a2-ac14-45b8-a185-994997b76828,a8569166-3094-47a8-b1c1-01783176c92e,,,"How should the evidence mapper weight artifacts by scope? Options: (1) only count goal-linked artifacts for grounding, (2) weight by goal proximity (current goal > session goal > unscoped), (3) separate the grounding score per goal vs per session. Also: should the mapper distinguish artifact intent (knowledge gap vs research question)?",0,,1770549006.723411,,"{""unknown"": ""How should the evidence mapper weight artifacts by scope? Options: (1) only count goal-linked artifacts for grounding, (2) weight by goal proximity (current goal > session goal > unscoped), (3) separate the grounding score per goal vs per session. Also: should the mapper distinguish artifact intent (knowledge gap vs research question)?"", ""goal_id"": null, ""subtask_id"": null, ""impact"": 0.75, ""transaction_id"": null, ""timestamp"": 1770549006.7234108}",,0.75,
b413e0ed-d1d1-4edb-9e7e-676430a5f60d,748a81a2-ac14-45b8-a185-994997b76828,0cb9c4f0-7618-4a97-a1fa-df2ae83ee3fe,,,"Transaction model for sub-agents: Should branches (a) inherit parent's transaction_id and contribute to parent's POSTFLIGHT, (b) create child transactions with explicit rollup, or (c) keep current implicit branch-level measurement? This affects epistemic continuity, calibration accuracy, and aggregate learning tracking.",0,,1770549006.725299,,"{""unknown"": ""Transaction model for sub-agents: Should branches (a) inherit parent's transaction_id and contribute to parent's POSTFLIGHT, (b) create child transactions with explicit rollup, or (c) keep current implicit branch-level measurement? This affects epistemic continuity, calibration accuracy, and aggregate learning tracking."", ""goal_id"": null, ""subtask_id"": null, ""impact"": 0.5, ""transaction_id"": null, ""timestamp"": 1770549006.7252986}",,0.5,
9e59020f-b5a4-418e-913a-17833f7c17d2,748a81a2-ac14-45b8-a185-994997b76828,7707bcf3-2df4-4fc7-8099-45a1dae9ec7a,,,Research agenda: Validate 13 vectors against their claimed epistemic constructs. Do they actually correlate with what they claim to measure? We have 2700+ observations - could run correlation analysis between PREFLIGHT vectors and POSTFLIGHT outcomes. Would give Empirica scientific legitimacy as validated measurement instrument.,0,,1770549006.7271416,,"{""unknown"": ""Research agenda: Validate 13 vectors against their claimed epistemic constructs. Do they actually correlate with what they claim to measure? We have 2700+ observations - could run correlation analysis between PREFLIGHT vectors and POSTFLIGHT outcomes. Would give Empirica scientific legitimacy as validated measurement instrument."", ""goal_id"": null, ""subtask_id"": null, ""impact"": 0.7, ""transaction_id"": null, ""timestamp"": 1770549006.7271414}",,0.7,
c2d5a44a-41de-4ad1-a5e8-80d3c7c6f106,c011772c-e45a-4062-883a-ec4b89b62bdb,c7de8869-763e-481d-9981-c058dbff70bc,,,engagement_tasks store not yet created - praxic layer subtask management. Pattern clear from other stores.,0,,1770549006.728999,,"{""unknown"": ""engagement_tasks store not yet created - praxic layer subtask management. Pattern clear from other stores."", ""goal_id"": null, ""subtask_id"": null, ""impact"": 0.5, ""transaction_id"": null, ""timestamp"": 1770549006.7289984}",,0.5,
6de501d9-8636-4ab4-ac8e-37f8a5f8e615,748a81a2-ac14-45b8-a185-994997b76828,a8569166-3094-47a8-b1c1-01783176c92e,,,Should the paper's primary framing shift from 'epistemic self-assessment framework' to 'cognitive operating system'? The OS mapping is complete and compelling but changes the positioning significantly. May warrant a separate paper or may strengthen this one by providing the architectural argument for why all the subsystems are needed together.,0,,1770549006.7308357,,"{""unknown"": ""Should the paper's primary framing shift from 'epistemic self-assessment framework' to 'cognitive operating system'? The OS mapping is complete and compelling but changes the positioning significantly. May warrant a separate paper or may strengthen this one by providing the architectural argument for why all the subsystems are needed together."", ""goal_id"": null, ""subtask_id"": null, ""impact"": 0.75, ""transaction_id"": null, ""timestamp"": 1770549006.7308354}",,0.75,
bb0471c9-654e-45bc-b9fe-fc577261289f,748a81a2-ac14-45b8-a185-994997b76828,f8e28dea-0fec-4f09-98a4-1e4708ee4143,c9a464f7-20f2-4818-bbb5-17528e7b7e3e,,"Which of the 30+ remaining CLI commands with required session_id should use unified pattern? Categories: (1) Noetic logging commands (act-log, investigate-log) - likely candidates, (2) Query commands (epistemics-list, checkpoint-diff) - probably stay required, (3) Agent commands (spawn, aggregate) - need parent context, (4) Memory commands - session-specific operations",0,,1770549006.7327824,,"{""unknown"": ""Which of the 30+ remaining CLI commands with required session_id should use unified pattern? Categories: (1) Noetic logging commands (act-log, investigate-log) - likely candidates, (2) Query commands (epistemics-list, checkpoint-diff) - probably stay required, (3) Agent commands (spawn, aggregate) - need parent context, (4) Memory commands - session-specific operations"", ""goal_id"": ""c9a464f7-20f2-4818-bbb5-17528e7b7e3e"", ""subtask_id"": null, ""impact"": 0.5, ""transaction_id"": null, ""timestamp"": 1770549006.7327816}",,0.5,
371c1bc6-f144-4616-b8ab-8fd254cb205b,748a81a2-ac14-45b8-a185-994997b76828,a8569166-3094-47a8-b1c1-01783176c92e,,,"Philipp's orphaned global DB at ~/.empirica/sessions/sessions.db (2.3MB) contains mixed epistemic data from multiple projects. Should it be migrated into per-project DBs, archived, or deleted? Need to audit what's in there and whether any session/goal data would be lost.",0,,1770549006.7346673,,"{""unknown"": ""Philipp's orphaned global DB at ~/.empirica/sessions/sessions.db (2.3MB) contains mixed epistemic data from multiple projects. Should it be migrated into per-project DBs, archived, or deleted? Need to audit what's in there and whether any session/goal data would be lost."", ""goal_id"": null, ""subtask_id"": null, ""impact"": 0.75, ""transaction_id"": null, ""timestamp"": 1770549006.7346668}",,0.75,
341cfdbf-b893-4a6e-91d0-13ddff52950d,748a81a2-ac14-45b8-a185-994997b76828,7707bcf3-2df4-4fc7-8099-45a1dae9ec7a,,,"Shared blind spot problem: Human-AI calibration fails when both parties have overlapping misconceptions. Empirical grounding (outcomes) helps but doesn't catch blind spots that don't manifest as observable failures. How do we detect ""unknown unknowns"" neither party thinks to question?",0,,1770549006.7365167,,"{""unknown"": ""Shared blind spot problem: Human-AI calibration fails when both parties have overlapping misconceptions. Empirical grounding (outcomes) helps but doesn't catch blind spots that don't manifest as observable failures. How do we detect \""unknown unknowns\"" neither party thinks to question?"", ""goal_id"": null, ""subtask_id"": null, ""impact"": 0.7, ""transaction_id"": null, ""timestamp"": 1770549006.736516}",,0.7,
8657f1bd-6685-4d88-89f4-7e80ffaea3cc,748a81a2-ac14-45b8-a185-994997b76828,a46e16f8-5f07-4571-95f0-2ba416264a5d,f7b402a9-b679-4804-af28-273de4009769,,"How should goal-bound agents inherit epistemic state? Options: (a) inherit from parent session vectors, (b) derive from goal's logged unknowns, (c) synthesize from both. Also unclear: should agent findings auto-link to the goal that spawned them?",0,,1770549006.738315,,"{""unknown"": ""How should goal-bound agents inherit epistemic state? Options: (a) inherit from parent session vectors, (b) derive from goal's logged unknowns, (c) synthesize from both. Also unclear: should agent findings auto-link to the goal that spawned them?"", ""goal_id"": ""f7b402a9-b679-4804-af28-273de4009769"", ""subtask_id"": null, ""impact"": 0.5, ""transaction_id"": null, ""timestamp"": 1770549006.7383149}",,0.5,
89e5a051-d60f-4f6b-a8ac-b3ed3987a210,748a81a2-ac14-45b8-a185-994997b76828,2acef5ed-a624-4e2e-a020-a3f6aa724ae0,61cb4217-7994-4c79-88b8-66dc047055e6,,"User said 'the empirica project now only has 200 odd sessions' but investigation found 691 in that DB. Of those: 210 belong to the actual Empirica Framework project_id, 294 are orphans (referencing deleted project_id ea2f33a4), 184 have NULL project_id. The '200 odd' may refer to the 210 properly-linked sessions. Need to clarify if orphan/NULL sessions should be cleaned up or reassigned.",0,,1770549006.7401817,,"{""unknown"": ""User said 'the empirica project now only has 200 odd sessions' but investigation found 691 in that DB. Of those: 210 belong to the actual Empirica Framework project_id, 294 are orphans (referencing deleted project_id ea2f33a4), 184 have NULL project_id. The '200 odd' may refer to the 210 properly-linked sessions. Need to clarify if orphan/NULL sessions should be cleaned up or reassigned."", ""goal_id"": ""61cb4217-7994-4c79-88b8-66dc047055e6"", ""subtask_id"": null, ""impact"": 0.75, ""transaction_id"": null, ""timestamp"": 1770549006.7401814}",,0.75,
8c1b28bf-e5f3-45b1-8735-94110a4f9938,748a81a2-ac14-45b8-a185-994997b76828,95c9c7bf-e6d5-4870-b8de-a41c3790f659,,,"project-embed rehydration incomplete: Populates memory collection but not eidetic from SQLite findings. For repo sharing / container deployment, should rebuild full Qdrant state including eidetic facts with confidence. Current workaround: use --type all for search.",0,,1770549006.7422678,,"{""unknown"": ""project-embed rehydration incomplete: Populates memory collection but not eidetic from SQLite findings. For repo sharing / container deployment, should rebuild full Qdrant state including eidetic facts with confidence. Current workaround: use --type all for search."", ""goal_id"": null, ""subtask_id"": null, ""impact"": 0.8, ""transaction_id"": null, ""timestamp"": 1770549006.7422671}",,0.8,
36e7d1d7-5638-4dba-8fa0-2a9b6eb34a8d,748a81a2-ac14-45b8-a185-994997b76828,2acef5ed-a624-4e2e-a020-a3f6aa724ae0,2125c0a9-10dc-4a9d-91d2-3c4c6aece556,,AlignmentCheck (goal hijacking detector) in LlamaFirewall - is this distinct from PromptGuard 2? Can it detect when an agent's objectives are being redirected by another agent? Critical for inter-agent trust.,0,,1770549006.7441654,,"{""unknown"": ""AlignmentCheck (goal hijacking detector) in LlamaFirewall - is this distinct from PromptGuard 2? Can it detect when an agent's objectives are being redirected by another agent? Critical for inter-agent trust."", ""goal_id"": ""2125c0a9-10dc-4a9d-91d2-3c4c6aece556"", ""subtask_id"": null, ""impact"": 0.75, ""transaction_id"": null, ""timestamp"": 1770549006.7441647}",,0.75,
77b37435-57a6-498d-982f-86b2684cfad2,748a81a2-ac14-45b8-a185-994997b76828,a8569166-3094-47a8-b1c1-01783176c92e,,,"How to detect and handle git squash/rebase workflows that destroy intermediate history. Some teams squash before merge, losing the fine-grained trajectory data. Need either pre-squash extraction or alternative evidence collection for squash-heavy workflows.",0,,1770549006.746006,,"{""unknown"": ""How to detect and handle git squash/rebase workflows that destroy intermediate history. Some teams squash before merge, losing the fine-grained trajectory data. Need either pre-squash extraction or alternative evidence collection for squash-heavy workflows."", ""goal_id"": null, ""subtask_id"": null, ""impact"": 0.75, ""transaction_id"": null, ""timestamp"": 1770549006.7460055}",,0.75,
a7f25247-7c0a-46de-98f8-7f8bfff6fb3a,748a81a2-ac14-45b8-a185-994997b76828,2acef5ed-a624-4e2e-a020-a3f6aa724ae0,2125c0a9-10dc-4a9d-91d2-3c4c6aece556,,How to extract and calibrate confidence scores from PromptGuard 2 and Llama Guard 3 outputs to feed into epistemic envelope? Need to validate that probability distributions are well-calibrated before using as confidence signals.,0,,1770549006.7478712,,"{""unknown"": ""How to extract and calibrate confidence scores from PromptGuard 2 and Llama Guard 3 outputs to feed into epistemic envelope? Need to validate that probability distributions are well-calibrated before using as confidence signals."", ""goal_id"": ""2125c0a9-10dc-4a9d-91d2-3c4c6aece556"", ""subtask_id"": null, ""impact"": 0.75, ""transaction_id"": null, ""timestamp"": 1770549006.7478707}",,0.75,
b3942c2a-4caa-49d1-b9ce-424b76cca4b7,748a81a2-ac14-45b8-a185-994997b76828,a8569166-3094-47a8-b1c1-01783176c92e,,,"How to normalize git timing signals across different AI models and hardware. Commit timestamp gaps depend on model inference speed, tool latency, and human interruptions — need to isolate the epistemic signal (investigation vs execution) from infrastructure noise.",0,,1770549006.751703,,"{""unknown"": ""How to normalize git timing signals across different AI models and hardware. Commit timestamp gaps depend on model inference speed, tool latency, and human interruptions \u2014 need to isolate the epistemic signal (investigation vs execution) from infrastructure noise."", ""goal_id"": null, ""subtask_id"": null, ""impact"": 0.75, ""transaction_id"": null, ""timestamp"": 1770549006.7517023}",,0.75,
a407585f-f50f-4878-93ba-13031a7f2ccc,748a81a2-ac14-45b8-a185-994997b76828,a8569166-3094-47a8-b1c1-01783176c92e,,,"How to handle git reflog in multi-agent scenarios where multiple AIs share a repo. Attribution of resets, rebases, and abandoned branches to specific agents is needed for per-agent calibration. Current reflog doesn't tag by AI identity.",0,,1770549006.7536008,,"{""unknown"": ""How to handle git reflog in multi-agent scenarios where multiple AIs share a repo. Attribution of resets, rebases, and abandoned branches to specific agents is needed for per-agent calibration. Current reflog doesn't tag by AI identity."", ""goal_id"": null, ""subtask_id"": null, ""impact"": 0.75, ""transaction_id"": null, ""timestamp"": 1770549006.7536}",,0.75,
bf41ee4b-d421-401e-a811-0d1eb226ac89,748a81a2-ac14-45b8-a185-994997b76828,2bc1da78-2a28-4745-b75b-f021d563d819,5df8d3a8-a3dc-4e75-a6a7-b621576c8bfd,,"Sentinel && chain fix works for simple commands (--flags) and pipes (echo | cmd), but heredocs (cmd - << 'EOF') still blocked. The multi-line heredoc content may be included in the command string, breaking the split logic. Need to investigate how Bash tool sends heredoc commands to hooks.",0,,1770549006.755532,,"{""unknown"": ""Sentinel && chain fix works for simple commands (--flags) and pipes (echo | cmd), but heredocs (cmd - << 'EOF') still blocked. The multi-line heredoc content may be included in the command string, breaking the split logic. Need to investigate how Bash tool sends heredoc commands to hooks."", ""goal_id"": ""5df8d3a8-a3dc-4e75-a6a7-b621576c8bfd"", ""subtask_id"": null, ""impact"": 0.5, ""transaction_id"": null, ""timestamp"": 1770549006.7555318}",,0.5,
90dc66c0-d7a9-4b54-a719-b9ca141ca0d1,748a81a2-ac14-45b8-a185-994997b76828,2acef5ed-a624-4e2e-a020-a3f6aa724ae0,2125c0a9-10dc-4a9d-91d2-3c4c6aece556,,"How does Noetic Firewall integrate with existing Sentinel? Are they separate systems (Sentinel = workflow gate, Firewall = inter-agent comms) or should Firewall be a Sentinel subsystem? Need to verify against codebase.",0,,1770549006.7574034,,"{""unknown"": ""How does Noetic Firewall integrate with existing Sentinel? Are they separate systems (Sentinel = workflow gate, Firewall = inter-agent comms) or should Firewall be a Sentinel subsystem? Need to verify against codebase."", ""goal_id"": ""2125c0a9-10dc-4a9d-91d2-3c4c6aece556"", ""subtask_id"": null, ""impact"": 0.75, ""transaction_id"": null, ""timestamp"": 1770549006.7574031}",,0.75,
