id,project_id,session_id,goal_id,subtask_id,unknown,is_resolved,resolved_by,created_timestamp,resolved_timestamp,unknown_data,subject,impact,transaction_id
73a93233-0999-455b-83e5-5cd50d4c1e95,3be592bd-651d-47f6-8dcd-eec78df7ebfd,49f4486e-c475-401b-bb09-f6a7c83e034c,,,How to auto-generate mistake patterns with LLM analysis?,1,LLM analysis integrated via project-embed semantic patterns,1765308976.3811886,1766925693.564212,"{""unknown"": ""How to auto-generate mistake patterns with LLM analysis?"", ""goal_id"": null, ""subtask_id"": null}",,0.5,
bd0bb320-38a0-45f6-ba9d-0f782c5843c2,3be592bd-651d-47f6-8dcd-eec78df7ebfd,49f4486e-c475-401b-bb09-f6a7c83e034c,,,"How to handle information overload in projects with 500+ sessions, 2000+ findings? Need prioritization, recency weighting, relevance filtering, or LLM summarization.",1,Test resolution for human output format,1765310673.2725053,1766925713.334425,"{""unknown"": ""How to handle information overload in projects with 500+ sessions, 2000+ findings? Need prioritization, recency weighting, relevance filtering, or LLM summarization."", ""goal_id"": null, ""subtask_id"": null}",,0.5,
eb341919-ee5d-498e-9dd7-16e8ac8d1020,3be592bd-651d-47f6-8dcd-eec78df7ebfd,49f4486e-c475-401b-bb09-f6a7c83e034c,,,"How to handle stale unknowns (6+ months old, no longer relevant)? Need expiration mechanism or manual review prompts.",0,,1765310673.4511702,,"{""unknown"": ""How to handle stale unknowns (6+ months old, no longer relevant)? Need expiration mechanism or manual review prompts."", ""goal_id"": null, ""subtask_id"": null}",,0.5,
1ee9a28a-3879-484e-be1c-9bf77b29d427,3be592bd-651d-47f6-8dcd-eec78df7ebfd,49f4486e-c475-401b-bb09-f6a7c83e034c,,,"How to detect and resolve conflicting findings (Session 5: 'Use X', Session 12: 'Use Y')? Need finding versioning or conflict detection.",0,,1765310673.633024,,"{""unknown"": ""How to detect and resolve conflicting findings (Session 5: 'Use X', Session 12: 'Use Y')? Need finding versioning or conflict detection."", ""goal_id"": null, ""subtask_id"": null}",,0.5,
b465988d-5a97-471a-a265-559a1e5ca5bc,3be592bd-651d-47f6-8dcd-eec78df7ebfd,49f4486e-c475-401b-bb09-f6a7c83e034c,,,"How to ensure finding quality (prevent vague, non-actionable findings)? Need quality scoring, templates, or review process.",0,,1765310673.814199,,"{""unknown"": ""How to ensure finding quality (prevent vague, non-actionable findings)? Need quality scoring, templates, or review process."", ""goal_id"": null, ""subtask_id"": null}",,0.5,
165b198c-ba1f-4732-b9cf-96f013ab5d30,3be592bd-651d-47f6-8dcd-eec78df7ebfd,49f4486e-c475-401b-bb09-f6a7c83e034c,,,"How to handle multi-user coordination (conflicting findings from different developers)? Need real-time sync, conflict resolution, discussion threads.",0,,1765310673.9997513,,"{""unknown"": ""How to handle multi-user coordination (conflicting findings from different developers)? Need real-time sync, conflict resolution, discussion threads."", ""goal_id"": null, ""subtask_id"": null}",,0.5,
a476c3c4-a202-4d39-94ae-34ad757a493d,3be592bd-651d-47f6-8dcd-eec78df7ebfd,49f4486e-c475-401b-bb09-f6a7c83e034c,,,"How to handle privacy and security (findings with API keys, credentials)? Need classification, access control, auto-redaction. Critical for commercial use.",0,,1765310674.1828783,,"{""unknown"": ""How to handle privacy and security (findings with API keys, credentials)? Need classification, access control, auto-redaction. Critical for commercial use."", ""goal_id"": null, ""subtask_id"": null}",,0.5,
15a19b6e-a001-49f2-858d-ee06fabccd60,3be592bd-651d-47f6-8dcd-eec78df7ebfd,49f4486e-c475-401b-bb09-f6a7c83e034c,,,"How to enable cross-project learning (Project A solves Y, Project B has same problem Y)? Need cross-project search, pattern library, recommendation system.",0,,1765310674.3601031,,"{""unknown"": ""How to enable cross-project learning (Project A solves Y, Project B has same problem Y)? Need cross-project search, pattern library, recommendation system."", ""goal_id"": null, ""subtask_id"": null}",,0.5,
b1e2ea2c-cf4a-4bf3-a866-bc2b8ecd114a,3be592bd-651d-47f6-8dcd-eec78df7ebfd,3978cc40-f6c3-44de-98c0-da9b8ce482a5,,,How to optimize MCP cost for programmatic CLI calls vs direct Python?,0,,1765314479.3048067,,"{""unknown"": ""How to optimize MCP cost for programmatic CLI calls vs direct Python?"", ""goal_id"": null, ""subtask_id"": null}",,0.5,
323593d8-8c77-4dfe-8665-f07e5898ed6f,3be592bd-651d-47f6-8dcd-eec78df7ebfd,5720c635-5189-4625-82be-9762c6d470ee,,,"Phase 2: How to implement Qdrant embeddings for semantic search across docs, findings, unknowns, mistakes?",1,"Qdrant semantic search fully implemented. Collections: project_{id}_memory (findings/unknowns/dead_ends), project_{id}_docs, project_{id}_epistemics, global_learnings, personas. All migrated to 768-dim Ollama vectors.",1765371540.5891838,1767372594.0256321,"{""unknown"": ""Phase 2: How to implement Qdrant embeddings for semantic search across docs, findings, unknowns, mistakes?"", ""goal_id"": null, ""subtask_id"": null}",,0.5,
f92e9f0d-cd98-4ea4-9f67-e0a2143c7e41,3be592bd-651d-47f6-8dcd-eec78df7ebfd,5720c635-5189-4625-82be-9762c6d470ee,,,"Phase 3: How to implement uncertainty-driven bootstrap that loads context depth based on UNCERTAINTY vector (high uncertainty → more docs, low uncertainty → fewer docs)?",0,,1765371540.7816675,,"{""unknown"": ""Phase 3: How to implement uncertainty-driven bootstrap that loads context depth based on UNCERTAINTY vector (high uncertainty \u2192 more docs, low uncertainty \u2192 fewer docs)?"", ""goal_id"": null, ""subtask_id"": null}",,0.5,
2a9da4f4-a3f5-4bfe-95d2-29a78406dabb,748a81a2-ac14-45b8-a185-994997b76828,c4557f4b-02c1-4d60-87f5-902ee804b487,d12bcde4-f387-41ac-8ed3-cb360d7ad408,,"ProjectRepository has 3 methods still need delegation: create_project, link_session_to_project, aggregate_project_learning_deltas",1,Commit a8e25b93: All 7 ProjectRepository methods delegated and tested,1765454912.2990346,1765457593.4195065,"{""unknown"": ""ProjectRepository has 3 methods still need delegation: create_project, link_session_to_project, aggregate_project_learning_deltas"", ""goal_id"": ""d12bcde4-f387-41ac-8ed3-cb360d7ad408"", ""subtask_id"": null}",,0.5,
477213af-0236-463f-af74-1da300e63e4a,748a81a2-ac14-45b8-a185-994997b76828,c4557f4b-02c1-4d60-87f5-902ee804b487,d12bcde4-f387-41ac-8ed3-cb360d7ad408,,bootstrap_project_breadcrumbs kept in facade due to complex cross-repository orchestration (breadcrumbs + goals + handoffs),1,Investigation complete - resolution documented in findings,1765454912.4702494,1767278138.0914397,"{""unknown"": ""bootstrap_project_breadcrumbs kept in facade due to complex cross-repository orchestration (breadcrumbs + goals + handoffs)"", ""goal_id"": ""d12bcde4-f387-41ac-8ed3-cb360d7ad408"", ""subtask_id"": null}",,0.5,
50068ac1-593d-4435-9caa-6902bd45a9c4,748a81a2-ac14-45b8-a185-994997b76828,c4557f4b-02c1-4d60-87f5-902ee804b487,d12bcde4-f387-41ac-8ed3-cb360d7ad408,,EpistemicRepository (21 methods) and SessionRepository (10 methods) still pending extraction - largest remaining work,1,Investigation complete - resolution documented in findings,1765454912.6352444,1767278137.823298,"{""unknown"": ""EpistemicRepository (21 methods) and SessionRepository (10 methods) still pending extraction - largest remaining work"", ""goal_id"": ""d12bcde4-f387-41ac-8ed3-cb360d7ad408"", ""subtask_id"": null}",,0.5,
97b43241-e0a3-4388-808a-d1345e652b92,748a81a2-ac14-45b8-a185-994997b76828,c3174883-172b-4a2b-a760-917a7082d2cd,fbe2610c-f637-4e27-8119-da38b739d034,,"BROKEN FUNCTIONALITY: Config.yml update blocked by Unicode character encoding mismatch (\u escape sequences vs actual Unicode). Automated find_and_replace_code cannot match the exact string. Requires either: (1) manual copy/paste from /tmp/empirica_system_prompt_v4.1.txt, (2) script to handle Unicode normalization, or (3) direct file write with proper encoding.",1,Investigation complete - resolution documented in findings,1765541609.7009394,1767278137.5533683,"{""unknown"": ""BROKEN FUNCTIONALITY: Config.yml update blocked by Unicode character encoding mismatch (\\u escape sequences vs actual Unicode). Automated find_and_replace_code cannot match the exact string. Requires either: (1) manual copy/paste from /tmp/empirica_system_prompt_v4.1.txt, (2) script to handle Unicode normalization, or (3) direct file write with proper encoding."", ""goal_id"": ""fbe2610c-f637-4e27-8119-da38b739d034"", ""subtask_id"": null}",,0.5,
94c0424f-5e2a-4654-970a-0e8cbc2a36b2,748a81a2-ac14-45b8-a185-994997b76828,5e22164f-b7a9-42cf-be0b-39e8376c73bb,,,"EMPIRICA POSITIONING UNCLEAR: Is Empirica competing with LLM observability tools (LangSmith, Langfuse) or is it a different category entirely (epistemic infrastructure vs performance monitoring)? Are we observability or are we cognitive OS? What is our competitive differentiation vs LangChain/W&B?",1,Investigation complete - resolution documented in findings,1765652893.131387,1767278137.2851627,"{""unknown"": ""EMPIRICA POSITIONING UNCLEAR: Is Empirica competing with LLM observability tools (LangSmith, Langfuse) or is it a different category entirely (epistemic infrastructure vs performance monitoring)? Are we observability or are we cognitive OS? What is our competitive differentiation vs LangChain/W&B?"", ""goal_id"": null, ""subtask_id"": null}",,0.5,
16da4660-a564-4e8a-8af2-88cfea43888d,748a81a2-ac14-45b8-a185-994997b76828,5e22164f-b7a9-42cf-be0b-39e8376c73bb,,,USER CONSTRAINTS UNKNOWN: What is user's runway/budget? Solo founder or team? Bootstrap or fundraise path? Timeline pressure (need revenue NOW vs can build for 12-18 months)? Risk tolerance (enterprise sales cycles vs fast developer revenue)? Technical constraints (can they support enterprise deployments? cloud infrastructure ready?)?,1,Investigation complete - resolution documented in findings,1765652894.6788538,1767278137.014235,"{""unknown"": ""USER CONSTRAINTS UNKNOWN: What is user's runway/budget? Solo founder or team? Bootstrap or fundraise path? Timeline pressure (need revenue NOW vs can build for 12-18 months)? Risk tolerance (enterprise sales cycles vs fast developer revenue)? Technical constraints (can they support enterprise deployments? cloud infrastructure ready?)?"", ""goal_id"": null, ""subtask_id"": null}",,0.5,
96192344-ca5f-470d-b86b-fbaf250e2a18,748a81a2-ac14-45b8-a185-994997b76828,5e22164f-b7a9-42cf-be0b-39e8376c73bb,,,EXISTING TRACTION UNKNOWN: Does user have ANY paying customers? Warm leads? People who expressed interest? How many people have tried Empirica? What was the conversion/retention? The person who had '\''existential conversation'\'' - who are they and could they be first customer?,1,Investigation complete - resolution documented in findings,1765652896.136236,1767278136.7424588,"{""unknown"": ""EXISTING TRACTION UNKNOWN: Does user have ANY paying customers? Warm leads? People who expressed interest? How many people have tried Empirica? What was the conversion/retention? The person who had '\\''existential conversation'\\'' - who are they and could they be first customer?"", ""goal_id"": null, ""subtask_id"": null}",,0.5,
d1b726e3-993c-4a3a-bd10-503c03c2ea92,748a81a2-ac14-45b8-a185-994997b76828,5e22164f-b7a9-42cf-be0b-39e8376c73bb,,,DEFENSIBILITY/MOAT UNCLEAR: What prevents someone from copying Empirica? Is it: (1) Technical complexity of git isomorphism + CASCADE? (2) First-mover in epistemic infrastructure category? (3) Network effects (more agents using = more valuable)? (4) Data moat (CASCADE deltas as training data)? What is sustainable competitive advantage?,1,Investigation complete - resolution documented in findings,1765652897.4780512,1767278136.4730628,"{""unknown"": ""DEFENSIBILITY/MOAT UNCLEAR: What prevents someone from copying Empirica? Is it: (1) Technical complexity of git isomorphism + CASCADE? (2) First-mover in epistemic infrastructure category? (3) Network effects (more agents using = more valuable)? (4) Data moat (CASCADE deltas as training data)? What is sustainable competitive advantage?"", ""goal_id"": null, ""subtask_id"": null}",,0.5,
0d185bbc-6666-486c-9d0e-3f6fc02de5ab,748a81a2-ac14-45b8-a185-994997b76828,5e22164f-b7a9-42cf-be0b-39e8376c73bb,,,"TARGET CUSTOMER UNCLEAR: Who is the actual buyer? AI researchers (academic, low budget)? AI startups (limited runway, need ROI fast)? Enterprises with multi-agent systems (deep pockets, long sales cycles)? Autonomous systems companies (safety-critical, regulatory requirements)? Each requires completely different GTM motion.",1,Investigation complete - resolution documented in findings,1765652898.7431583,1767278136.2028885,"{""unknown"": ""TARGET CUSTOMER UNCLEAR: Who is the actual buyer? AI researchers (academic, low budget)? AI startups (limited runway, need ROI fast)? Enterprises with multi-agent systems (deep pockets, long sales cycles)? Autonomous systems companies (safety-critical, regulatory requirements)? Each requires completely different GTM motion."", ""goal_id"": null, ""subtask_id"": null}",,0.5,
c72da5ad-59a1-4775-b1fe-fa0fdfcf51e0,748a81a2-ac14-45b8-a185-994997b76828,5e22164f-b7a9-42cf-be0b-39e8376c73bb,,,PAIN POINT VALIDATION: Is epistemic self-awareness a '\''nice-to-have'\'' or '\''must-have'\''? Who feels the pain most acutely RIGHT NOW? Context loss? Memory gaps? Multi-agent coordination? Training data generation? Need to validate which pain point has urgency and budget behind it.,1,Investigation complete - resolution documented in findings,1765652900.1942265,1767278135.9334528,"{""unknown"": ""PAIN POINT VALIDATION: Is epistemic self-awareness a '\\''nice-to-have'\\'' or '\\''must-have'\\''? Who feels the pain most acutely RIGHT NOW? Context loss? Memory gaps? Multi-agent coordination? Training data generation? Need to validate which pain point has urgency and budget behind it."", ""goal_id"": null, ""subtask_id"": null}",,0.5,
bdc1d74b-6fc8-45d8-b4ab-21a854b7f954,748a81a2-ac14-45b8-a185-994997b76828,4bb57fff-6fc0-4643-85f2-7286b7ded253,,,Git config permission error: '/etc/gitconfig' access denied. Need to investigate if this is blocking git notes storage or just a warning.,1,Investigation complete - resolution documented in findings,1765741543.605912,1767278135.6641397,"{""unknown"": ""Git config permission error: '/etc/gitconfig' access denied. Need to investigate if this is blocking git notes storage or just a warning."", ""goal_id"": null, ""subtask_id"": null}",,0.5,
96e59c39-1f3f-4868-93df-0d32a4535b8d,748a81a2-ac14-45b8-a185-994997b76828,6ef91f75-fc74-4212-8d24-e7c060d1586f,,,Should we enforce PREFLIGHT before allowing CHECK/POSTFLIGHT? Or is it acceptable to skip PREFLIGHT for quick sessions?,1,Investigation complete - resolution documented in findings,1765742799.2707527,1767278135.404324,"{""unknown"": ""Should we enforce PREFLIGHT before allowing CHECK/POSTFLIGHT? Or is it acceptable to skip PREFLIGHT for quick sessions?"", ""goal_id"": null, ""subtask_id"": null}",,0.5,
89012ce9-7ac3-4a12-8dbd-2018f2ea034e,748a81a2-ac14-45b8-a185-994997b76828,b4f4a721-ada9-40c9-8082-dc501313d366,ae80233e-91d8-4635-9ee6-64d331194531,,"Best audio transcription method for VideoProcessor: Whisper API, local Whisper, or AssemblyAI?",1,Investigation complete - resolution documented in findings,1766061267.0422752,1767278134.8617802,"{""unknown"": ""Best audio transcription method for VideoProcessor: Whisper API, local Whisper, or AssemblyAI?"", ""goal_id"": ""ae80233e-91d8-4635-9ee6-64d331194531"", ""subtask_id"": null}",,0.5,
f5d0005e-36bd-4d16-ab11-7bbb883cec2b,748a81a2-ac14-45b8-a185-994997b76828,b4f4a721-ada9-40c9-8082-dc501313d366,ae80233e-91d8-4635-9ee6-64d331194531,,How to integrate with external multimodal models: API calls vs manual prompt copy/paste?,1,Investigation complete - resolution documented in findings,1766061267.2622125,1767278134.5903962,"{""unknown"": ""How to integrate with external multimodal models: API calls vs manual prompt copy/paste?"", ""goal_id"": ""ae80233e-91d8-4635-9ee6-64d331194531"", ""subtask_id"": null}",,0.5,
4c6631f0-7708-4007-b88a-677cc6840905,748a81a2-ac14-45b8-a185-994997b76828,b4f4a721-ada9-40c9-8082-dc501313d366,ae80233e-91d8-4635-9ee6-64d331194531,,Optimal thresholds for critique severity (critical vs high vs medium) - need user testing?,1,Investigation complete - resolution documented in findings,1766061267.4906187,1767278134.3183203,"{""unknown"": ""Optimal thresholds for critique severity (critical vs high vs medium) - need user testing?"", ""goal_id"": ""ae80233e-91d8-4635-9ee6-64d331194531"", ""subtask_id"": null}",,0.5,
a5773c95-30e8-426e-8a11-2a614e8b5b32,748a81a2-ac14-45b8-a185-994997b76828,d40bb703-8752-4f93-a0a3-1ffccec3a59a,f3888efa-2fdd-49d0-b921-9e8d3950dccf,,🚀 ULTIMATE TEST: Everything working!,1,Investigation complete - resolution documented in findings,1766061274.5451455,1767278134.04808,"{""unknown"": ""\ud83d\ude80 ULTIMATE TEST: Everything working!"", ""goal_id"": ""f3888efa-2fdd-49d0-b921-9e8d3950dccf"", ""subtask_id"": null}",,0.5,
a5c446ee-59c3-48de-8b00-f72ecbfb1e70,748a81a2-ac14-45b8-a185-994997b76828,0554f1d4-88dd-4010-b82a-119535b9bcf8,,,Origin of 'no such table: handoffs' error message - RESOLVED: was documentation artifact only,1,Investigation complete - resolution documented in findings,1766317470.319956,1767278133.7782772,"{""unknown"": ""Origin of 'no such table: handoffs' error message - RESOLVED: was documentation artifact only"", ""goal_id"": null, ""subtask_id"": null}",handoff-system-cleanup,0.5,
425a42e3-1dbf-4ed0-a001-24e1f400410d,748a81a2-ac14-45b8-a185-994997b76828,1e9530e5-0757-4f02-9738-cdd58a5272cb,b7abdaa6-945f-4a38-a8f2-3fc011228b77,,Git repo discovery approach: scan parent directory vs recursive git commands vs config file,1,Investigation complete - resolution documented in findings,1766418452.725674,1767278133.5097995,"{""unknown"": ""Git repo discovery approach: scan parent directory vs recursive git commands vs config file"", ""goal_id"": ""b7abdaa6-945f-4a38-a8f2-3fc011228b77"", ""subtask_id"": null}",,0.5,
e0b72443-5f69-483f-adc6-6b3809f85f09,748a81a2-ac14-45b8-a185-994997b76828,1e9530e5-0757-4f02-9738-cdd58a5272cb,b7abdaa6-945f-4a38-a8f2-3fc011228b77,,Should workspace-map auto-create missing projects or just suggest them to user?,1,Investigation complete - resolution documented in findings,1766418452.9695528,1767278133.241598,"{""unknown"": ""Should workspace-map auto-create missing projects or just suggest them to user?"", ""goal_id"": ""b7abdaa6-945f-4a38-a8f2-3fc011228b77"", ""subtask_id"": null}",,0.5,
6b6f1ee0-8ad6-4896-8183-6f5857be31dd,748a81a2-ac14-45b8-a185-994997b76828,f729e984-71c9-4628-af2a-2415b6067224,,,How to integrate enrichment into finding-log/unknown-log/deadend-log without syntax errors (sed approach failed),1,Investigation complete - resolution documented in findings,1766431157.5392127,1767278132.9723346,"{""unknown"": ""How to integrate enrichment into finding-log/unknown-log/deadend-log without syntax errors (sed approach failed)"", ""goal_id"": null, ""subtask_id"": null}",,0.5,
4b6c89e4-b335-4db5-a798-d397e9960c55,748a81a2-ac14-45b8-a185-994997b76828,f729e984-71c9-4628-af2a-2415b6067224,,,Need to test workspace-init on real empirical-ai/ with 42 directories - will .empirica-workspace scoping work correctly?,1,Investigation complete - resolution documented in findings,1766431157.7752192,1767278132.704325,"{""unknown"": ""Need to test workspace-init on real empirical-ai/ with 42 directories - will .empirica-workspace scoping work correctly?"", ""goal_id"": null, ""subtask_id"": null}",,0.5,
d29fd688-3af6-4d57-b654-7b43f77573a2,748a81a2-ac14-45b8-a185-994997b76828,f729e984-71c9-4628-af2a-2415b6067224,,,empirica-comms git remote not created yet - need to create GitHub repo and push,1,Investigation complete - resolution documented in findings,1766431158.0114305,1767278132.4359696,"{""unknown"": ""empirica-comms git remote not created yet - need to create GitHub repo and push"", ""goal_id"": null, ""subtask_id"": null}",,0.5,
ec535bca-5e91-4561-bca5-66a30ea41ff1,748a81a2-ac14-45b8-a185-994997b76828,f729e984-71c9-4628-af2a-2415b6067224,,,"Should workspace-init read .empirica-workspace config for scoping, or is that v1.0.7 feature?",1,Investigation complete - resolution documented in findings,1766431158.2462478,1767278132.1665258,"{""unknown"": ""Should workspace-init read .empirica-workspace config for scoping, or is that v1.0.7 feature?"", ""goal_id"": null, ""subtask_id"": null}",,0.5,
ab75d328-1519-468b-b775-5425d1a7aa73,748a81a2-ac14-45b8-a185-994997b76828,b197fbe6-dd55-4c00-a924-36ad1ef095d3,,,"Dashboard action hooks not implemented yet. Need interactive prompts for low confidence below 40 percent, medium confidence 40-70 percent, blocked goals. Should write JSON to /tmp/action_response.json for AI to read.",1,Investigation complete - resolution documented in findings,1766670739.0093129,1767278130.8142917,"{""unknown"": ""Dashboard action hooks not implemented yet. Need interactive prompts for low confidence below 40 percent, medium confidence 40-70 percent, blocked goals. Should write JSON to /tmp/action_response.json for AI to read."", ""goal_id"": null, ""subtask_id"": null}",,0.5,
158b86dc-4505-426d-99c2-e6fd0c0e36fb,748a81a2-ac14-45b8-a185-994997b76828,b197fbe6-dd55-4c00-a924-36ad1ef095d3,,,Verbose flag added to parsers but handlers may not implement actual verbose logging. Need audit to verify which commands silently accept --verbose vs actually show detailed output to stderr.,1,Investigation complete - resolution documented in findings,1766670741.0541112,1767278130.5414538,"{""unknown"": ""Verbose flag added to parsers but handlers may not implement actual verbose logging. Need audit to verify which commands silently accept --verbose vs actually show detailed output to stderr."", ""goal_id"": null, ""subtask_id"": null}",,0.5,
5ee14a11-9257-4bec-8c36-91a94861bfdf,748a81a2-ac14-45b8-a185-994997b76828,b197fbe6-dd55-4c00-a924-36ad1ef095d3,,,"Workspace-level DB architecture designed but not implemented. Would enable multi-project monitoring, AI switching between projects, cross-project epistemic handoffs. Decision: Keep for premium paying clients only, MIT version gets single-project monitoring.",1,Investigation complete - resolution documented in findings,1766670743.0923657,1767278130.2789931,"{""unknown"": ""Workspace-level DB architecture designed but not implemented. Would enable multi-project monitoring, AI switching between projects, cross-project epistemic handoffs. Decision: Keep for premium paying clients only, MIT version gets single-project monitoring."", ""goal_id"": null, ""subtask_id"": null}",,0.5,
72e5b8bf-cc66-4647-ba44-e127ed4076f3,748a81a2-ac14-45b8-a185-994997b76828,b197fbe6-dd55-4c00-a924-36ad1ef095d3,,,Exit code fix needs to be applied to all CLI handlers that currently return dicts. Need to audit and change all return statements to return 0 for success.,1,Investigation complete - resolution documented in findings,1766671033.1142085,1767278130.0084732,"{""unknown"": ""Exit code fix needs to be applied to all CLI handlers that currently return dicts. Need to audit and change all return statements to return 0 for success."", ""goal_id"": null, ""subtask_id"": null}",,0.5,
eebe776b-00b0-4a1e-8780-42f2e8cff891,748a81a2-ac14-45b8-a185-994997b76828,b197fbe6-dd55-4c00-a924-36ad1ef095d3,,,How to integrate workflow automation docs into semantic index (Qdrant) for dynamic context loading via project-bootstrap? Need to embed INTERACTIVE_CHECKLIST_TUI.md and AI_WORKFLOW_AUTOMATION.md as searchable context so AIs discover workflow patterns automatically based on project type and activity.,1,Investigation complete - resolution documented in findings,1766671406.60877,1767278129.7348392,"{""unknown"": ""How to integrate workflow automation docs into semantic index (Qdrant) for dynamic context loading via project-bootstrap? Need to embed INTERACTIVE_CHECKLIST_TUI.md and AI_WORKFLOW_AUTOMATION.md as searchable context so AIs discover workflow patterns automatically based on project type and activity."", ""goal_id"": null, ""subtask_id"": null}",,0.5,
c5a1ecda-7d8a-48e3-a1d2-5d6ba6c4c823,748a81a2-ac14-45b8-a185-994997b76828,b197fbe6-dd55-4c00-a924-36ad1ef095d3,,,Version bump strategy: Should we go to v4.1.0 (minor) or v5.0.0 (major) given perpetual continuity is a breaking paradigm shift?,1,Investigation complete - resolution documented in findings,1766697701.92508,1767278129.1926577,"{""unknown"": ""Version bump strategy: Should we go to v4.1.0 (minor) or v5.0.0 (major) given perpetual continuity is a breaking paradigm shift?"", ""goal_id"": null, ""subtask_id"": null, ""impact"": 0.7, ""timestamp"": 1766697701.9250789}",,0.5,
f97b152e-1d7f-485b-adb9-aa6aa1ec99a5,748a81a2-ac14-45b8-a185-994997b76828,b197fbe6-dd55-4c00-a924-36ad1ef095d3,,,How to disable Claude Code's automatic doc loading on /compact? It's redundant with our importance-weighted bootstrap. Need to check ~/.claude/settings.json or Claude Code docs.,1,Investigation complete - resolution documented in findings,1766697927.8814666,1767278128.925295,"{""unknown"": ""How to disable Claude Code's automatic doc loading on /compact? It's redundant with our importance-weighted bootstrap. Need to check ~/.claude/settings.json or Claude Code docs."", ""goal_id"": null, ""subtask_id"": null, ""impact"": 0.6, ""timestamp"": 1766697927.8814657}",,0.5,
