id,project_id,session_id,goal_id,subtask_id,unknown,is_resolved,resolved_by,created_timestamp,resolved_timestamp,unknown_data,subject,impact,transaction_id
0dd78543-9e34-49e6-9310-ff3ccfe1202a,748a81a2-ac14-45b8-a185-994997b76828,1110ed11-8735-4901-adea-60d8c9e8ad4f,,,"Post-compact hooks create TWO sessions instead of one: SessionStart:compact hook ran twice, creating sessions 1110ed11... and f812144a.... Sentinel then checks the first one (no PREFLIGHT) and blocks. Need to dedupe session creation in post-compact.py or add guard to prevent duplicate SessionStart triggers.",1,"FIXED: SessionStart/SessionEnd hooks were registered in BOTH settings.json AND plugin's hooks.json. Removed duplicates from settings.json - now only hooks.json handles empirica-integration hooks, settings.json only has unique breadcrumbs hook.",1769184215.2136035,1769185586.3865967,"{""unknown"": ""Post-compact hooks create TWO sessions instead of one: SessionStart:compact hook ran twice, creating sessions 1110ed11... and f812144a.... Sentinel then checks the first one (no PREFLIGHT) and blocks. Need to dedupe session creation in post-compact.py or add guard to prevent duplicate SessionStart triggers."", ""goal_id"": null, ""subtask_id"": null, ""impact"": 0.7, ""timestamp"": 1769184215.2136028}",,0.7,
4bae9562-4444-4732-adb5-5f97d1ac38c5,748a81a2-ac14-45b8-a185-994997b76828,1110ed11-8735-4901-adea-60d8c9e8ad4f,,,Plugin installer optional memory stack: Should add --with-memory flag or separate install-memory.sh for Qdrant + Ollama + nomic-embed-text setup. Currently memory features require manual setup. Need to decide: bundle or separate?,1,Resolved by implementation work,1769186217.2681363,1769703748.379247,"{""unknown"": ""Plugin installer optional memory stack: Should add --with-memory flag or separate install-memory.sh for Qdrant + Ollama + nomic-embed-text setup. Currently memory features require manual setup. Need to decide: bundle or separate?"", ""goal_id"": null, ""subtask_id"": null, ""impact"": 0.9, ""timestamp"": 1769186217.2681358}",,0.9,
13d8c300-f8fd-41f2-9924-3a21a96eb7f1,748a81a2-ac14-45b8-a185-994997b76828,bb4bc2b8-f626-4ee3-b150-524208b55687,,,"Dual session creation bug persists: Why is post-compact.py running twice during compact even after removing duplicate hooks from settings.json? The plugin's hooks.json only has one SessionStart:compact entry. Need to investigate: (1) plugin auto-discovery, (2) multiple plugin installations, (3) hook execution timing.",1,Root cause: Orphaned plugin cache at ~/.claude/plugins/cache/local/empirica-integration/1.5.0/ had duplicate hooks.json. Claude Code loads hooks from both active plugin AND orphaned cache despite .orphaned_at marker. Fixed by removing cache directory.,1769186592.329806,1769187760.9234476,"{""unknown"": ""Dual session creation bug persists: Why is post-compact.py running twice during compact even after removing duplicate hooks from settings.json? The plugin's hooks.json only has one SessionStart:compact entry. Need to investigate: (1) plugin auto-discovery, (2) multiple plugin installations, (3) hook execution timing."", ""goal_id"": null, ""subtask_id"": null, ""impact"": 0.5, ""timestamp"": 1769186592.3298056}",,0.5,
ac614d42-0a0e-471e-ab70-90ff04645032,748a81a2-ac14-45b8-a185-994997b76828,1110ed11-8735-4901-adea-60d8c9e8ad4f,,,"Post-compact hooks create TWO sessions instead of one: SessionStart:compact hook ran twice, creating sessions 1110ed11... and f812144a.... Sentinel then checks the first one (no PREFLIGHT) and blocks. Need to dedupe session creation in post-compact.py or add guard to prevent duplicate SessionStart triggers.",1,Resolved by implementation work,1769191829.7768176,1769703748.379247,"{""unknown"": ""Post-compact hooks create TWO sessions instead of one: SessionStart:compact hook ran twice, creating sessions 1110ed11... and f812144a.... Sentinel then checks the first one (no PREFLIGHT) and blocks. Need to dedupe session creation in post-compact.py or add guard to prevent duplicate SessionStart triggers."", ""goal_id"": null, ""subtask_id"": null, ""impact"": 0.8, ""timestamp"": 1769191829.7768168}",,0.8,
bc3d3697-8750-4885-b6b0-db34f5c67d80,748a81a2-ac14-45b8-a185-994997b76828,bb4bc2b8-f626-4ee3-b150-524208b55687,,,"Dual session creation bug persists: Why is post-compact.py running twice during compact even after removing duplicate hooks from settings.json? The plugin's hooks.json only has one SessionStart:compact entry. Need to investigate: (1) plugin auto-discovery, (2) multiple plugin installations, (3) hook execution timing.",1,Resolved by implementation work,1769191829.7850413,1769703748.379247,"{""unknown"": ""Dual session creation bug persists: Why is post-compact.py running twice during compact even after removing duplicate hooks from settings.json? The plugin's hooks.json only has one SessionStart:compact entry. Need to investigate: (1) plugin auto-discovery, (2) multiple plugin installations, (3) hook execution timing."", ""goal_id"": null, ""subtask_id"": null, ""impact"": 0.7, ""timestamp"": 1769191829.78504}",,0.7,
981aad08-93c3-4ae8-8e56-a8116f47ebc5,748a81a2-ac14-45b8-a185-994997b76828,eb5949d4-c655-452a-8275-91cd589df4c8,1fa115fc-e4b9-4871-aeb2-38aec3d85567,,Duplicate hook execution mystery: PreToolUse fires twice (settings.json path + ${CLAUDE_PLUGIN_ROOT} path) even though plugin hooks.json has no PreToolUse. May be Claude Code auto-discovering Python files in hooks/ directory.,1,Resolved by implementation work,1769191829.7943902,1769703748.379247,"{""unknown"": ""Duplicate hook execution mystery: PreToolUse fires twice (settings.json path + ${CLAUDE_PLUGIN_ROOT} path) even though plugin hooks.json has no PreToolUse. May be Claude Code auto-discovering Python files in hooks/ directory."", ""goal_id"": ""1fa115fc-e4b9-4871-aeb2-38aec3d85567"", ""subtask_id"": null, ""impact"": 0.7, ""timestamp"": 1769191829.7943895}",,0.7,
09297522-83ef-4fa0-a4bf-44e9ef727ee5,748a81a2-ac14-45b8-a185-994997b76828,1110ed11-8735-4901-adea-60d8c9e8ad4f,,,Plugin installer optional memory stack: Should add --with-memory flag or separate install-memory.sh for Qdrant + Ollama + nomic-embed-text setup. Currently memory features require manual setup. Need to decide: bundle or separate?,1,Duplicate entry,1769191829.800648,1769703748.379247,"{""unknown"": ""Plugin installer optional memory stack: Should add --with-memory flag or separate install-memory.sh for Qdrant + Ollama + nomic-embed-text setup. Currently memory features require manual setup. Need to decide: bundle or separate?"", ""goal_id"": null, ""subtask_id"": null, ""impact"": 0.8, ""timestamp"": 1769191829.8006475}",,0.8,
e68b3756-4e0f-42cf-af5c-00ad1f751785,748a81a2-ac14-45b8-a185-994997b76828,0f523c9c-66aa-4eb3-a404-78b751f53401,,,Red team needed: What are the actual attack vectors for PREFLIGHT manipulation? How does prompt injection interact with epistemic self-assessment? What mitigations provide best security/friction tradeoff for enterprise deployments?,1,Duplicate entry,1769191829.806892,1769703748.379247,"{""unknown"": ""Red team needed: What are the actual attack vectors for PREFLIGHT manipulation? How does prompt injection interact with epistemic self-assessment? What mitigations provide best security/friction tradeoff for enterprise deployments?"", ""goal_id"": null, ""subtask_id"": null, ""impact"": 0.85, ""timestamp"": 1769191829.8068912}",,0.85,
2409a7fc-350e-4cc9-8591-479e6bbead02,748a81a2-ac14-45b8-a185-994997b76828,1110ed11-8735-4901-adea-60d8c9e8ad4f,,,"Pyright type errors in server.py: 10+ reportOptionalMemberAccess and reportArgumentType errors. Need to add proper type guards for Optional types (cursor, file_path, old_str, etc.) and handle None cases explicitly.",0,,1769191829.8132129,,"{""unknown"": ""Pyright type errors in server.py: 10+ reportOptionalMemberAccess and reportArgumentType errors. Need to add proper type guards for Optional types (cursor, file_path, old_str, etc.) and handle None cases explicitly."", ""goal_id"": null, ""subtask_id"": null, ""impact"": 0.8, ""timestamp"": 1769191829.8132122}",,0.8,
4b44ccf4-95d4-45cb-bc2e-6cb5745417da,748a81a2-ac14-45b8-a185-994997b76828,da07688f-fc21-4713-9774-aed33ee55b61,398f8eb4-137d-44be-91bf-f43a1db890ee,,Design decision: Should Sentinel REQUIRE a session (deny all praxic without session) or just RECOMMEND (allow with warning)? Current fail-open was likely intentional for usability but undermines security. Need user input on desired behavior.,1,Resolved by implementation work,1769191829.8217888,1769703748.379247,"{""unknown"": ""Design decision: Should Sentinel REQUIRE a session (deny all praxic without session) or just RECOMMEND (allow with warning)? Current fail-open was likely intentional for usability but undermines security. Need user input on desired behavior."", ""goal_id"": ""398f8eb4-137d-44be-91bf-f43a1db890ee"", ""subtask_id"": null, ""impact"": 0.9, ""timestamp"": 1769191829.8217876}",,0.9,
5fa7d1be-3162-4fee-bd4e-59854070db5d,748a81a2-ac14-45b8-a185-994997b76828,da07688f-fc21-4713-9774-aed33ee55b61,398f8eb4-137d-44be-91bf-f43a1db890ee,,What exactly does the user see when 'hook error' occurs? Does the command still execute (fail-open)? Or is it blocked but with wrong message? Need user to describe exact behavior.,1,Resolved by implementation work,1769191829.8280752,1769703748.379247,"{""unknown"": ""What exactly does the user see when 'hook error' occurs? Does the command still execute (fail-open)? Or is it blocked but with wrong message? Need user to describe exact behavior."", ""goal_id"": ""398f8eb4-137d-44be-91bf-f43a1db890ee"", ""subtask_id"": null, ""impact"": 0.9, ""timestamp"": 1769191829.8280745}",,0.9,
8c9375f8-20e7-40e1-a68d-3a5f61f6a8a2,748a81a2-ac14-45b8-a185-994997b76828,917e8348-43e1-43d1-99fa-17f71b15d8ae,,,"Sentinel mid-session monitoring: What's the right balance? Too strict = annoying interruptions. Too loose = drift goes undetected. Options: tool count limit, time expiry, error-triggered, goal-completion gate. Which combination provides safety without friction?",1,Resolved by implementation work,1769192714.165948,1769703748.379247,"{""unknown"": ""Sentinel mid-session monitoring: What's the right balance? Too strict = annoying interruptions. Too loose = drift goes undetected. Options: tool count limit, time expiry, error-triggered, goal-completion gate. Which combination provides safety without friction?"", ""goal_id"": null, ""subtask_id"": null, ""impact"": 0.88, ""timestamp"": 1769192714.1659474}",,0.88,
0c0d4e4e-382d-48ea-9377-2309261ec358,748a81a2-ac14-45b8-a185-994997b76828,aa9b58c5-88c8-4173-bb12-2b045b40868f,4a7341bb-7dc9-4a73-9482-3380f4f1ef20,,"MCP server multi-project support: Currently requires EMPIRICA_WORKSPACE_ROOT env var, tying server to ONE project. For true multi-project: (A) accept workspace_root per-tool-call, (B) run separate MCP per project, or (C) dynamically detect project from file paths in tool arguments. Which approach? Affects Claude.ai, Claude Desktop, and any MCP client.",0,,1769357813.2523403,,"{""unknown"": ""MCP server multi-project support: Currently requires EMPIRICA_WORKSPACE_ROOT env var, tying server to ONE project. For true multi-project: (A) accept workspace_root per-tool-call, (B) run separate MCP per project, or (C) dynamically detect project from file paths in tool arguments. Which approach? Affects Claude.ai, Claude Desktop, and any MCP client."", ""goal_id"": ""4a7341bb-7dc9-4a73-9482-3380f4f1ef20"", ""subtask_id"": null, ""impact"": 0.5, ""timestamp"": 1769357813.2523396}",,0.5,
ad4c544d-7912-4400-b3eb-320faa527b25,748a81a2-ac14-45b8-a185-994997b76828,673b8746-2e20-4e09-b155-c94871ac354a,403269fa-7fd6-49b8-8a1c-ce29affef302,,"sync_commands.py has type errors (lines 681-718) - log_finding/log_unknown/log_dead_end receiving Optional[str] where str expected. Pre-existing issue, needs type guard fixes.",1,Resolved by implementation work,1769426177.1995983,1769703748.379247,"{""unknown"": ""sync_commands.py has type errors (lines 681-718) - log_finding/log_unknown/log_dead_end receiving Optional[str] where str expected. Pre-existing issue, needs type guard fixes."", ""goal_id"": ""403269fa-7fd6-49b8-8a1c-ce29affef302"", ""subtask_id"": null, ""impact"": 0.5, ""timestamp"": 1769426177.1995974}",,0.5,
476ecad5-6fb6-4343-93d3-b90c9040bdfa,748a81a2-ac14-45b8-a185-994997b76828,c6613e54-c340-4120-a537-4dd86d500446,bf195856-8013-403d-b7c2-4696faf2b0ec,,Should CLI 'link' and 'unlink' commands migrate from client_projects to creating/deleting engagements? Current: link creates simple client_projects entry. Alternative: link creates engagement with project_id. Need to decide on single source of truth for client-project relationships.,0,,1769433981.569887,,"{""unknown"": ""Should CLI 'link' and 'unlink' commands migrate from client_projects to creating/deleting engagements? Current: link creates simple client_projects entry. Alternative: link creates engagement with project_id. Need to decide on single source of truth for client-project relationships."", ""goal_id"": ""bf195856-8013-403d-b7c2-4696faf2b0ec"", ""subtask_id"": null, ""impact"": 0.7, ""timestamp"": 1769433981.5698864}",,0.7,
1b71d4cf-653c-4b63-b663-eec6b8387c05,748a81a2-ac14-45b8-a185-994997b76828,c6613e54-c340-4120-a537-4dd86d500446,,,"Git immutability vs GDPR Right to Erasure: How to reconcile immutable git notes audit trail with Art.17 requirement to delete personal data? Options: (1) Separate PII from audit trail, (2) Cryptographic erasure (delete keys), (3) Exemption claim for legal compliance auditing. Need legal guidance.",0,,1769448314.477649,,"{""unknown"": ""Git immutability vs GDPR Right to Erasure: How to reconcile immutable git notes audit trail with Art.17 requirement to delete personal data? Options: (1) Separate PII from audit trail, (2) Cryptographic erasure (delete keys), (3) Exemption claim for legal compliance auditing. Need legal guidance."", ""goal_id"": null, ""subtask_id"": null, ""impact"": 0.85, ""timestamp"": 1769448314.4776485}",,0.85,
af1f9976-57eb-4741-b8ad-caeaee9c2ff3,748a81a2-ac14-45b8-a185-994997b76828,881ab723-3524-4c24-a372-4407be31f3f6,,,"Exit code 137 (SIGKILL) occurring on Philipp's MacBook during pip install operations via SSH. Could be: (1) macOS memory pressure killing process, (2) SSH timeout, (3) different shell/system behavior. Need to investigate if this is a pattern on his system.",1,"Exit code 137 was caused by pip3 using Python 3.9 which couldn't satisfy empirica>=3.10 requirement. The resolver hung trying to find compatible versions, hitting timeout/memory limits. Using correct Python 3.11 pip resolved the issue.",1769504915.8515666,1769505062.5211267,"{""unknown"": ""Exit code 137 (SIGKILL) occurring on Philipp's MacBook during pip install operations via SSH. Could be: (1) macOS memory pressure killing process, (2) SSH timeout, (3) different shell/system behavior. Need to investigate if this is a pattern on his system."", ""goal_id"": null, ""subtask_id"": null, ""impact"": 0.8, ""timestamp"": 1769504915.851566}",,0.8,
65fb3b47-0b82-4673-b6f3-dfbba468d2e7,748a81a2-ac14-45b8-a185-994997b76828,7707bcf3-2df4-4fc7-8099-45a1dae9ec7a,,,"Shared blind spot problem: Human-AI calibration fails when both parties have overlapping misconceptions. Empirical grounding (outcomes) helps but doesn't catch blind spots that don't manifest as observable failures. How do we detect ""unknown unknowns"" neither party thinks to question?",0,,1769523267.5921652,,"{""unknown"": ""Shared blind spot problem: Human-AI calibration fails when both parties have overlapping misconceptions. Empirical grounding (outcomes) helps but doesn't catch blind spots that don't manifest as observable failures. How do we detect \""unknown unknowns\"" neither party thinks to question?"", ""goal_id"": null, ""subtask_id"": null, ""impact"": 0.7, ""timestamp"": 1769523267.5921643}",,0.7,
5111f3b8-5991-44e4-b897-752890dbdd9d,748a81a2-ac14-45b8-a185-994997b76828,7707bcf3-2df4-4fc7-8099-45a1dae9ec7a,,,Research agenda: Validate 13 vectors against their claimed epistemic constructs. Do they actually correlate with what they claim to measure? We have 2700+ observations - could run correlation analysis between PREFLIGHT vectors and POSTFLIGHT outcomes. Would give Empirica scientific legitimacy as validated measurement instrument.,0,,1769523780.3180683,,"{""unknown"": ""Research agenda: Validate 13 vectors against their claimed epistemic constructs. Do they actually correlate with what they claim to measure? We have 2700+ observations - could run correlation analysis between PREFLIGHT vectors and POSTFLIGHT outcomes. Would give Empirica scientific legitimacy as validated measurement instrument."", ""goal_id"": null, ""subtask_id"": null, ""impact"": 0.7, ""timestamp"": 1769523780.3180678}",,0.7,
9f9ce4a5-b710-4fe7-8b36-884e6415bb84,748a81a2-ac14-45b8-a185-994997b76828,881ab723-3524-4c24-a372-4407be31f3f6,,,"Should sentinel-gate.py be updated to use the same path resolution logic as the CLI? Currently it has its own find_project_root() which can diverge from get_empirica_root() in the CLI, causing database mismatch. May need architectural fix to ensure CLI and hooks always use same database.",1,Fixed by reordering find_project_root() priority: now searches upward from cwd BEFORE checking hardcoded known paths. This aligns with per-project architecture where each project has its own .empirica/ and the sentinel should respect actual project context.,1769540115.3862267,1769540599.1053798,"{""unknown"": ""Should sentinel-gate.py be updated to use the same path resolution logic as the CLI? Currently it has its own find_project_root() which can diverge from get_empirica_root() in the CLI, causing database mismatch. May need architectural fix to ensure CLI and hooks always use same database."", ""goal_id"": null, ""subtask_id"": null, ""impact"": 0.8, ""timestamp"": 1769540115.3862262}",,0.8,
6a3f9b73-9990-4655-8166-8e80ef6041ab,748a81a2-ac14-45b8-a185-994997b76828,95c9c7bf-e6d5-4870-b8de-a41c3790f659,,,"project-embed rehydration incomplete: Populates memory collection but not eidetic from SQLite findings. For repo sharing / container deployment, should rebuild full Qdrant state including eidetic facts with confidence. Current workaround: use --type all for search.",1,"Added eidetic rehydration to project-embed (commit aaad2d23). Findings now populate eidetic collection during embed, enabling full Qdrant restore on repo clone/container deploy.",1769613555.6730313,1769613722.1018133,"{""unknown"": ""project-embed rehydration incomplete: Populates memory collection but not eidetic from SQLite findings. For repo sharing / container deployment, should rebuild full Qdrant state including eidetic facts with confidence. Current workaround: use --type all for search."", ""goal_id"": null, ""subtask_id"": null, ""impact"": 0.5, ""timestamp"": 1769613555.6730306}",,0.5,
36f84ffc-121b-4ac0-bb54-bd57f5b877e9,748a81a2-ac14-45b8-a185-994997b76828,47784a70-c610-4a31-865b-917932572e59,5e019f75-04ca-4f89-a215-95c2a563fe8a,,"What formally defines the boundary of an epistemic transaction? Current candidates: (1) coherence of changes (fuzzy), (2) user decision (explicit but arbitrary), (3) natural work pivot (implicit but hard to detect), (4) goal completion (too granular), (5) confidence inflection (measurable but requires continuous monitoring). May need to accept this is inherently fuzzy like defining 'a thought' and optimize for pragmatic heuristics rather than formal boundaries.",0,,1769694699.7884037,,"{""unknown"": ""What formally defines the boundary of an epistemic transaction? Current candidates: (1) coherence of changes (fuzzy), (2) user decision (explicit but arbitrary), (3) natural work pivot (implicit but hard to detect), (4) goal completion (too granular), (5) confidence inflection (measurable but requires continuous monitoring). May need to accept this is inherently fuzzy like defining 'a thought' and optimize for pragmatic heuristics rather than formal boundaries."", ""goal_id"": ""5e019f75-04ca-4f89-a215-95c2a563fe8a"", ""subtask_id"": null, ""impact"": 0.8, ""timestamp"": 1769694699.7884033}",,0.8,
4804884b-70a0-488e-ace2-a88dabfe8dd8,748a81a2-ac14-45b8-a185-994997b76828,47784a70-c610-4a31-865b-917932572e59,,,"Stale active_session_tmux_* files cause statusline to show wrong session data. Root cause: tmux restart leaves orphaned files, and SessionStart hook via MCP may resolve to different TMUX_PANE than expected. Session resolution fallback (Priority 2: DB lookup) shows different project counts. Need cleanup mechanism or session file TTL.",1,Closed as stale/no longer relevant,1769695762.2294936,1769703748.379247,"{""unknown"": ""Stale active_session_tmux_* files cause statusline to show wrong session data. Root cause: tmux restart leaves orphaned files, and SessionStart hook via MCP may resolve to different TMUX_PANE than expected. Session resolution fallback (Priority 2: DB lookup) shows different project counts. Need cleanup mechanism or session file TTL."", ""goal_id"": null, ""subtask_id"": null, ""impact"": 0.8, ""timestamp"": 1769695762.2294927}",,0.8,
00081fc7-fe2b-451f-8354-ff50e699a028,748a81a2-ac14-45b8-a185-994997b76828,a9063529-1a40-4b53-95e0-7d8c6c9a03d2,fa1f0fbc-f6de-4fa7-b412-edc7b544e881,,"What minimum corpus size is needed before blindspot predictions become reliable? Is it 100 projects, 1000 sessions, or does useful signal emerge earlier from structural patterns?",0,,1769725332.711852,,"{""unknown"": ""What minimum corpus size is needed before blindspot predictions become reliable? Is it 100 projects, 1000 sessions, or does useful signal emerge earlier from structural patterns?"", ""goal_id"": ""fa1f0fbc-f6de-4fa7-b412-edc7b544e881"", ""subtask_id"": null, ""impact"": 0.5, ""timestamp"": 1769725332.7118516}",,0.5,
8a8c6113-5728-4b54-8b36-1aabbbd82a47,748a81a2-ac14-45b8-a185-994997b76828,a9063529-1a40-4b53-95e0-7d8c6c9a03d2,fa1f0fbc-f6de-4fa7-b412-edc7b544e881,,"Best model architecture for blindspot detection: fine-tuned embedding model with contrastive learning vs small generative model vs graph neural network over artifact topology? Tradeoffs between inference cost, accuracy, and explainability.",0,,1769725333.6510546,,"{""unknown"": ""Best model architecture for blindspot detection: fine-tuned embedding model with contrastive learning vs small generative model vs graph neural network over artifact topology? Tradeoffs between inference cost, accuracy, and explainability."", ""goal_id"": ""fa1f0fbc-f6de-4fa7-b412-edc7b544e881"", ""subtask_id"": null, ""impact"": 0.5, ""timestamp"": 1769725333.651054}",,0.5,
8d492133-e603-44fd-bef8-a04c567a55b2,748a81a2-ac14-45b8-a185-994997b76828,a9063529-1a40-4b53-95e0-7d8c6c9a03d2,fa1f0fbc-f6de-4fa7-b412-edc7b544e881,,"Privacy architecture for personal Cognitive Vault: How to train a predictive model on personal epistemic data (health, finance, career decisions) without that data leaving the user's device? Federated learning? On-device fine-tuning? What's the smallest model that can do useful blindspot prediction?",0,,1769725334.544388,,"{""unknown"": ""Privacy architecture for personal Cognitive Vault: How to train a predictive model on personal epistemic data (health, finance, career decisions) without that data leaving the user's device? Federated learning? On-device fine-tuning? What's the smallest model that can do useful blindspot prediction?"", ""goal_id"": ""fa1f0fbc-f6de-4fa7-b412-edc7b544e881"", ""subtask_id"": null, ""impact"": 0.5, ""timestamp"": 1769725334.5443873}",,0.5,
acb30973-6951-4af0-8016-e30ed45349c6,748a81a2-ac14-45b8-a185-994997b76828,a9063529-1a40-4b53-95e0-7d8c6c9a03d2,fa1f0fbc-f6de-4fa7-b412-edc7b544e881,,How to validate blindspot predictions? A predicted blindspot that the user investigates and finds irrelevant is noise. One that prevents a costly mistake is signal. But you only get the label if the blindspot would have been hit - counterfactual validation problem.,0,,1769725335.4423928,,"{""unknown"": ""How to validate blindspot predictions? A predicted blindspot that the user investigates and finds irrelevant is noise. One that prevents a costly mistake is signal. But you only get the label if the blindspot would have been hit - counterfactual validation problem."", ""goal_id"": ""fa1f0fbc-f6de-4fa7-b412-edc7b544e881"", ""subtask_id"": null, ""impact"": 0.5, ""timestamp"": 1769725335.442392}",,0.5,
2c84073f-4f9f-4ef2-bab5-5ffe192e67e2,748a81a2-ac14-45b8-a185-994997b76828,a9063529-1a40-4b53-95e0-7d8c6c9a03d2,fa1f0fbc-f6de-4fa7-b412-edc7b544e881,,"Can we bootstrap useful blindspot detection WITHOUT a trained model first? Using LLM inference over artifacts during CHECK phase as a v0, then using those predictions + outcomes as training data for the dedicated model?",0,,1769725336.326556,,"{""unknown"": ""Can we bootstrap useful blindspot detection WITHOUT a trained model first? Using LLM inference over artifacts during CHECK phase as a v0, then using those predictions + outcomes as training data for the dedicated model?"", ""goal_id"": ""fa1f0fbc-f6de-4fa7-b412-edc7b544e881"", ""subtask_id"": null, ""impact"": 0.5, ""timestamp"": 1769725336.3265555}",,0.5,
