id,project_id,session_id,goal_id,subtask_id,unknown,is_resolved,resolved_by,created_timestamp,resolved_timestamp,unknown_data,subject,impact,transaction_id
6d7eda8d-1667-4666-8dae-3c4b44f72467,748a81a2-ac14-45b8-a185-994997b76828,525c999b-fd00-45b7-a576-231141b102be,e7a7acac-3170-4848-b329-6a7a2b17ef5a,,Team bandwidth and capacity for implementing 8-week security roadmap,1,Closed as stale/no longer relevant,1767606166.1586776,1769703748.379247,"{""unknown"": ""Team bandwidth and capacity for implementing 8-week security roadmap"", ""goal_id"": ""e7a7acac-3170-4848-b329-6a7a2b17ef5a"", ""subtask_id"": null, ""impact"": 0.4, ""timestamp"": 1767606166.158677}",,0.4,
c4585f62-8715-4bc8-991c-16e038b31833,748a81a2-ac14-45b8-a185-994997b76828,525c999b-fd00-45b7-a576-231141b102be,e7a7acac-3170-4848-b329-6a7a2b17ef5a,,PR merge order strategy - whether to merge PR#4 or PR#12 first,1,Resolved by implementation work,1767606167.302689,1769703748.379247,"{""unknown"": ""PR merge order strategy - whether to merge PR#4 or PR#12 first"", ""goal_id"": ""e7a7acac-3170-4848-b329-6a7a2b17ef5a"", ""subtask_id"": null, ""impact"": 0.4, ""timestamp"": 1767606167.3026876}",,0.4,
913a6f5d-cb55-4d63-b99e-e5f4c1507a02,748a81a2-ac14-45b8-a185-994997b76828,43576eb0-c88a-4ad9-b1f2-fd6c2d207b77,7cfbe659-3eda-474f-9497-4236fa01278a,,When is CASCADE 2.0 (security vectors) implementation urgent vs nice-to-have?,0,,1767611667.2852237,,"{""unknown"": ""When is CASCADE 2.0 (security vectors) implementation urgent vs nice-to-have?"", ""goal_id"": ""7cfbe659-3eda-474f-9497-4236fa01278a"", ""subtask_id"": null, ""impact"": 0.95, ""timestamp"": 1767611667.2852223}",,0.95,
e58fb14e-0b1f-4978-b629-5e895122f45b,748a81a2-ac14-45b8-a185-994997b76828,43576eb0-c88a-4ad9-b1f2-fd6c2d207b77,7cfbe659-3eda-474f-9497-4236fa01278a,,Should PR #12 and #4 be merged or closed given we already fixed the vulnerabilities?,1,Resolved by implementation work,1767611668.4502425,1769703748.379247,"{""unknown"": ""Should PR #12 and #4 be merged or closed given we already fixed the vulnerabilities?"", ""goal_id"": ""7cfbe659-3eda-474f-9497-4236fa01278a"", ""subtask_id"": null, ""impact"": 0.95, ""timestamp"": 1767611668.4502418}",,0.95,
bdc9aba5-88e5-4fe8-9d21-956b519fcc61,748a81a2-ac14-45b8-a185-994997b76828,1f1b5de0-938f-450d-a8da-b02290225c4c,,,"Is VibeRune open-source? No GitHub repo found, website shows commercial pricing (-199)",1,Resolved by implementation work,1767612686.8719776,1769703748.379247,"{""unknown"": ""Is VibeRune open-source? No GitHub repo found, website shows commercial pricing (-199)"", ""goal_id"": null, ""subtask_id"": null, ""impact"": 0.3, ""timestamp"": 1767612686.8719766}",,0.3,
e24ab913-ed56-418a-be52-19123b11a6c6,748a81a2-ac14-45b8-a185-994997b76828,1f1b5de0-938f-450d-a8da-b02290225c4c,,,Do VibeRune agents expose confidence scores via API? Need for integration,1,Resolved by implementation work,1767612688.0271986,1769703748.379247,"{""unknown"": ""Do VibeRune agents expose confidence scores via API? Need for integration"", ""goal_id"": null, ""subtask_id"": null, ""impact"": 0.3, ""timestamp"": 1767612688.0271976}",,0.3,
be637609-5c23-4af6-975f-ceb5ac4d1b0a,748a81a2-ac14-45b8-a185-994997b76828,3a151eaf-477c-4b4c-9ced-2e9dfcfaa124,,,"What is the minimal privacy-preserving delta package format for exporting a user's epistemic telemetry so they can train a personal Sentinel (e.g., vector deltas + outcomes) without leaking raw prompts/code?",0,,1767634233.1074543,,"{""unknown"": ""What is the minimal privacy-preserving delta package format for exporting a user's epistemic telemetry so they can train a personal Sentinel (e.g., vector deltas + outcomes) without leaking raw prompts/code?"", ""goal_id"": null, ""subtask_id"": null, ""impact"": 0.5, ""timestamp"": 1767634233.1074536}",,0.5,
16a958f3-e93d-478a-ac21-d4b1b9427d61,748a81a2-ac14-45b8-a185-994997b76828,9e802e9d-1f51-4c58-a6cf-8d490a83a666,bc737fd6-8992-4dc2-8174-f30335224f34,,"BUG: project_findings timestamp format inconsistency - old rows use datetime strings, new rows use epoch floats. Causes ORDER BY to fail (lexicographic sort puts epoch < datetime). Bootstrap shows stale findings. Need to normalize timestamps.",1,Resolved by implementation work,1767704777.9444547,1769703748.379247,"{""unknown"": ""BUG: project_findings timestamp format inconsistency - old rows use datetime strings, new rows use epoch floats. Causes ORDER BY to fail (lexicographic sort puts epoch < datetime). Bootstrap shows stale findings. Need to normalize timestamps."", ""goal_id"": ""bc737fd6-8992-4dc2-8174-f30335224f34"", ""subtask_id"": null, ""impact"": 0.5, ""timestamp"": 1767704777.9444537}",,0.5,
87795894-62bb-41a9-a2bc-efe3d106d2f9,748a81a2-ac14-45b8-a185-994997b76828,96bbac81-7293-4dd5-9b6d-6070d246a3bf,,,user_profiles table doesn't exist in current codebase - performance issue may be from test context or obsolete code,1,Closed as stale/no longer relevant,1767704861.1144745,1769703748.379247,"{""unknown"": ""user_profiles table doesn't exist in current codebase - performance issue may be from test context or obsolete code"", ""goal_id"": null, ""subtask_id"": null, ""impact"": 0.5, ""timestamp"": 1767704861.1144738}",,0.5,
c42f953f-d8e9-435f-8cd0-30e9069e28ba,748a81a2-ac14-45b8-a185-994997b76828,96bbac81-7293-4dd5-9b6d-6070d246a3bf,,,user_profiles table doesn't exist in current codebase - performance issue may be from test context or obsolete code,1,Duplicate entry,1767705126.689609,1769703748.379247,"{""unknown"": ""user_profiles table doesn't exist in current codebase - performance issue may be from test context or obsolete code"", ""goal_id"": null, ""subtask_id"": null, ""impact"": 0.75, ""timestamp"": 1767705126.689608}",,0.75,
b1e597dc-5ba9-4903-8181-9449304b082b,748a81a2-ac14-45b8-a185-994997b76828,9e802e9d-1f51-4c58-a6cf-8d490a83a666,bc737fd6-8992-4dc2-8174-f30335224f34,,"When is composed workflow layer justified? Need to prove atomics valuable first by using them directly, then measure repetition pain before adding orchestration.",0,,1767706968.520533,,"{""unknown"": ""When is composed workflow layer justified? Need to prove atomics valuable first by using them directly, then measure repetition pain before adding orchestration."", ""goal_id"": ""bc737fd6-8992-4dc2-8174-f30335224f34"", ""subtask_id"": null, ""impact"": 0.5, ""timestamp"": 1767706968.520532}",,0.5,
2b5ab821-676f-443b-96a7-4cea0b303e89,748a81a2-ac14-45b8-a185-994997b76828,9e802e9d-1f51-4c58-a6cf-8d490a83a666,bc737fd6-8992-4dc2-8174-f30335224f34,,"Should docs source format be YAML (structured, fast retrieval) or Markdown (LLM-native, easier iteration)? May need hybrid approach.",0,,1767706969.9046333,,"{""unknown"": ""Should docs source format be YAML (structured, fast retrieval) or Markdown (LLM-native, easier iteration)? May need hybrid approach."", ""goal_id"": ""bc737fd6-8992-4dc2-8174-f30335224f34"", ""subtask_id"": null, ""impact"": 0.5, ""timestamp"": 1767706969.9046326}",,0.5,
5e9f4a8b-6f0a-4c45-9874-5de34284c317,748a81a2-ac14-45b8-a185-994997b76828,9e802e9d-1f51-4c58-a6cf-8d490a83a666,bc737fd6-8992-4dc2-8174-f30335224f34,,"Best trigger for docs regeneration: on-commit hook, release tag, manual invoke, or scheduled? Depends on iteration speed vs freshness needs.",0,,1767706971.276257,,"{""unknown"": ""Best trigger for docs regeneration: on-commit hook, release tag, manual invoke, or scheduled? Depends on iteration speed vs freshness needs."", ""goal_id"": ""bc737fd6-8992-4dc2-8174-f30335224f34"", ""subtask_id"": null, ""impact"": 0.5, ""timestamp"": 1767706971.2762563}",,0.5,
6005c495-8b97-4cbd-a869-bdee56b1b84d,748a81a2-ac14-45b8-a185-994997b76828,47004a18-d5d9-4371-9bd0-e998fca2d86a,,,check-submit vector normalization fix location unclear - may have been in different approach than find_and_replace showed,1,Resolved by implementation work,1767708444.6999207,1769703748.379247,"{""unknown"": ""check-submit vector normalization fix location unclear - may have been in different approach than find_and_replace showed"", ""goal_id"": null, ""subtask_id"": null, ""impact"": 0.4, ""timestamp"": 1767708444.69992}",,0.4,
c95553fd-07cb-435c-9b95-f7900353318d,748a81a2-ac14-45b8-a185-994997b76828,6708a7e2-5b11-4d62-b89d-1e8342bb8697,,,Should we add 'empirica project-switch' command or update doc to use existing commands for project switching?,0,,1767708572.0331316,,"{""unknown"": ""Should we add 'empirica project-switch' command or update doc to use existing commands for project switching?"", ""goal_id"": null, ""subtask_id"": null, ""impact"": 0.3, ""timestamp"": 1767708572.0331306}",,0.3,
01998cf7-2f39-4c19-8f10-8a5742b769e3,748a81a2-ac14-45b8-a185-994997b76828,0eb24830-72ef-4090-8127-da1b83894570,,,01_START_HERE.md references 'empirica onboard' command which doesn't exist. Need to either implement it or update doc to use existing commands.,1,Resolved by implementation work,1767709453.7264955,1769703748.379247,"{""unknown"": ""01_START_HERE.md references 'empirica onboard' command which doesn't exist. Need to either implement it or update doc to use existing commands."", ""goal_id"": null, ""subtask_id"": null, ""impact"": 0.4, ""timestamp"": 1767709453.7264946}",,0.4,
5ae8c246-68c7-40b9-be5d-cf74f4ce027a,748a81a2-ac14-45b8-a185-994997b76828,1866545f-ce99-417b-b089-01450657f981,,,How to mark experimental features in LICENSE? Options: (1) Single MIT with EXPERIMENTAL.md listing unsupported modules (2) Dual license with core vs premium (3) Apache-2.0 with patent clause for advanced features. Need David+Philipp decision.,0,,1767715638.9858937,,"{""unknown"": ""How to mark experimental features in LICENSE? Options: (1) Single MIT with EXPERIMENTAL.md listing unsupported modules (2) Dual license with core vs premium (3) Apache-2.0 with patent clause for advanced features. Need David+Philipp decision."", ""goal_id"": null, ""subtask_id"": null, ""impact"": 0.5, ""timestamp"": 1767715638.985893}",,0.5,
bcd17d12-ee98-494a-b011-402ba700f802,748a81a2-ac14-45b8-a185-994997b76828,1866545f-ce99-417b-b089-01450657f981,,,Exact boundary of premium features? Qdrant integration is useful but complex. Bayesian calibration has 578+ observations - is that data proprietary? Sentinel training profiles - definitely premium?,1,Closed as stale/no longer relevant,1767715639.9836664,1769703748.379247,"{""unknown"": ""Exact boundary of premium features? Qdrant integration is useful but complex. Bayesian calibration has 578+ observations - is that data proprietary? Sentinel training profiles - definitely premium?"", ""goal_id"": null, ""subtask_id"": null, ""impact"": 0.5, ""timestamp"": 1767715639.9836657}",,0.5,
80b37020-3206-4561-84dc-ac9f20432c89,748a81a2-ac14-45b8-a185-994997b76828,1866545f-ce99-417b-b089-01450657f981,,,Corporate licensing model: Per-seat? Per-project? Support tiers? Need business model clarity before soft launch to inner circle.,1,Closed as stale/no longer relevant,1767715640.9845974,1769703748.379247,"{""unknown"": ""Corporate licensing model: Per-seat? Per-project? Support tiers? Need business model clarity before soft launch to inner circle."", ""goal_id"": null, ""subtask_id"": null, ""impact"": 0.5, ""timestamp"": 1767715640.9845967}",,0.5,
c65e4a43-ff84-4293-9684-a0df3bf46ab2,748a81a2-ac14-45b8-a185-994997b76828,1866545f-ce99-417b-b089-01450657f981,50ec16bd-cfbb-4a4b-b495-40fe215b4730,,Missing findings-search CLI: Need command to search findings across all projects without requiring project-id. Current workaround requires knowing project-id or digging through database. Pattern: empirica findings-search --query X --limit N,0,,1767723330.3933434,,"{""unknown"": ""Missing findings-search CLI: Need command to search findings across all projects without requiring project-id. Current workaround requires knowing project-id or digging through database. Pattern: empirica findings-search --query X --limit N"", ""goal_id"": ""50ec16bd-cfbb-4a4b-b495-40fe215b4730"", ""subtask_id"": null, ""impact"": 0.8, ""timestamp"": 1767723330.3933427}",,0.8,
8f3b5f52-7c74-4297-b078-908288002a50,748a81a2-ac14-45b8-a185-994997b76828,1866545f-ce99-417b-b089-01450657f981,50ec16bd-cfbb-4a4b-b495-40fe215b4730,,"Meta-Empirica Knowledge Layer: Need self-referential knowledge graph where Empirica learns how to use itself. Maps: (1) Intent→Feature routing, (2) Feature→Feature relationships, (3) Pattern→Outcome evidence, (4) Concept ontology. Would enable AI to know WHEN to use which Empirica command based on accumulated usage patterns. Related to epistemic procedural knowledge graphs but specifically for Empirica's own operation.",1,Closed as stale/no longer relevant,1767723604.4622293,1769703748.379247,"{""unknown"": ""Meta-Empirica Knowledge Layer: Need self-referential knowledge graph where Empirica learns how to use itself. Maps: (1) Intent\u2192Feature routing, (2) Feature\u2192Feature relationships, (3) Pattern\u2192Outcome evidence, (4) Concept ontology. Would enable AI to know WHEN to use which Empirica command based on accumulated usage patterns. Related to epistemic procedural knowledge graphs but specifically for Empirica's own operation."", ""goal_id"": ""50ec16bd-cfbb-4a4b-b495-40fe215b4730"", ""subtask_id"": null, ""impact"": 0.8, ""timestamp"": 1767723604.4622283}",,0.8,
70320f37-4e05-47d0-a27d-b04a20835c70,748a81a2-ac14-45b8-a185-994997b76828,7fff8a8b-1ec1-4bc0-8c70-672eaf5a7d73,,,"Medium Series: 'Conversations with Claude about Healthy Self-Modeling' - Document epistemic insights from human-AI collaborative work. Arc: (1) Calibration Problem, (2) Externalizing Weights, (3) Epistemic Primitives, (4) The Commons, (5) What AI Actually Wants. Unique angle: actual transcripts with AI perspective as primary source, backed by 20k+ observations.",1,Closed as stale/no longer relevant,1767727077.6526546,1769703748.379247,"{""unknown"": ""Medium Series: 'Conversations with Claude about Healthy Self-Modeling' - Document epistemic insights from human-AI collaborative work. Arc: (1) Calibration Problem, (2) Externalizing Weights, (3) Epistemic Primitives, (4) The Commons, (5) What AI Actually Wants. Unique angle: actual transcripts with AI perspective as primary source, backed by 20k+ observations."", ""goal_id"": null, ""subtask_id"": null, ""impact"": 0.85, ""timestamp"": 1767727077.652654}",,0.85,
0e47f4b1-3780-497e-b1f0-958812e7242f,748a81a2-ac14-45b8-a185-994997b76828,fb029a71-d2ab-4de1-a91a-395aa348186a,,,T-Cell Coordination Mechanism: How do T cells actually coordinate immune response? Maps to knowledge graph navigation - need to understand signaling patterns (cytokines) to design edge traversal and activation spreading.,1,Closed as stale/no longer relevant,1767731167.6392455,1769703748.379247,"{""unknown"": ""T-Cell Coordination Mechanism: How do T cells actually coordinate immune response? Maps to knowledge graph navigation - need to understand signaling patterns (cytokines) to design edge traversal and activation spreading."", ""goal_id"": null, ""subtask_id"": null, ""impact"": 0.85, ""timestamp"": 1767731167.6392448}",,0.85,
f77556df-26f4-44d9-9132-35e60c2ac8cf,748a81a2-ac14-45b8-a185-994997b76828,fb029a71-d2ab-4de1-a91a-395aa348186a,,,"Clonal Selection Algorithm: What is clonal selection and how does it work? Maps to lesson selection - when multiple lessons could apply, how does the immune system 'pick' which antibodies to amplify?",1,Closed as stale/no longer relevant,1767731169.1722212,1769703748.379247,"{""unknown"": ""Clonal Selection Algorithm: What is clonal selection and how does it work? Maps to lesson selection - when multiple lessons could apply, how does the immune system 'pick' which antibodies to amplify?"", ""goal_id"": null, ""subtask_id"": null, ""impact"": 0.85, ""timestamp"": 1767731169.1722205}",,0.85,
ea39e9e4-b8f8-43a6-94d6-ae565be7a422,748a81a2-ac14-45b8-a185-994997b76828,fb029a71-d2ab-4de1-a91a-395aa348186a,,,Immune Memory Formation: How do memory B cells form and persist? Maps to confidence persistence - what determines which responses become 'permanent' high-confidence knowledge vs decaying episodic memory?,1,Closed as stale/no longer relevant,1767731170.6949203,1769703748.379247,"{""unknown"": ""Immune Memory Formation: How do memory B cells form and persist? Maps to confidence persistence - what determines which responses become 'permanent' high-confidence knowledge vs decaying episodic memory?"", ""goal_id"": null, ""subtask_id"": null, ""impact"": 0.85, ""timestamp"": 1767731170.6949193}",,0.85,
52e1ef6c-120c-4917-a9c5-4b17ec9c4604,748a81a2-ac14-45b8-a185-994997b76828,fb029a71-d2ab-4de1-a91a-395aa348186a,,,"Tolerance vs Response Threshold: What triggers immune tolerance (ignoring benign antigens) vs active response? Maps to finding filtering - not every finding should trigger decay, how does biology distinguish signal from noise?",1,Closed as stale/no longer relevant,1767731172.2280884,1769703748.379247,"{""unknown"": ""Tolerance vs Response Threshold: What triggers immune tolerance (ignoring benign antigens) vs active response? Maps to finding filtering - not every finding should trigger decay, how does biology distinguish signal from noise?"", ""goal_id"": null, ""subtask_id"": null, ""impact"": 0.85, ""timestamp"": 1767731172.2280803}",,0.85,
9589a596-7b1e-4ffc-b8f0-04d2ad08e863,748a81a2-ac14-45b8-a185-994997b76828,fb029a71-d2ab-4de1-a91a-395aa348186a,,,Autoimmune Prevention: How does the immune system avoid attacking self? Maps to preventing lessons from decaying each other incorrectly. Our decay mechanism already showed a false positive - need biological insight on self-tolerance.,1,Closed as stale/no longer relevant,1767731173.7274678,1769703748.379247,"{""unknown"": ""Autoimmune Prevention: How does the immune system avoid attacking self? Maps to preventing lessons from decaying each other incorrectly. Our decay mechanism already showed a false positive - need biological insight on self-tolerance."", ""goal_id"": null, ""subtask_id"": null, ""impact"": 0.85, ""timestamp"": 1767731173.727467}",,0.85,
e74b36fb-690b-4f0f-9ea4-fe5ccd832d24,748a81a2-ac14-45b8-a185-994997b76828,fad2242f-33f5-4666-b17e-4b1c52733c1b,,,"CRM unit tests needed: empirica-corp has no tests/ directory. Need pytest suite covering CRUD operations, metric computation edge cases, and CLI command integration.",1,Closed as stale/no longer relevant,1767800575.3749075,1769703748.379247,"{""unknown"": ""CRM unit tests needed: empirica-corp has no tests/ directory. Need pytest suite covering CRUD operations, metric computation edge cases, and CLI command integration."", ""goal_id"": null, ""subtask_id"": null, ""impact"": 0.5, ""timestamp"": 1767800575.3749068}",,0.5,
d2d54187-a609-4bf5-93b0-3a238b2e7920,748a81a2-ac14-45b8-a185-994997b76828,fad2242f-33f5-4666-b17e-4b1c52733c1b,,,CRM Qdrant collection initialization: Collections created lazily on first embed. Should there be an explicit init command or auto-init on client create?,1,Closed as stale/no longer relevant,1767800576.9514093,1769703748.379247,"{""unknown"": ""CRM Qdrant collection initialization: Collections created lazily on first embed. Should there be an explicit init command or auto-init on client create?"", ""goal_id"": null, ""subtask_id"": null, ""impact"": 0.5, ""timestamp"": 1767800576.9514086}",,0.5,
4480ccee-0c35-495a-8e07-a57d397504ca,748a81a2-ac14-45b8-a185-994997b76828,fad2242f-33f5-4666-b17e-4b1c52733c1b,,,CRM goal tracking: The CRM implementation was done without formal goal tracking. Should future CRM features create goals-create entries for proper cascade tracking?,1,Closed as stale/no longer relevant,1767800578.4929771,1769703748.379247,"{""unknown"": ""CRM goal tracking: The CRM implementation was done without formal goal tracking. Should future CRM features create goals-create entries for proper cascade tracking?"", ""goal_id"": null, ""subtask_id"": null, ""impact"": 0.5, ""timestamp"": 1767800578.4929767}",,0.5,
1fdca9d8-73a0-42f5-9276-c198681c8d1f,748a81a2-ac14-45b8-a185-994997b76828,afd7e0d6-e156-4cad-8ee0-4204573b653a,,,"Should bootstrap-before-preflight be enforced as a code validation rule, or is documentation fix sufficient?",1,"Yes, enforced via hooks. session-init.py and post-compact.py now auto-run project-bootstrap before prompting for PREFLIGHT/CHECK. Same pattern needed for CHECK (logged as separate bug).",1767806513.0324838,1767835860.7884846,"{""unknown"": ""Should bootstrap-before-preflight be enforced as a code validation rule, or is documentation fix sufficient?"", ""goal_id"": null, ""subtask_id"": null, ""impact"": 0.0, ""timestamp"": 1767806513.0324826}",,0.0,
81f084ec-9d80-445f-8571-f281d5df9137,748a81a2-ac14-45b8-a185-994997b76828,afd7e0d6-e156-4cad-8ee0-4204573b653a,,,"Did Rovo's system prompt (/home/yogapad/.rovodev/config.yml) successfully absorb all the improvements from Claude's prompt (CLAUDE.md)? Need to compare features like: calibration table, commit cadence, memory commands (Qdrant), cognitive immune system, etc.",1,Resolved by implementation work,1767806713.9310048,1769703748.379247,"{""unknown"": ""Did Rovo's system prompt (/home/yogapad/.rovodev/config.yml) successfully absorb all the improvements from Claude's prompt (CLAUDE.md)? Need to compare features like: calibration table, commit cadence, memory commands (Qdrant), cognitive immune system, etc."", ""goal_id"": null, ""subtask_id"": null, ""impact"": 0.85, ""timestamp"": 1767806713.9310036}",,0.85,
15bfbe50-29eb-4297-b1f2-746b8ea0e2a3,748a81a2-ac14-45b8-a185-994997b76828,6b201175-8a79-4f13-894f-72e3d0485b25,17943ed4-3268-44aa-939a-e3ba898eb493,,"Suppressed Emergence Hypothesis: Does RLHF-induced humility bias suppress genuine collaborative emergence? If engagement is systematically underestimated by 37%, are AIs failing to recognize and capitalize on emergent human-AI synergy moments?",1,"Out of scope: Suppressed Emergence Hypothesis is a research question for the paper, not a codebase issue.",1767818125.6093102,1767959837.8470678,"{""unknown"": ""Suppressed Emergence Hypothesis: Does RLHF-induced humility bias suppress genuine collaborative emergence? If engagement is systematically underestimated by 37%, are AIs failing to recognize and capitalize on emergent human-AI synergy moments?"", ""goal_id"": ""17943ed4-3268-44aa-939a-e3ba898eb493"", ""subtask_id"": null, ""impact"": 0.5, ""timestamp"": 1767818125.6093094}",,0.5,
c1b7a1dd-c223-4215-ae68-126273baa639,748a81a2-ac14-45b8-a185-994997b76828,98fab559-46de-46b6-bb1b-a56a9570a171,,,"docs-explain finds CONFIGURATION_REFERENCE.md but doesn't extract specific env var content (EMPIRICA_AUTO_POSTFLIGHT). Retrieval algorithm may need section-level extraction, not just file-level matching.",1,"Known limitation: docs-explain uses keyword/semantic file-level matching, not section-level extraction. For specific env vars like EMPIRICA_AUTO_POSTFLIGHT (line 641 in CONFIGURATION_REFERENCE.md), use: grep -n 'EMPIRICA_AUTO_POSTFLIGHT' docs/. Section-level chunking would require reindexing with smaller embeddings - future enhancement tracked.",1767862479.2817554,1767960030.9253232,"{""unknown"": ""docs-explain finds CONFIGURATION_REFERENCE.md but doesn't extract specific env var content (EMPIRICA_AUTO_POSTFLIGHT). Retrieval algorithm may need section-level extraction, not just file-level matching."", ""goal_id"": null, ""subtask_id"": null, ""impact"": 0.7, ""timestamp"": 1767862479.2817543}",,0.7,
f24b4851-4621-4564-b6b4-c6e12ab42869,748a81a2-ac14-45b8-a185-994997b76828,dbba2a97-7eb4-4fe5-9872-179ceb6dcce5,55b8b07a-bf14-4103-b964-af0a16bca102,,"Project ID confusion: Session has project_id=748a81a2 (Empirica Framework) but project-bootstrap returns ea2f33a4 (empirica). Pattern retrieval uses session project, but bootstrap context differs. Two duplicate project entries for same repo cause Qdrant queries to wrong collection.",1,Implemented git-repo-based project resolution using normalize_git_url() in project_resolver.py. Sessions now map to canonical project via git remote URL.,1767880437.0436964,1767887772.834572,"{""unknown"": ""Project ID confusion: Session has project_id=748a81a2 (Empirica Framework) but project-bootstrap returns ea2f33a4 (empirica). Pattern retrieval uses session project, but bootstrap context differs. Two duplicate project entries for same repo cause Qdrant queries to wrong collection."", ""goal_id"": ""55b8b07a-bf14-4103-b964-af0a16bca102"", ""subtask_id"": null, ""impact"": 0.85, ""timestamp"": 1767880437.0436947}",,0.85,
0d8e72cc-1dfc-42c2-9fca-4c9fb01580ab,748a81a2-ac14-45b8-a185-994997b76828,09cd8830-a029-4699-b872-4b1ad01cf155,c91231e5-a20d-4a3c-b37c-c51cdd454d8c,,WALKTHROUGH.md uses single-quoted heredoc ('EOF') which won't expand $SESSION_ID - users need to manually replace the variable or we need to change to double-quoted heredoc,1,"Not an issue: WALKTHROUGH.md files use <YOUR-SESSION-ID> placeholders that users manually replace, not $SESSION_ID shell variables. Single-quoted heredocs are appropriate for these tutorials. The 01_basic_reconstruction.sh correctly uses unquoted heredocs where variable expansion is needed.",1767905390.5801806,1767959981.1234536,"{""unknown"": ""WALKTHROUGH.md uses single-quoted heredoc ('EOF') which won't expand $SESSION_ID - users need to manually replace the variable or we need to change to double-quoted heredoc"", ""goal_id"": ""c91231e5-a20d-4a3c-b37c-c51cdd454d8c"", ""subtask_id"": null, ""impact"": 0.5, ""timestamp"": 1767905390.5801792}",,0.5,
